"subreddit","body","stickied","gilded","score","author","link_id","subreddit_id","retrieved_on","author_flair_css_class","author_flair_text","controversiality","created_utc","distinguished","parent_id","edited","id"
"politics","U6 has fallen to just 9.2%, from a recession peak of 17.1%.","False","0","399","AtomicKoala","t3_5mdmbw","t5_2cneq","1485826004","null","null","0","1483712526","null","t1_dc2qm99","False","dc2qt49"
"politics","The 2009 Democratic trifecta put in place a highly effective stimulus, Obama has, since 2010, spent his time trying to protect a bunch of things from the GOP.","False","0","9","AtomicKoala","t3_5mdmbw","t5_2cneq","1485826024","null","null","0","1483712595","null","t1_dc2q491","False","dc2qunt"
"politics","Obama has done too little if anything, I'm not complaining about that.  I'm complaining about your ridiculously high carbon emissions per capita, and how you've elected a climate denier obsessed with nukes.","False","0","2","AtomicKoala","t3_5mapp7","t5_2cneq","1485826064","null","null","0","1483712721","null","t1_dc2qoa2","False","dc2qxlm"
"politics","70% of people indicated they were fine with this.  Of those who voted, the GOP got a federal House plurality of 49%.  Most Americans just aren't good people right now, I guess. You need to find a way to help them find their way back from this dark path.","False","0","6","AtomicKoala","t3_5mdqs8","t5_2cneq","1485826193","null","null","0","1483713132","null","t1_dc2qvxy","False","dc2r78t"
"politics","Makes me wonder if Sen Gillibrand isn't actually a fool and is opposing Mattis seeing as Trump hates Democrats like her. If every Democrat was for him he'd probably change his mind.","False","0","29","AtomicKoala","t3_5mdak7","t5_2cneq","1485826257","null","null","0","1483713329","null","t1_dc2pjm6","False","dc2rc1s"
"politics","Eh, that was a national strategy. I'm talking about on a state by state basis.  Or are you telling me Berniecrats wouldn't vote for a conservative Dem over the GOP in Tennessee out of spite..?","False","0","1","AtomicKoala","t3_5m8mrm","t5_2cneq","1485826315","null","null","0","1483713506","null","t1_dc2rde7","False","dc2rgd1"
"politics","It's a huge difference. How little do you know about Europe? Yugoslavia was closer to the West than to the USSR.","False","0","1","AtomicKoala","t3_5mapp7","t5_2cneq","1485826328","null","null","0","1483713549","null","t1_dc2r6it","False","dc2rhdz"
"politics","U3 is the official unemployment rate. U5 includes discouraged workers and all other marginally attached workers. U6 adds on those workers who are part-time purely for economic reasons.  So U5 might be more accurate for what they are asking, but U3 and U6 are what people usually use.","False","0","24","AtomicKoala","t3_5mdmbw","t5_2cneq","1485826897","null","null","0","1483715228","null","t1_dc2s7pd","False","dc2snt5"
"politics","Indeed, China and us Europe are investing heavily in nuclear, renewables and public transport, despite our emissions per capita being lower. Americans should be disgusted with themselves, outside places like California.","False","0","2","AtomicKoala","t3_5mapp7","t5_2cneq","1485826945","null","null","0","1483715361","null","t1_dc2sn4i","False","dc2srcq"
"politics","We spend about half as much on healthcare than the US, it's a bit of a chronic problem tbh. We need way more consultants and a fair few more beds (although as much as our lack of beds is frustrating, it is good at encouraging us to keep patients out of hospital, with more beds we'd probably get more lax).  See, this is what Sander's plan also assumed - massive spending cuts on healthcare. I do think that hefty cuts were reasonable - perhaps 1-2% of GDP thanks to reduced admin overhead and more effective negotiating, but I don't think it possible to reduce costs down to European or even Canadian levels.  Of course, this is all hypothetical. Sanders would never have had a centrist Congressional majority, nevermind a centre-left one. ","False","0","1","AtomicKoala","t3_5mcuyc","t5_2cneq","1485827110","null","null","0","1483715815","null","t1_dc2sxsc","False","dc2t3ft"
"politics","Here in Ireland we have a mixed public/private system. Public expenditure is about 70% of total health spending, but there's a lot of supplemental private spending. About 40% of people have supplemental health insurance, and for those without medical cards, you have to pay for GP visits, A&E use, prescriptions (up to a capped amount), etc.   I don't really know of any European country with a single payer model using private provision, Canada is what springs to mind. Europe uses either a Bismarckian model (ie insurance based), or publicly owned and run health systems.","False","0","1","AtomicKoala","t3_5mcuyc","t5_2cneq","1485828109","null","null","0","1483718431","null","t1_dc2tutz","False","dc2v612"
"politics","You got fuckloads of change. What on earth did you expect?   >Millenias are done with voting for lesser of two evils thst seems obvious and why me and so many of my liberal friends voted trump.   And what about the rest of the world? ","False","0","16","AtomicKoala","t3_5mcuyc","t5_2cneq","1485828305","null","null","0","1483718921","null","t1_dc2vg53","False","dc2vkqe"
"politics","Democrats are not a left wing party. You live in a right wing country, start being pragmatic and work with the sole party that believes in science and economics instead of holding out for a pipe dream.   You're not getting a public healthcare system. You can expand single payer or create a true Bismarckian system. But you're not going to nationalise thousands of hospitals.","False","0","1","AtomicKoala","t3_5mcuyc","t5_2cneq","1485828565","null","null","0","1483719553","null","t1_dc2vyfc","1483719739","dc2w458"
"politics","Why are Americans so obsessed with needing a great leader? Just do the right thing... ","False","0","2","AtomicKoala","t3_5mdqs8","t5_2cneq","1485828656","null","null","0","1483719778","null","t1_dc2vsi0","False","dc2wb2b"
"politics","> Is the ultimate goal a fully socialized healthcare system? Yes, it is.  But what would be wrong with medicare for all? I get that there would be profit for private hospitals, but at least it is possible. A public system really isn't, is it?","False","0","1","AtomicKoala","t3_5mcuyc","t5_2cneq","1485829015","null","null","0","1483720637","null","t1_dc2wlof","False","dc2x1w5"
"politics","The stimulus was very well designed and helped virtually every American. The bailout was more than paid back.   What's wrong with free trade deals? Liberal parties have always supported free trade. ","False","0","14","AtomicKoala","t3_5mcuyc","t5_2cneq","1485829035","null","null","0","1483720685","null","t1_dc2wdtr","False","dc2x3dj"
"politics","This isn't a bad thing. Americans are too focused on buying property (much like us Irish and the Brits).","False","0","0","AtomicKoala","t3_5mddur","t5_2cneq","1485829218","null","null","0","1483721105","null","t1_dc2pdwh","False","dc2xgp8"
"politics",">Free trade is great when the other country has enviorment and labor on part with yours  So you support the TTIP?","False","0","1","AtomicKoala","t3_5mcuyc","t5_2cneq","1485829476","null","null","0","1483721711","null","t1_dc2xhzp","False","dc2xzxb"
"politics","U3 is the official unemployment rate. U5 includes discouraged workers and all other marginally attached workers. U6 adds on those workers who are part-time purely for economic reasons.  ","False","0","2","AtomicKoala","t3_5mdmbw","t5_2cneq","1485829494","null","null","0","1483721750","null","t1_dc2xhs0","False","dc2y182"
"politics","These people need to see this: https://ourworldindata.org/grapher/world-population-in-extreme-poverty-absolute.png","False","0","8","AtomicKoala","t3_5mcuyc","t5_2cneq","1485829567","null","null","0","1483721920","null","t1_dc2xn59","False","dc2y6ll"
"politics","Could you elaborate?","False","0","1","AtomicKoala","t3_5mcuyc","t5_2cneq","1485829651","null","null","0","1483722119","null","t1_dc2y8hj","False","dc2ycy8"
"politics","God bless Truman, Eisenhower and Kennedy I suppose.","False","0","2","AtomicKoala","t3_5mcuyc","t5_2cneq","1485829699","null","null","0","1483722233","null","t1_dc2y9wh","False","dc2ygio"
"politics","Not for 90% of countries.  *U3* in Europe is over 8% alone.","False","0","12","AtomicKoala","t3_5mdmbw","t5_2cneq","1485830424","null","null","0","1483723904","null","t1_dc2zgks","False","dc2zyfm"
"politics","No, because Americans are not a sensible bunch of people. ","False","0","3","AtomicKoala","t3_5mcuyc","t5_2cneq","1485833316","null","null","0","1483730463","null","t1_dc32vsr","False","dc35xsk"
"politics","I'm European.  We aren't scared of trade, unlike you Americans.","False","0","3","AtomicKoala","t3_5mcuyc","t5_2cneq","1485833347","null","null","0","1483730534","null","t1_dc32t48","False","dc3603z"
"politics","Worst economic crisis since the Great Depression.","False","0","1","AtomicKoala","t3_5mdmbw","t5_2cneq","1485833364","null","null","0","1483730572","null","t1_dc32o4k","False","dc361d6"
"politics","Eh?","False","0","0","AtomicKoala","t3_5mcuyc","t5_2cneq","1485837770","null","null","0","1483740774","null","t1_dc36f29","False","dc3f6li"
"politics","Not really though. It was a sociological term, little to do with race.","False","0","8","AtomicKoala","t3_5mevqm","t5_2cneq","1485839107","null","null","0","1483744214","null","t1_dc3az8n","False","dc3hybd"
"politics","Their standard of living has gone down because they supported GOP tax cuts.","False","0","1","AtomicKoala","t3_5mcuyc","t5_2cneq","1485840198","null","null","0","1483747153","null","t1_dc3ioqp","False","dc3k7rh"
"politics","It includes discouraged workers, or rather it includes U5 which includes that.","False","0","1","AtomicKoala","t3_5mdmbw","t5_2cneq","1485840604","null","null","0","1483748288","null","t1_dc3kw8x","False","dc3l23j"
"politics","American cable news is pathetic. At least your newspapers are okay.","False","0","3","AtomicKoala","t3_5mf481","t5_2cneq","1485840691","null","null","0","1483748534","null","t1_dc3ela5","False","dc3l8lc"
"politics","A greater proportion of boombers voted Democrat than millennials.  Millennials don't vote.","False","0","1","AtomicKoala","t3_5metmc","t5_2cneq","1485840759","null","null","0","1483748722","null","t1_dc32qwr","False","dc3ldp3"
"politics","Look, it's your Founding Fathers who created this terrible system in every state and at the federal level. They could have created a constitutional monarchy with a parliamentary system.  No large Presidential democracy bar America managed to maintain stability for more than a few decades. Maybe Mexico comes the closest.","False","0","1","AtomicKoala","t3_5me3ek","t5_2cneq","1485840936","null","null","0","1483749231","null","t1_dc3df8h","False","dc3lr0z"
"politics","The rust belt is probably the most dependent on those trade policies. Imagine the state of US manufacturing if it remained as sheltered as it was. Even today, you won't see American cars in Europe. They're largely shit.","False","0","2","AtomicKoala","t3_5mdedn","t5_2cneq","1485841044","null","null","0","1483749541","null","t1_dc2z966","False","dc3lz31"
"politics","In all fairness he was hobbled by Kennedy, who betrayed the party with some Jill Stein-esque logic.","False","0","1","AtomicKoala","t3_5mdedn","t5_2cneq","1485841069","null","null","0","1483749611","null","t1_dc33pg4","False","dc3m0yd"
"politics","Depends if the leftwing of the party realises that only a 25% identify as liberal, and 35% as conservative, and run appropriate candidates. And drop stuff like gun control and stop talking about abortion etc.  But they wont, and millennials will be too busy watching netflix, and the world will pay the price of the irresponsible US electorate. ","False","0","2","AtomicKoala","t3_5mfexv","t5_2cneq","1485841233","null","null","0","1483750081","null","t1_dc3km4c","1483788675","dc3md88"
"politics","If Democrats get their heads out of their asses and support and vote for a conservative Dem, maybe?  Of course a bunch of organisations will freak out, and there'll be the cries from progressives etc, but too much is at stake, Dems need to fall in line.","False","0","1","AtomicKoala","t3_5mfexv","t5_2cneq","1485841269","null","null","0","1483750189","null","t1_dc35mcv","False","dc3mfwu"
"politics","Get involved for 2018 if you can. Tennessee is the Democrat's 4th best Senate seat pickup opportunity in 2018. He'll likely capitulate soon enough.","False","0","2","AtomicKoala","t3_5mfexv","t5_2cneq","1485841284","null","null","0","1483750232","null","t1_dc38zc9","False","dc3mh1i"
"politics","Sorry, I meant 35% conservative! Things aren't that bad...","False","0","1","AtomicKoala","t3_5mfexv","t5_2cneq","1485850428","null","null","0","1483788537","null","t1_dc3zv89","False","dc45hmh"
"politics","In what works was she conservative? Fiscally conservative maybe, but she was pushing tax rises.   How did the DNC hold him back?","False","0","1","AtomicKoala","t3_5mfexv","t5_2cneq","1485850432","null","null","0","1483788571","null","t1_dc3uka8","False","dc45hzt"
"politics","Why do you say that?","False","0","1","AtomicKoala","t3_5mcuyc","t5_2cneq","1485850442","null","null","0","1483788631","null","t1_dc3n7xk","False","dc45inb"
"politics","Try posting anything about big oil funding climate change denial, they don't like that conspiracy either.","False","0","65","AtomicKoala","t3_5mhrtt","t5_2cneq","1485850610","null","null","0","1483789842","null","t1_dc3yszr","False","dc45v6g"
"politics","Maybe Trump should do something about his being a terrible person then?","False","0","-1","AtomicKoala","t3_5mhrtt","t5_2cneq","1485850688","null","null","0","1483790373","null","t1_dc43xwo","False","dc460uz"
"politics","What's the alternative to drone strikes? SF? What's your point here? ","False","0","3","AtomicKoala","t3_5mho2o","t5_2cneq","1485850818","null","null","0","1483791274","null","t1_dc435vb","False","dc46am1"
"politics","That's true. The overhead of American private insurance is huge. Proper Bismarckian systems seem to have much less overhead.   Obviously a public system would have the least overhead (eg the NHS), but single payer would reduce it substantially, seeing as how the ACA's attempt at a Bismarckian system failed.","False","0","2","AtomicKoala","t3_5mih92","t5_2cneq","1485850859","null","null","0","1483791554","null","t1_dc3wpr4","False","dc46doj"
"politics","Well yeah, there's stuff going on in NC etc, but I imagine most state legislatures are doing nothing right now. Why don't you find something to post?  Obviously the election of the most extreme freely elected national leader the West has seen since WWII will remain a big story, so long as he fails to pivot.","False","0","1","AtomicKoala","t3_5mhrtt","t5_2cneq","1485851043","null","null","0","1483792758","null","t1_dc46p79","False","dc46rib"
"politics",">Most extreme freely elected national leader since WWII!???   I'm also European mate - can you point to someone more extreme than Trump that we have freely elected?  >You've been reading fake news as I've heard it called.   Maybe Trump should be more careful with his words, given he has called for killing the families of terrorists, which would require assassinating thousands of us Europeans.","False","0","1","AtomicKoala","t3_5mhrtt","t5_2cneq","1485853957","null","null","0","1483805572","null","t1_dc47a0p","False","dc4cscr"
"politics","No I think that, because I expect him to renege on a lot of his plans.  Again, can you point to a more extreme leader in the West?","False","0","1","AtomicKoala","t3_5mhrtt","t5_2cneq","1485855041","null","null","0","1483808930","null","t1_dc4dbpm","False","dc4f0w6"
"politics","So you only have Silvio from the West, a centre right politician whose racism was more casual than malicious, who didn't promote torture, obsess about nuclear weapons, talk about abandoning allies etc.","False","0","1","AtomicKoala","t3_5mhrtt","t5_2cneq","1485855372","null","null","0","1483809916","null","t1_dc4faj4","False","dc4fpoh"
"politics","That's not what rigging is at all. Come to Europe if you want to see actual political party shenanigans.    And I'm sure the other issues taking care of themselves is of great comfort to those affected.  What's wrong with wanting to balance the budget by raising taxes as she planned?","False","0","1","AtomicKoala","t3_5mfexv","t5_2cneq","1485858607","null","null","0","1483818552","null","t1_dc4j5d0","False","dc4m1c0"
"politics","I'm focusing on the west, because the West is a set of well established liberal democracies.  Answer the question.","False","0","1","AtomicKoala","t3_5mhrtt","t5_2cneq","1485858648","null","null","0","1483818664","null","t1_dc4fy2o","False","dc4m4df"
"politics","Most Democrat voters do support free trade at least.","False","0","1","AtomicKoala","t3_5mjx52","t5_2cneq","1485858759","null","null","0","1483818983","null","t1_dc49xa0","False","dc4mcr4"
"politics","Russia is in opposition to Western culture. They are incredibly hostile to ex-socialist countries identifying as Western.  What are you on about? It's Democrats who are trying to protect enlightenment values.","False","0","6","AtomicKoala","t3_5mjx52","t5_2cneq","1485858820","null","null","0","1483819161","null","t1_dc4e11h","False","dc4mhb1"
"politics","American cable news is dire. From my European perspective the emails were boring. A few interesting things, but nothing shocking for the inner workings of a political campaign.  Yet cable news managed to turn them into something. ","False","0","2","AtomicKoala","t3_5ml260","t5_2cneq","1485860281","null","null","0","1483823372","null","t1_dc4jxyj","False","dc4pimv"
"politics","CIA does what the admin asks it to do. Morality was not easy during the Cold War. They largely did what they had to here in Europe. You can criticise them covertly funding parties, supporting federalists etc, but the it's likely that the likes of Italy would've ended up communist, and the EU would not exist if not for US interference. What Truman and Eisenhower did helped us, it did not make our countries worse, rather it made us richer and fairer, and preserved peace.","False","0","4","AtomicKoala","t3_5ml8sg","t5_2cneq","1485860647","null","null","0","1483824414","null","t1_dc4n7wn","False","dc4q9zi"
"politics","How? Because he was weak on Russia and the GOP? I don't see how a Trump admin would be up in that case...","False","0","6","AtomicKoala","t3_5ml8sg","t5_2cneq","1485860670","null","null","0","1483824475","null","t1_dc4posj","False","dc4qblf"
"politics","Breitbart and Russia are.  Germany is safe. France though? The fact they elect a semi-executive President changes things.  It's a three way race now that Macron has started to benefit from Fillon actually not being a great campaigner and an arch-conservative of the Thatcherite bent. Russia seems to be leaning a bit toward Fillon who has been worryingly Russophilic.  Even if Le Pen loses to Fillon, Russia is in a better situation than  before with Hollande - a man who was willing to stand up for Western values and interests, who was willing to use military force to do so.  Macron, well, he's the Blairite candidate. He supported Hollande's liberal reforms, but he's the most leftwing by far of the three. I bet Russia is going to work as hard as possible to sink him.","False","0","2","AtomicKoala","t3_5mle5b","t5_2cneq","1485860877","null","null","0","1483825048","null","t1_dc4f677","False","dc4qr7a"
"politics","Pretty much. The ACA is close to being a Bismarckian system except for a lack of price controls. In CH which is perhaps the most similar system to the US, the government has enacted Medicare-style price controls for hospital and physician reimbursement. Insurers must charge similar rates to the young and old (“community rating”), must cover pre-existing conditions, and must operate as non-profit entities. Princeton economist Uwe Reinhardt describes Switzerland as “a de facto cartel of insurers and health care practitioners who transact with one another in a tight web of government regulations.” (http://www.forbes.com/sites/theapothecary/2011/04/29/why-switzerland-has-the-worlds-best-health-care-system/#ae0cfc418afd)  Price controls are however, the devil. They would force hospitals to rationalise operations however. The US has the most MRI machines per capita, yet lower life expectancies than unhealthier places like Wallonia.   To be honest I don't see how this can be fixed in the US. Won't the GOP filibuster any new system?   Democrats probably need to give up on a federal system and work at the state level.","False","0","8","AtomicKoala","t3_5ml6ne","t5_2cneq","1485861025","null","null","0","1483825444","null","t1_dc4d418","False","dc4r28m"
"politics","3/10","False","0","2","AtomicKoala","t3_5mmkoj","t5_2cneq","1485861374","null","null","0","1483826348","null","t1_dc4r25x","False","dc4rsca"
"politics","See what should happen is comprehensive regularisation for those who can prove their origin etc. I wouldn't support a pathway to citizenship personally, but these people are nearly all from culturally western countries, deporting them would badly damage the economy, given unemployment is just 4.6%.  It's long been time to end the profiting from cheap, precarious labour. Fine employers who fail to notify they have hired illegal immigrants. Offer amnesty for longer term stayers if they fulfill a bunch of conditions.   There's probably no need to offer incentives for self-deportation, many probably will lose jobs and leave of their own accord if having to pay them minimum wage makes their labour less preferable to automation.","False","0","0","AtomicKoala","t3_5mmyaw","t5_2cneq","1485861469","null","null","0","1483826593","null","t1_dc4qu21","False","dc4rzg6"
"politics","Here in western Europe it's basically other Europeans from ex-socialist states who end up doing a lot of that stuff. Obviously they're legal as they're citizens, but it's an interesting dynamic, they tend to be more likely to take up jobs that resident nationals wouldn't for the same wage.","False","0","6","AtomicKoala","t3_5mmyaw","t5_2cneq","1485861524","null","null","0","1483826734","null","t1_dc4r3gc","False","dc4s3ie"
"politics","Texas has to be targeted in 2018. Democrats can't be seen as the party of illegals, but being perceived as reasonable on this front could help them.","False","0","4","AtomicKoala","t3_5mmyaw","t5_2cneq","1485861543","null","null","0","1483826782","null","t1_dc4r4qf","False","dc4s4x4"
"politics","Mattis looks solid.","False","0","4","AtomicKoala","t3_5mmktr","t5_2cneq","1485861627","null","null","0","1483827002","null","t1_dc4reei","False","dc4sb75"
"politics","heh, I missed your sarcasm.","False","0","5","AtomicKoala","t3_5ml8sg","t5_2cneq","1485861663","null","null","0","1483827089","null","t1_dc4sajm","False","dc4sdxs"
"politics","Actually Sweden shouldn't be able to extradite him to the US given their laws which prevent political extraditions.  If he knew the case was unprovable the smart move would be to go to Sweden as the UK could actually extradite him to the US.  Of course for someone like Assange, there is the risk of intelligence agencies falsifying a case against him for the greater good or whatever, so I can empathise with him.","False","0","1","AtomicKoala","t3_5mkaj1","t5_2cneq","1485861692","null","null","0","1483827163","null","t1_dc48xjm","False","dc4sg2j"
"politics","Eh, I'd be wary of false equivalencies.  Mind you, Kelly actually seems like a conservative, as opposed to the far right reactionaries that have taken over the GOP.","False","0","1","AtomicKoala","t3_5mkaj1","t5_2cneq","1485861759","null","null","0","1483827339","null","t1_dc4kidu","False","dc4sl3d"
"politics","Well I was talking about Tennessee, so why am I wrong about there?","False","0","1","AtomicKoala","t3_5mfexv","t5_2cneq","1485865023","null","null","0","1483836313","null","t1_dc4wr1i","False","dc4zcnm"
"politics","No experience though. She wasn't a Senator for example.","False","0","1","AtomicKoala","t3_5mmktr","t5_2cneq","1485865037","null","null","0","1483836353","null","t1_dc4uuvk","False","dc4zdqh"
"politics","I hate what this election has done to sarcasm.","False","0","3","AtomicKoala","t3_5ml8sg","t5_2cneq","1485865045","null","null","0","1483836379","null","t1_dc4vwsu","False","dc4zeeu"
"politics","Eh, it's a different dynamic in reality though. Illegals have to hide from society to avoid deportation, these people are all legal and integrate relatively quickly (bar gypsies who come to steal/beg instead of finding a job).","False","0","1","AtomicKoala","t3_5mmyaw","t5_2cneq","1485865092","null","null","0","1483836498","null","t1_dc4tjpw","False","dc4zhp3"
"politics","In all fairness that constitutional amendment did not seem well crafted, I wouldn't be too quick to blame corporate megadonors.  Fact is, America is a right wing country. Colorado certainly isn't a left wing state. Look even at Washington, which failed to pass a revenue neutral carbon tax. ","False","0","4","AtomicKoala","t3_5ml6ne","t5_2cneq","1485865123","null","null","0","1483836578","null","t1_dc4uua3","False","dc4zjz5"
"politics","Eh, the New Deal and Great Society were made possible by transient centre-left majorities. You had the conservative coalition holding power most of the time.  It's only since the 80s that the Democratic party has moved left. Unfortunately that has forced most conservatives into the GOP, where they are being radicalised and are losing touch with reality.","False","0","3","AtomicKoala","t3_5ml6ne","t5_2cneq","1485868707","null","null","0","1483846505","null","t1_dc538r1","False","dc56ze1"
"politics","Blaming education is what the GOP wants.  The problem is not education, but far right radicalisation.","False","0","11","AtomicKoala","t3_5mnl6g","t5_2cneq","1485868774","null","null","0","1483846679","null","t1_dc50jjc","False","dc574eq"
