"subreddit","body","stickied","gilded","score","author","link_id","subreddit_id","retrieved_on","author_flair_css_class","author_flair_text","controversiality","created_utc","distinguished","parent_id","edited","id"
"politics","Why does it? Canada implemented universal healthcare province by province. I'm personally a big believer in the principle of subsidiarity.","False","0","2","AtomicKoala","t3_5nwzvd","t5_2cneq","1486045297","null","null","0","1484414074","null","t1_dcf6wjd","False","dcf74tn"
"politics","Balanced budget amendments are illogical. You need counter-cyclical policy. The US should be run based on 10-20 year budget projections, with provision for an ageing population and downturns.","False","0","7","AtomicKoala","t3_5nwzvd","t5_2cneq","1486045352","null","null","0","1484414225","null","t1_dcf76uu","False","dcf78pi"
"politics","I assume that they're also one of these people freaking out about Islamic terrorism, how dare Obama work to deal with that at the request of other governments! The nerve.","False","0","13","AtomicKoala","t3_5nxn5j","t5_2cneq","1486045392","null","null","0","1484414337","null","t1_dcf797p","False","dcf7bnn"
"politics","I don't know if you've noticed but most eligible voters don't vote for that. Maybe in NY or Maryland, but in Florida? Michigan? Texas?","False","0","3","AtomicKoala","t3_5nxqab","t5_2cneq","1486046050","null","null","0","1484416162","null","t1_dcf7mz7","False","dcf8nwr"
"politics","I mentioned that in another comment. As the Bernie or Bust types point out, Democrats are highly likely not vote for the national candidate if they don't like their policies.   As I said in the comment you replied to:  >Democrats have a huge problem falling in line, easy to see Bloomberg fucking everything up unless Sanders changed his stances to appeal to moderates which are 35% of the country and a large part of the Democrat base.","False","0","1","AtomicKoala","t3_5nwzvd","t5_2cneq","1486046248","null","null","0","1484416702","null","t1_dcf8a7l","False","dcf928l"
"politics","It shows that Democrats can win these places if they make voters realise they are the party of national security and fiscal sensibility.","False","0","29","AtomicKoala","t3_5nyf2t","t5_2cneq","1486046640","null","null","0","1484417826","null","t1_dcf8qnl","False","dcf9uo8"
"politics","Haha, that's a hilarious slogan.","False","0","12","AtomicKoala","t3_5nyf2t","t5_2cneq","1486046672","null","null","0","1484417916","null","t1_dcf7jej","False","dcf9wyx"
"politics","All of Europe watched as Austria reran their presidential election over the littlest things I suppose.","False","0","19","AtomicKoala","t3_5nypzi","t5_2cneq","1486046754","null","null","0","1484418148","null","t1_dcf9xo0","False","dcfa2z8"
"politics","Well I think that's what's needed, them to enforce the law instead of deferring to the president.","False","0","-3","AtomicKoala","t3_5nxn5j","t5_2cneq","1486046927","null","null","0","1484418636","null","t1_dcfa3nn","False","dcfafni"
"politics","This will finally sink Trump's campaign. A few million in payments to people like Manafort will be of little harm to him. It's not like the people who would care didn't know about the Russian stooges in his campaign.","False","0","45","AtomicKoala","t3_5nypzi","t5_2cneq","1486046966","null","null","0","1484418742","null","t1_dcfa4op","False","dcfaidj"
"politics","Yes and climate change is a chinese hoax.","False","0","10","AtomicKoala","t3_5nypzi","t5_2cneq","1486046986","null","null","0","1484418800","null","t1_dcfaast","False","dcfajw6"
"politics","I think they're trying to, eh, Drain the Swamp.","False","0","14","AtomicKoala","t3_5nypzi","t5_2cneq","1486046996","null","null","0","1484418828","null","t1_dcfa73i","False","dcfakm4"
"politics","Democrats need to aim to win a Democratic trifecta in Georgia in 2018. They'd be incredibly stupid to ignore it. Democrats did excellent work in Georgia - even fucking Maddox played a big role in making the state have a knowledge based economy by expanding tertiary education on a grand scale. They lost their trifecta in 2002.  Now I don't think the Georgian GOP is the worst of them (but feel free to tell me otherwise, I know shit all about the politics of either Georgia), but how long can they govern the state without undoing all the previous good work?","False","0","14","AtomicKoala","t3_5nyf2t","t5_2cneq","1486047101","null","null","0","1484419116","null","t1_dcfald4","1484422454","dcfas9p"
"politics","It's a centre-right paper really, but I don't think they are working to make their fact checkers harsher, are they? Reading through the article I think their logic makes sense.","False","0","3","AtomicKoala","t3_5nx91g","t5_2cneq","1486047213","null","null","0","1484419427","null","t1_dcezm2o","False","dcfb0gb"
"politics","That's pointless unless it is ensured that he has no power.","False","0","6","AtomicKoala","t3_5nypzi","t5_2cneq","1486047347","null","null","0","1484419790","null","t1_dcfb6qa","False","dcfb9zr"
"politics","Small arms are useful for an insurgency, not replacing the government.","False","0","2","AtomicKoala","t3_5nxn5j","t5_2cneq","1486047941","null","null","0","1484421412","null","t1_dcfc9kg","False","dcfcgzb"
"politics","You forgot the GDP... the GDP is 0 right now. Zero. Ze-ee-ro.","False","0","3","AtomicKoala","t3_5nxn5j","t5_2cneq","1486047965","null","null","0","1484421477","null","t1_dcfbuub","False","dcfcioz"
"politics","Trump has already said he would order them to commit illegal acts, and they would do that even if they tried not to. He also plans to fire the generals which ties in with this.  He respects and admires dictators, and has praised Tiananmen and Saddam doing the gas.  See why you need to keep them on side and have them follow the law?","False","0","1","AtomicKoala","t3_5nxn5j","t5_2cneq","1486048027","null","null","0","1484421640","null","t1_dcfbefw","False","dcfcn58"
"politics",">Do you want the Army to NOT answer to the President?  Look, if the President is consistently disregarding the law as he has announced plans to, particularly in a manner detrimental to the continuation of electoral democracy, the military has a duty to uphold the constitution.  >Do you want the military enforcing the laws within the country?  Not directly. That's the job of the judiciary via police forces. ","False","0","1","AtomicKoala","t3_5nxn5j","t5_2cneq","1486048268","null","null","0","1484422297","null","t1_dcfcrhl","False","dcfd4ks"
"politics","Certainly changed some of my opinions. I used to be quite open to immigration from the rest of the West, but it's clear that it'd be irresponsible to somehow make it easier for Americans than, say, Tunisians to move to Europe. Tunisians certainly vote more responsibly.","False","0","3","AtomicKoala","t3_5nz13t","t5_2cneq","1486048448","null","null","0","1484422778","null","t1_dcfccbc","False","dcfdh9n"
"politics","Eh?","False","0","0","AtomicKoala","t3_5nz13t","t5_2cneq","1486048455","null","null","0","1484422800","null","t1_dcfcrn8","False","dcfdhtu"
"politics","The CDU has been quite happy getting a bunch of FTAs with other countries doing the pushing for it. Everyone associates the likes of Sweden and Denmark pushing for say, the EU-SK FTA, but who has benefited more than Germany from that? Maybe France?","False","0","2","AtomicKoala","t3_5nz13t","t5_2cneq","1486048481","null","null","0","1484422865","null","t1_dcfbnim","False","dcfdjky"
"politics","In all fairness Merkel has no experience of going against the political grain, so I have no hope in her managing to convince Trump. She's like Captain Renault in Vichy Morocco, she acts like a hostage of the electorate, blowing with the wind.","False","0","1","AtomicKoala","t3_5nz13t","t5_2cneq","1486048529","null","null","0","1484423002","null","t1_dcfbrd6","False","dcfdn3f"
"politics","> J. Edgar Hoover  There's only been 8 years of Democratic trifectas since his death I suppose. Longest stretch was under Carter, who struggled with Congress.","False","0","3","AtomicKoala","t3_5nwwhh","t5_2cneq","1486048664","null","null","0","1484423394","null","t1_dcfa8zu","False","dcfdx4h"
"politics","None of the Baltic states treated the settlers like dirt. They were all given permanent residency, and a very simple path to citizenship - learn some basics of the language, a bit of history etc, and bam, you are now a citizen.   Even if you're not a citizen you're not an illegal, you still get all the benefits an EU citizen would.  How on earth is this generous treatment of colonists oppression? They get to live in a top 40 country globally, one that is free and fair. There is a reason most decided to stay.","False","0","3","AtomicKoala","t3_5nwwhh","t5_2cneq","1486048784","null","null","0","1484423739","null","t1_dcfb66t","False","dcfe60r"
"politics","Unfortunately a lot of Russian Europeans are like this. It's a similar situation to Muslim Europeans I suppose, probably a bit worse but at least when they go nuts they don't mean to shoot down civilian airliners.  The difference is that Russian in this instance is either a nationality or ethnic background, not a strict religion, so there's hope. ","False","0","2","AtomicKoala","t3_5nwwhh","t5_2cneq","1486048808","null","null","0","1484423806","null","t1_dcf4xot","False","dcfe7qk"
"politics","What do you think the solution is to this radicalisation? Or rather, why didn't it happen to you?  Thank you for your posts, I actually tagged you as you seem to read the articles.","False","0","2","AtomicKoala","t3_5nwwhh","t5_2cneq","1486048852","null","null","0","1484423935","null","t1_dcf7v2o","False","dcfeb2k"
"politics","Russia particularly hates Sweden as they're one of the few non-ex-socialist countries taking a hard line on Russia.  It's been good to see them increasing spending, remilitarising Gotland, and looking to reintroduce conscription. I'm glad the Social Democratic government isn't full of pussies.","False","0","8","AtomicKoala","t3_5nz6jx","t5_2cneq","1486048908","null","null","0","1484424093","null","t3_5nz6jx","False","dcfef4t"
"politics","I'm not too sure he hates black people. He just views them differently. In a negative fashion. Not necessarily the same as hate. ","False","0","7","AtomicKoala","t3_5nz994","t5_2cneq","1486048950","null","null","1","1484424216","null","t1_dcfdrn4","False","dcfei9x"
"politics","Aren't loggers highly dependent on trade, particularly with China?","False","0","3","AtomicKoala","t3_5nxnql","t5_2cneq","1486048991","null","null","0","1484424330","null","t1_dcf7kca","False","dcfel9z"
"politics","These workers aren't being exploited. They are earning far more and in far better conditions than their parents who worked in subsistence agriculture.  They hope to see their children live like South Koreans.  Why hurt these innocent people with protectionism, when protectionism will hurt you too, just to a lesser degree?","False","0","1","AtomicKoala","t3_5nxnql","t5_2cneq","1486049019","null","null","0","1484424405","null","t1_dcf2l23","False","dcfena1"
"politics","They don't deserve that. Crazy family members can't be helped.","False","0","4","AtomicKoala","t3_5nxnql","t5_2cneq","1486049038","null","null","0","1484424458","null","t1_dcf2dj7","False","dcfeoo2"
"politics","Yeah Hillary herself deported plenty of illegals. It's not wrong. But given how low US unemployment is, and the fact most illegals are from the Western hemisphere, it makes sense to regularise many instead of engaging in some sort of mass deportation campaign.","False","0","-1","AtomicKoala","t3_5ny4do","t5_2cneq","1486049456","null","null","0","1484425663","null","t1_dcf6af4","False","dcffj6f"
"politics","...I'm European.  When was the last time she went against the political grain? I've watched her push for the shutdown of Germany's nuclear industry. She's a fucking conservative! She wasn't even in coalition with the coal loving SPD at the time! I respect the woman but I've no faith in her to affect positive change. ","False","0","2","AtomicKoala","t3_5nz13t","t5_2cneq","1486049477","null","null","0","1484425721","null","t1_dcffhm1","False","dcffklr"
"politics","I was thinking more of car exports really.","False","0","1","AtomicKoala","t3_5nz13t","t5_2cneq","1486049511","null","null","0","1484425815","null","t1_dcffk1o","False","dcffn0k"
"politics",">Once the fire of rebellion is lit, and the cause is just a significant portion of the military will join you.  Sure, this is what happened in Syria for example. However as with Syria Trump will have Russian backing.","False","0","1","AtomicKoala","t3_5nxn5j","t5_2cneq","1486049535","null","null","0","1484425884","null","t1_dcfflj3","False","dcfforb"
"politics","I mean that's a pretty accurate portrayal of his supporters.","False","0","24","AtomicKoala","t3_5ny9s0","t5_2cneq","1486049561","null","null","0","1484425955","null","t1_dcfeund","False","dcffqn4"
"politics","Eh, she doesn't really go against the European political grain either.  With the European debt crisis, she had so many opportunities. Yet she kept Schauble, and did little to temper the more hardline national governments (Europe is a confederation).   Now on the international stage we might see something different. But she has little experience of this from her political career as I outlined.   I'd personally probably vote CDU in the federal elections (mostly for foreign policy reasons), but she's pretty Obama-esque.","False","0","1","AtomicKoala","t3_5nz13t","t5_2cneq","1486049616","null","null","0","1484426108","null","t1_dcffry2","False","dcffunj"
"politics","It's because of the two big players (well three while Renzi was around), Germany was the pro-austerity one.  In reality, Estonia, Latvia, Lithuania, Finland, NL took more deficit hawkish stances. You can add Austria too, and Slovenia, and probably Slovakia. Spain and Ireland had (and still have) conservative led governments. Belgium and Luxembourg probably sided less with them but didn't exactly take strong stands. I can barely remember Muscat is PM of Malta on a good day.  So you had Greece, France, Italy and Portugal trying to make a case, and Portugal too was led by conservatives.","False","0","1","AtomicKoala","t3_5nz13t","t5_2cneq","1486049799","null","null","0","1484426626","null","t1_dcffy32","False","dcfg82r"
"politics","That said Mexico will be more united against the US than vice versa, even if the President's approval is shit. Mexico is far more pro-trade than the US and has other avenues to sell its goods. We have had an FTA with them since 2000.","False","0","9","AtomicKoala","t3_5nzdk9","t5_2cneq","1486049890","null","null","0","1484426882","null","t1_dcffj6i","False","dcfgemj"
"politics","It's almost like most Republicans are radicalised and don't care about consistency or reality.","False","0","34","AtomicKoala","t3_5nzdk9","t5_2cneq","1486049911","null","null","0","1484426943","null","t1_dcffyve","False","dcfgg53"
"politics","Yeah she's a non-citizen with residency, as I said it's not hard to fix that. I'm sure there is some racism though, which is unfortunate. Understandable, but unfortunate.","False","0","2","AtomicKoala","t3_5nwwhh","t5_2cneq","1486049976","null","null","0","1484427129","null","t1_dcfgel3","False","dcfgkug"
"politics","She had to coordinate returns with governments, no? I thought the justice department had to work with them on that.","False","0","1","AtomicKoala","t3_5ny4do","t5_2cneq","1486050374","null","null","0","1484428269","null","t1_dcfh4at","False","dcfhdup"
"politics","A lot of people dodged the draft - particularly the well off. What bothers me is how he disparaged those tortured etc, in light of this.","False","0","7","AtomicKoala","t3_5nybxi","t5_2cneq","1486050530","null","null","0","1484428709","null","t1_dcf6l8a","False","dcfhp2o"
"politics","Well I imagine without her cooperation they would have been impossible.","False","0","2","AtomicKoala","t3_5ny4do","t5_2cneq","1486050557","null","null","0","1484428786","null","t1_dcfhn6a","False","dcfhr18"
"politics","I know it's heavily dependent on the US. My point is that in a global trade war scenario, Mexico has more established friends.","False","0","5","AtomicKoala","t3_5nzdk9","t5_2cneq","1486051076","null","null","0","1484430206","null","t1_dcfio82","False","dcfish7"
"politics","Yeah that's what it is tbh. To the privileged, equality feels like oppression.","False","0","3","AtomicKoala","t3_5nwwhh","t5_2cneq","1486051734","null","null","0","1484431919","null","t1_dcfjqzd","False","dcfk3yc"
"politics","It's not on the grounds of ethnicity at all. Plenty of ethnic Russians were citizens before the illegal Soviet occupation. They never lost that citizenship - why would they? This solely pertained to those sent as colonists.","False","0","2","AtomicKoala","t3_5nwwhh","t5_2cneq","1486052623","null","null","0","1484434126","null","t1_dcfl87h","False","dcflvcf"
"politics","He got 46% of the vote. Indeed only 30% of the eligible electorate actually bothered to vote Democrat. That's not a great excuse.  Jean-Marie Le Pen lost 82-18 to Chirac in 2002, and he had political experience. I suppose he did downplay the Holocaust, but other than that Trump is generally more extreme.","False","0","1","AtomicKoala","t3_5nyh0u","t5_2cneq","1486053047","null","null","0","1484435218","null","t1_dcfcde3","False","dcfmq0w"
"politics","Pretty much my thoughts.","False","0","1","AtomicKoala","t3_5nxn5j","t5_2cneq","1486053151","null","null","0","1484435497","null","t1_dcfmu5r","False","dcfmxhd"
"politics","So battleground states should have high turnout, right?  So why was Arizona's turnout just 56%?","False","0","3","AtomicKoala","t3_5nyh0u","t5_2cneq","1486053188","null","null","0","1484435589","null","t1_dcfmwvk","False","dcfn01u"
"politics","So he was supposed to defy Iraq and keep troops there? And you wanted a ground invasion of Syria?","False","0","3","AtomicKoala","t3_5o03dv","t5_2cneq","1486053235","null","null","0","1484435708","null","t1_dcfmn9l","False","dcfn3a2"
"politics","I mean, he's being replaced by a far right Russian stooge. Almost everything the 2009 Dem trifecta achieved is going to be wiped out. So what success does he have left? The economic recovery thanks to what that trifecta did is it, and massive deficit spending is going to piss that away.","False","0","2","AtomicKoala","t3_5o03dv","t5_2cneq","1486053253","null","null","0","1484435757","null","t1_dcfjt1p","False","dcfn4l3"
"politics","He funded terrorists?","False","0","3","AtomicKoala","t3_5o03dv","t5_2cneq","1486053456","null","null","0","1484436281","null","t1_dcfnc06","False","dcfnj17"
"politics","No I do not think it would have been right for him to plan to fund terrorists, and indeed he didn't.  Why do you think he tried to?","False","0","1","AtomicKoala","t3_5o03dv","t5_2cneq","1486053639","null","null","0","1484436744","null","t1_dcfntlr","False","dcfnw7o"
"politics","It doesn't say in those articles he planned to support terrorists..?","False","0","1","AtomicKoala","t3_5o03dv","t5_2cneq","1486053869","null","null","0","1484437355","null","t1_dcfoar1","False","dcfocog"
"politics","Georgia isn't the deep South though. Interesting to see how it has diverged from those states since 2004 (when the Democrat voting Greatest Generation was still alive and before Democrats had a black President and moved to the left).   Realistically it's more like Florida.","False","0","1","AtomicKoala","t3_5nyf2t","t5_2cneq","1486054008","null","null","0","1484437717","null","t1_dcfhdxy","False","dcfomqb"
"politics","What President oversaw the massive commitment to Vietnam?","False","0","4","AtomicKoala","t3_5nyf2t","t5_2cneq","1486054845","null","null","0","1484439885","null","t1_dcfpvng","False","dcfqbd1"
"politics","No, daily leaks jumped on by your shitty cable news media does.","False","0","1","AtomicKoala","t3_5nuhsx","t5_2cneq","1486054863","null","null","0","1484439930","null","t1_dcfpu4z","False","dcfqcpq"
"politics","So I take it you read the article then? What do you think it says?","False","0","1","AtomicKoala","t3_5o03dv","t5_2cneq","1486054913","null","null","0","1484440051","null","t1_dcforaz","False","dcfqgd7"
"politics","Neocons are among the last sane Republicans left it seems.  Not necessarily right or anything. Just sort of grounded in reality. Sad times.","False","0","10","AtomicKoala","t3_5nzwf7","t5_2cneq","1486055028","null","null","0","1484440345","null","t1_dcfocbp","False","dcfqouv"
"politics","Never, can you read latin script?","False","0","5","AtomicKoala","t3_5nzwf7","t5_2cneq","1486055048","null","null","0","1484440396","null","t1_dcfp6dw","False","dcfqqap"
"politics","So where does it indicate that the Obama admin aimed to arm terrorists?","False","0","1","AtomicKoala","t3_5o03dv","t5_2cneq","1486055158","null","null","0","1484440690","null","t1_dcfqma9","False","dcfqy9w"
"politics","I'm asking as you seem unable to read the comments, which are mostly of the I hate to agree with Bill Kristol variety.","False","0","7","AtomicKoala","t3_5nzwf7","t5_2cneq","1486055300","null","null","0","1484441052","null","t1_dcfr5qp","False","dcfr8kq"
"politics","Could you point out where in the article it said the Obama admin tried to arm terrorists?","False","0","1","AtomicKoala","t3_5o03dv","t5_2cneq","1486055315","null","null","0","1484441087","null","t1_dcfr4q2","False","dcfr9lv"
"politics","He did bring in the precursor of the ACA after all, Ottocare.  I don't think he's underrated at all mind you. His biggest error was failing to put in place a durable system to succeed him.","False","0","6","AtomicKoala","t3_5o0kxv","t5_2cneq","1486055447","null","null","0","1484441391","null","t1_dcfpgha","False","dcfriue"
"politics","Well it's a separate fund, but the government borrows from it.","False","0","3","AtomicKoala","t3_5o0kxv","t5_2cneq","1486055473","null","null","0","1484441455","null","t1_dcfr11a","False","dcfrknr"
"politics","Could you point to some successful examples of this?","False","0","2","AtomicKoala","t3_5o0kxv","t5_2cneq","1486055488","null","null","0","1484441493","null","t1_dcfonwd","False","dcfrlr1"
"politics","Why is this an unreasonable sentiment for people to express?  On the other hand you claimed people here were on the whole worshipping his word.","False","0","9","AtomicKoala","t3_5nzwf7","t5_2cneq","1486055523","null","null","0","1484441581","null","t1_dcfrh1y","False","dcfrobz"
"politics","I mean it seems more reasonable than a ban on Muslims (re)entering the US, no?","False","0","5","AtomicKoala","t3_5o0ucb","t5_2cneq","1486055662","null","null","0","1484441947","null","t1_dcfrmre","False","dcfryc6"
"politics","If Trump gets to sell out America to the Russians, nothing you can do, folks. Although the Second Amendment people, maybe there is.","False","0","20","AtomicKoala","t3_5o0ucb","t5_2cneq","1486055686","null","null","0","1484442013","null","t1_dcfqiyh","False","dcfs04y"
"politics","Yeah Cohen isn't very brown right? He's not even going to get his passport checked on the train.","False","0","2","AtomicKoala","t3_5o0qc0","t5_2cneq","1486055724","null","null","0","1484442118","null","t1_dcfqqjn","False","dcfs2x8"
"politics","Never? Neither has the average American Muslim, right?  But the far right has a worse record in this regard - last time Europe had the far right in power, throwing a few gays off a building and shooting up some nightclubs would have been the preferred alternative.  So based on this logic, shouldn't we ban the far right from entering Europe? May as well start with Trump.","False","0","11","AtomicKoala","t3_5o0ucb","t5_2cneq","1486055785","null","null","0","1484442290","null","t1_dcfs29e","False","dcfs7e7"
"politics","What love?","False","0","3","AtomicKoala","t3_5nzwf7","t5_2cneq","1486055794","null","null","0","1484442313","null","t1_dcfruin","False","dcfs80q"
"politics","Yes? Where did it say they aimed to arm terrorists?","False","0","1","AtomicKoala","t3_5o03dv","t5_2cneq","1486055804","null","null","0","1484442340","null","t1_dcfs611","False","dcfs8qo"
"politics","Could you elaborate on why my post is illogical?","False","0","3","AtomicKoala","t3_5o0ucb","t5_2cneq","1486055951","null","null","0","1484442742","null","t1_dcfsb98","False","dcfsjbv"
"politics","That really is an excellent idea. Community policing works quite well and ensures broad support for the police. Don't agree with a federal solution necessarily mind you.","False","0","3","AtomicKoala","t3_5o0yo7","t5_2cneq","1486056033","null","null","0","1484442960","null","t1_dcfrykp","False","dcfspab"
"politics","Because with every move he makes the GOP base - which votes strongly every 2 years - more and more pro-Russian.","False","0","89","AtomicKoala","t3_5o11wm","t5_2cneq","1486056136","null","null","0","1484443236","null","t1_dcfsrz4","False","dcfswjo"
"politics","Eh, this works for him too. It makes GOP supporters more pro-Russia, as they believe whatever Trump says.","False","0","7","AtomicKoala","t3_5o11wm","t5_2cneq","1486056160","null","null","0","1484443305","null","t1_dcfs4np","False","dcfsycv"
"politics","Amen.","False","0","5","AtomicKoala","t3_5o11wm","t5_2cneq","1486056178","null","null","0","1484443354","null","t1_dcfse5d","False","dcfszo1"
"politics","Could you elaborate?","False","0","5","AtomicKoala","t3_5nzwf7","t5_2cneq","1486056543","null","null","0","1484444300","null","t1_dcftd17","False","dcftpzj"
"politics","No, I gave an example of an area where Trump is less extreme.","False","0","1","AtomicKoala","t3_5nyh0u","t5_2cneq","1486064459","null","null","0","1484471912","null","t1_dcfxn1u","False","dcg9klc"
"politics","The public option failed in 2010 due to conservative opposition. Democrats have wanted to reform the ACA if they could get the chance to do so.","False","0","1","AtomicKoala","t3_5ntxzo","t5_2cneq","1486064469","null","null","0","1484471974","null","t1_dcfx7nf","False","dcg9lb7"
