"subreddit","body","stickied","gilded","score","author","link_id","subreddit_id","retrieved_on","author_flair_css_class","author_flair_text","controversiality","created_utc","distinguished","parent_id","edited","id"
"politics","Right, you need higher taxes. Yet you guys keep electing Republicans...","False","0","0","AtomicKoala","t3_5lbdw1","t5_2cneq","1485690131","null","null","0","1483281313","null","t1_dbur8gr","False","dbv7w2p"
"politics","Why not on people? You have high taxes on corporations.","False","0","1","AtomicKoala","t3_5lbdw1","t5_2cneq","1485691812","null","null","0","1483288654","null","t1_dbvai92","False","dbvbcoc"
"politics","Why can't high earners afford higher taxes? They have much higher net incomes than here in Europe.","False","0","3","AtomicKoala","t3_5lbdw1","t5_2cneq","1485692033","null","null","0","1483289466","null","t1_dbvbkqf","False","dbvbt9o"
"politics","Meh, I'm Irish, we'd do much worse. This is what Israelis have voted for.","False","0","6","AtomicKoala","t3_5lf1dr","t5_2cneq","1485692082","null","null","0","1483289637","null","t1_dbvbieu","False","dbvbwsy"
"politics","Almost anywhere in Europe?","False","0","3","AtomicKoala","t3_5lcyd5","t5_2cneq","1485692167","null","null","0","1483289937","null","t1_dbv50hm","False","dbvc34z"
"politics","Well yeah, the top 10-20% need a tax hike. ","False","0","2","AtomicKoala","t3_5lbdw1","t5_2cneq","1485693317","null","null","0","1483293823","null","t1_dbvcndi","False","dbveheh"
"politics","Third highest in the last few decades.","False","0","1","AtomicKoala","t3_5la6q9","t5_2cneq","1485694285","null","null","0","1483296605","null","t1_dbv2gsg","False","dbvghrd"
"politics","Blaming the education system is what the GOP wants. The problem is far right radicalisation, not a lack of education. ","False","0","4","AtomicKoala","t3_5lfn6r","t5_2cneq","1485696160","null","null","0","1483301907","null","t1_dbvj8sc","1483304177","dbvkdj2"
"politics","Eh, we haven't had a freely elected national leader as extreme as Trump since WWII. It's not that easy to quantify. I suppose most people dislike gypsies, but that's more of a cultural thing. Roma for example who pass or are adopted don't do badly.","False","0","0","AtomicKoala","t3_5lfn6r","t5_2cneq","1485696383","null","null","0","1483302525","null","t1_dbvicsp","False","dbvku9j"
"politics","Well that's diversity, which is a different issue. Diversity in terms of immigration can make countries better places (eg food), but also worse.  Diversity certainly isn't worth it if we have to adopt some multicultural compromise. That's hardly racist is it though? We just don't want cultural clashes and things like FGM or honour killings.","False","0","0","AtomicKoala","t3_5lfn6r","t5_2cneq","1485697050","null","null","0","1483304334","null","t1_dbvloh5","False","dbvm886"
"politics","This is why Democrats need to get more conservatives. Allowing them to fall into the clutches of the GOP creates situations like this. Democrats are the party of fiscal responsibility and sound economics.","False","0","9","AtomicKoala","t3_5lh0am","t5_2cneq","1485697107","null","null","0","1483304497","null","t3_5lh0am","False","dbvmchh"
"politics","Look I'm European - what do you want me to google? We don't have areas like the Deep South where non-hispanic whites vote >85%  GOP due to racist pandering.","False","0","1","AtomicKoala","t3_5lfn6r","t5_2cneq","1485697656","null","null","0","1483306069","null","t1_dbvnacv","False","dbvnhks"
"politics","The empirical evidence seems to say otherwise. Maybe you're thinking of Russia.","False","0","1","AtomicKoala","t3_5lfn6r","t5_2cneq","1485698008","null","null","0","1483307023","null","t1_dbvnkvj","False","dbvo79z"
"politics","Could you show me them?","False","0","2","AtomicKoala","t3_5lfn6r","t5_2cneq","1485698427","null","null","0","1483308177","null","t1_dbvoo4b","False","dbvp2hv"
"politics","Probably not the face the party needs though.","False","0","2","AtomicKoala","t3_5lfvri","t5_2cneq","1485698505","null","null","0","1483308383","null","t1_dbvkmlv","False","dbvp86w"
"politics","Eh I think you need someone from a more conservative point of view. You need conservative voters to vote for the party of fiscal responsibility and national security in 2018, the GOP has largely abandoned conservative governance.","False","0","1","AtomicKoala","t3_5lfvri","t5_2cneq","1485698893","null","null","0","1483309444","null","t1_dbvpcwp","False","dbvq154"
"politics","I live in an area that's relatively well maintained, no one was bothered to fish bags out of the river though.  Making people pay for the plastic fixed the problem.","False","0","1","AtomicKoala","t3_5l4to3","t5_2cneq","1485700934","null","null","0","1483315095","null","t1_dbvt7dm","False","dbvu9te"
"politics","The GOP has been overrun by the far right. You can't really compromise with people who don't believe in science or economics.  Instead Democrats need to stop alienating conservative voters. Hillary was far too progressive, damaging the Democratic brand.","False","0","1","AtomicKoala","t3_5lfvri","t5_2cneq","1485700959","null","null","0","1483315164","null","t1_dbvqcm1","False","dbvublb"
"politics","I'd say he's actually mixed race looking at him.","False","0","3","AtomicKoala","t3_5li1hl","t5_2cneq","1485703143","null","null","0","1483321613","null","t1_dbvvp2q","False","dbvyrwx"
"politics","Except the parties are extraordinarily different. Come to Europe.","False","0","2","AtomicKoala","t3_5lfn6r","t5_2cneq","1485703218","null","null","0","1483321840","null","t1_dbvq07b","False","dbvyxgf"
"politics","What corruption?","False","0","2","AtomicKoala","t3_5lfn6r","t5_2cneq","1485703262","null","null","0","1483321971","null","t1_dbvpoiq","False","dbvz0n2"
"politics","What corruption?","False","0","1","AtomicKoala","t3_5lfn6r","t5_2cneq","1485703266","null","null","0","1483321982","null","t1_dbvtejp","False","dbvz0yd"
"politics","Only part of it.","False","0","2","AtomicKoala","t3_5lfn6r","t5_2cneq","1485703421","null","null","0","1483322443","null","t1_dbvu0u7","False","dbvzccr"
"politics","Bingo. On reddit they were more hostile to tax increases than Clinton supporters, it was bizarre. A bandwagon as you say for many. Shame, as I really expected him to be a positive force.","False","0","2","AtomicKoala","t3_5lfn6r","t5_2cneq","1485703505","null","null","0","1483322702","null","t1_dbvdpzu","False","dbvzill"
"politics","Steve Bullock 2020?","False","0","1","AtomicKoala","t3_5lgc2t","t5_2cneq","1485703576","null","null","0","1483322914","null","t1_dbvmbna","False","dbvznvw"
"politics","What about America's climate responsibility?","False","0","11","AtomicKoala","t3_5likvy","t5_2cneq","1485704261","null","null","0","1483324543","null","t1_dbvzqbi","False","dbw0rne"
"politics","It really is bizarre. This is such a non-issue affecting a tiny amount of people.","False","0","13","AtomicKoala","t3_5lii4f","t5_2cneq","1485704287","null","null","0","1483324612","null","t1_dbvy4h2","False","dbw0tek"
"politics","Yeah it certainly hasn't been great since 2013.","False","0","2","AtomicKoala","t3_5lik7g","t5_2cneq","1485704326","null","null","0","1483324724","null","t1_dbvykvv","False","dbw0w53"
"politics","Why is establishment bad automatically? In the Democratic context, anti-establishment seems to equal anti-intellectual.","False","0","3","AtomicKoala","t3_5lihcl","t5_2cneq","1485704352","null","null","0","1483324800","null","t1_dbw0an0","False","dbw0xzg"
"politics","Yeah he's everything wrong with the party imo. A moderate who's perceived as anti-gun and socially progressive.","False","0","6","AtomicKoala","t3_5lii1e","t5_2cneq","1485704386","null","null","0","1483324903","null","t1_dbvzwvk","False","dbw10gf"
"politics","Does it?","False","0","4","AtomicKoala","t3_5lii1e","t5_2cneq","1485704394","null","null","0","1483324927","null","t1_dbvzad8","False","dbw1125"
"politics","Who will pay that premium however? I'm not a fan of this market interference.","False","0","5","AtomicKoala","t3_5likvy","t5_2cneq","1485704447","null","null","0","1483325074","null","t1_dbw0yft","False","dbw14r9"
"politics","How is it unethical to combine limits for developing countries with funding for low carbon alternatives, as does the Paris agreement does?","False","0","2","AtomicKoala","t3_5lilxr","t5_2cneq","1485712958","null","null","0","1483361572","null","t1_dbwfy6k","False","dbwh2rf"
"politics","Not including 2016, the 16 warmest years since records began in 1880 have occurred since 1998.","False","0","3","AtomicKoala","t3_5lilxr","t5_2cneq","1485713007","null","null","0","1483361868","null","t1_dbwftf5","False","dbwh6ex"
"politics",">Only if you assume that you can only be intellectual if you are pro-establishment.  Oh not at all - I'm just talking about the use of the term. Establishment does not necessarily equal good or bad, intellectual or vacuous, it's just the use of the term in the Democratic context seems to be to dismiss those with policy and institutional knowledge. I think Pelosi should go for example (get a younger, less stereotypically Democrat face in place), but her establishment knowledge got a truckload of policy passed with the little time the 2009 Democratic Congress had, and of course she is a pretty genuine progressive.","False","0","1","AtomicKoala","t3_5lihcl","t5_2cneq","1485713953","null","null","0","1483366760","null","t1_dbwizro","False","dbwj3dx"
"politics","This is a bit simplistic. Social conservativism has been used as a stepping stone for radicalisation, but does not necessarily make one dumber by default. ","False","0","1","AtomicKoala","t3_5ll9x7","t5_2cneq","1485714231","null","null","1","1483367956","null","t1_dbwj4jk","False","dbwjnh8"
"politics","Almost any company focused on quarterly results will feel good about a big increase in deficit spending and reduced taxes. Directors who have to worry about the company in a decade's time may take a different view.","False","0","4","AtomicKoala","t3_5llbe8","t5_2cneq","1485714261","null","null","0","1483368084","null","t1_dbwiq8a","False","dbwjpog"
"politics","Social conservatives don't believe the phenotype of homosexuality has a biological basis..?","False","0","-1","AtomicKoala","t3_5ll9x7","t5_2cneq","1485714348","null","null","1","1483368452","null","t1_dbwjuk1","False","dbwjw41"
"politics","You are definitely worse off than in 2008. You have all the negative opinion now you've elected Trump, plus an emboldened Russia.  Successes like the Iran deal or Paris may have been scuttled by Trump's election.  If Obama had been tougher on Russia, didn't fuck up the Red Line etc, Russia would not have been so emboldened and Trump would not be President.","False","0","-1","AtomicKoala","t3_5llgh8","t5_2cneq","1485714408","null","null","0","1483368699","null","t1_dbwjz4k","False","dbwk0kj"
"politics","Bush didn't result from Bill's foreign policy mistakes emboldening a foreign power - whereas Trump resulted from Obama's weakness on Russia.","False","0","0","AtomicKoala","t3_5llgh8","t5_2cneq","1485715136","null","null","0","1483371423","null","t1_dbwl673","False","dbwlhv5"
"politics","Is climate change real? What about fiscal multipliers? Asbestos causing lung cancer?","False","0","5","AtomicKoala","t3_5ll7yd","t5_2cneq","1485716472","null","null","0","1483375607","null","t1_dbwnqv9","False","dbwo8a1"
"politics","The GOP will swiftboat any candidate now. Decent men like McCain or Romney aren't running.  One day it'll happen to your preferred candidate. Be prepared.","False","0","1","AtomicKoala","t3_5ll7yd","t5_2cneq","1485716592","null","null","0","1483375957","null","t1_dbwnb87","False","dbwoh7x"
"politics","It's every voters duty to vote in the most logical fashion possible.  I agree with you though. Democrats need 55-60% of the vote in 2018. They need to appeal to racially anxious voters etc. They can't ostracise people for supporting racists if they want their vote.","False","0","5","AtomicKoala","t3_5ll7yd","t5_2cneq","1485716651","null","null","0","1483376123","null","t1_dbwnepf","False","dbwolm5"
"politics","I do wonder how O'Malley would have done. He'd have appeared too late to be Benghazi'd. But he was too friendly with illegals etc.","False","0","2","AtomicKoala","t3_5ll7yd","t5_2cneq","1485716687","null","null","0","1483376216","null","t1_dbwnxfr","False","dbwoo71"
"politics","2nd amendment people?","False","0","138","AtomicKoala","t3_5ll213","t5_2cneq","1485716892","null","null","0","1483376786","null","t1_dbwo2vz","False","dbwp38b"
"politics","Americans chose authoritarianism.","False","0","21","AtomicKoala","t3_5ll213","t5_2cneq","1485716907","null","null","0","1483376831","null","t1_dbwkmv9","False","dbwp4ec"
"politics","Corporate media conglomerates are a problem - but they're not *the* problem.  Conglomeration did not cause the far right radicalisation of much of the US electorate. Talk radio, fox, random internet sites, the GOP did.","False","0","11","AtomicKoala","t3_5llsm5","t5_2cneq","1485717369","null","null","0","1483378104","null","t1_dbwopyo","False","dbwq28u"
"politics","CNN is trash that enabled Trump.","False","0","48","AtomicKoala","t3_5llsm5","t5_2cneq","1485717464","null","null","0","1483378355","null","t1_dbwoxwy","False","dbwq98g"
"politics","WaPo is a newspaper though, it's their job to report and present opinion.","False","0","6","AtomicKoala","t3_5llsm5","t5_2cneq","1485717561","null","null","0","1483378617","null","t1_dbwmgrn","False","dbwqge3"
"politics","You realise that's part of being a candidate? Hillary got more coverage for her fucking emails than all policies combined. If fucking emails were baggage, all of Sanders' bullshit would be too.  Unfair? Sure. I don't think most Democrats care about Bernie's rape essays, connection to the Sandanistas etc. But 46% of voters went for Trump. Much of your electorate cannot be reconciled with facts and logic.","False","0","-1","AtomicKoala","t3_5llsm5","t5_2cneq","1485717606","null","null","1","1483378742","null","t1_dbwna8i","False","dbwqjt6"
"politics","If Donald gets to pick his judges...","False","0","2","AtomicKoala","t3_5ll213","t5_2cneq","1485717694","null","null","0","1483378983","null","t1_dbwqom7","False","dbwqqa0"
"politics","Indeed. Did you know Donald didn't even vote for the Secure Fence Act, and was praising the idea of open borders in 2013? I'm sick of these open borders types.","False","0","1","AtomicKoala","t3_5ll7yd","t5_2cneq","1485717732","null","null","0","1483379086","null","t1_dbwptu6","False","dbwqt19"
"politics","So Fox News is a response to CNN's right wing bullshit? A response to the WaPo's centre right bullshit? Could you elaborate?","False","0","5","AtomicKoala","t3_5llsm5","t5_2cneq","1485717841","null","null","0","1483379385","null","t1_dbwqyil","False","dbwr151"
"politics","Yes, it was ridiculous to watch so called liberals shouting down civil rights icons, hundred percent agreed. Those people disgraced their cause.","False","0","2","AtomicKoala","t3_5ll7yd","t5_2cneq","1485717854","null","null","0","1483379421","null","t1_dbwqskq","False","dbwr23x"
"politics","In all fairness /u/Scoobyblue02 is right, at some point action becomes necessary. Small arms are only sufficient for an insurgency however. Ultimately you need military backing to overthrow such a regime. ","False","0","6","AtomicKoala","t3_5ll213","t5_2cneq","1485718541","null","null","0","1483381209","null","t1_dbws9qj","False","dbwsfz6"
"politics","They were talking about a dictatorship, read their post.","False","0","5","AtomicKoala","t3_5ll213","t5_2cneq","1485719006","null","null","0","1483382308","null","t1_dbwt59d","False","dbwtdqg"
"politics",">Article needs to give credit to the Democrats also.   40 years of wage stagnation and outsourcing US jobs didn't happen without the support of the Democratic Party doing the bidding of their wealthy donors.   The 2009 Democratic trifecta put in place the most anti-inequality spending since LBJ. The next year Americans decisively voted against Democrats.  Why not blame voters?","False","0","10","AtomicKoala","t3_5lkzbq","t5_2cneq","1485719398","null","null","0","1483383272","null","t1_dbwkwdt","False","dbwu6o6"
"politics","I have a fair bit of time for Reich but he's a commentator, not an actual economist.","False","0","0","AtomicKoala","t3_5lkzbq","t5_2cneq","1485719420","null","null","0","1483383324","null","t1_dbwtgmg","False","dbwu893"
"politics","The problem is not education, but radicalisation.","False","0","4","AtomicKoala","t3_5lmcz4","t5_2cneq","1485719496","null","null","0","1483383515","null","t1_dbwu3hc","False","dbwudxb"
"politics","The DNC picked Martin O'Malley?  Anyway, I just demonstrated why you should blame voters. They chose inequality, science and economics denial in 2010, after Democrats put in place a highly successful stimulus among other things.","False","0","11","AtomicKoala","t3_5lkzbq","t5_2cneq","1485719665","null","null","0","1483383933","null","t1_dbwujhw","False","dbwuqef"
"politics","Why Perot in '92, out of interest?","False","0","3","AtomicKoala","t3_5lmrki","t5_2cneq","1485719714","null","null","0","1483384050","null","t1_dbwud4w","False","dbwutui"
"politics","Reality is biased against the GOP. No other major party in the West denies climate change, for example. There are few who deny economics to a similar degree.  Of course if the media is doing its job Democrats will look better than the alternative.","False","0","3","AtomicKoala","t3_5lmqxb","t5_2cneq","1485719743","null","null","0","1483384115","null","t1_dbwu9tn","False","dbwuvua"
"politics","Will the GOP find a way to prevent its implementation?","False","0","1","AtomicKoala","t3_5lmnxh","t5_2cneq","1485719872","null","null","0","1483384430","null","t1_dbwufj1","False","dbwv5an"
"politics","Well what I'm trying to understand is, why do you think O'Malley would have done better?  I suppose the GOP wouldn't have time to swiftboat him.","False","0","4","AtomicKoala","t3_5lkzbq","t5_2cneq","1485720053","null","null","0","1483384872","null","t1_dbwuzqi","False","dbwvidi"
"politics","Isn't there talk that it may be unconstitutional however? ","False","0","1","AtomicKoala","t3_5lmnxh","t5_2cneq","1485720105","null","null","0","1483385001","null","t1_dbwv7hg","False","dbwvm74"
"politics","Only 30% of Americans came out against it. Americans chose this. Here in Ireland we had 65% turnout for an incredibly low stakes national election. There were no other elections being run. In America you get 30 odd percent for that, and barely 60% in a election for President, >80% of the federal legislature, most state houses, a bunch of governors, etc.","False","0","7","AtomicKoala","t3_5ll213","t5_2cneq","1485720138","null","null","0","1483385086","null","t1_dbwvf80","False","dbwvom6"
"politics","You keep saying she was the worst candidate they could have run, so I'm trying to see why - O'Malley could have been run, he was to the left of her socially so I assume you'd support him - why would he have done better?","False","0","2","AtomicKoala","t3_5lkzbq","t5_2cneq","1485720176","null","null","0","1483385184","null","t1_dbwvo2h","False","dbwvrfm"
"politics","What I've learnt this year is that the GOP will find a way. Don't let you and yours get complacent.","False","0","1","AtomicKoala","t3_5lmnxh","t5_2cneq","1485720207","null","null","0","1483385264","null","t1_dbwvqb9","False","dbwvtrx"
"politics","The GOP in Maine that allowed LePage to become governor? Don't be so sure. Still, I've never been to Maine so I'd trust your judgement more than mine! I'm just worried by how many Americans believe it can't happen here. It absolutely can. Look at NC.","False","0","1","AtomicKoala","t3_5lmnxh","t5_2cneq","1485720361","null","null","0","1483385666","null","t1_dbwvyi7","False","dbww4zu"
"politics","Hmm, did you believe that Bush was doing the right thing in pushing for fiscal responsibility by following the deficit reduction plan?","False","0","6","AtomicKoala","t3_5lmrki","t5_2cneq","1485720391","null","null","0","1483385741","null","t1_dbwvo5p","False","dbww753"
"politics",">DNC picked the worst candidate to run against Trump.  So O'Malley would have been better? This is what I'm trying to figure out.  I'm hardly a Hillary fan, I heard about Bernie years ago and hoped to see a push towards social democracy when he entered the race. Your country needs higher taxes. Unfortunately his supporters ended up being less pro-tax rises than Hillary voters even though she had far more centre to centre right voters. I'm not sure how that happened, but I think part of it was the stump speech focusing on the 1% and corporations. Taxes need to rise on the top 25-15%, but I guess a lot his supporters' parents fell into that category.","False","0","5","AtomicKoala","t3_5lkzbq","t5_2cneq","1485720447","null","null","0","1483385883","null","t1_dbww6my","False","dbwwb9w"
"politics","Interesting! I guess you do more research these days?","False","0","2","AtomicKoala","t3_5lmrki","t5_2cneq","1485720482","null","null","0","1483385968","null","t1_dbwwbe8","False","dbwwdq1"
"politics","I suppose as someone who lives in a fairly socially liberal and economically liberal country (although we have an almost complete abortion ban), I don't really see how a state that can vote for LePage and give such a strong vote for Trump can be that liberal.  Both are authoritarians who happen to scream for big tax cuts and bigger deficits.  The radicalisation is only going to get worse. Get involved with your local and state party if you can.","False","0","1","AtomicKoala","t3_5lmnxh","t5_2cneq","1485720515","null","null","0","1483386056","null","t1_dbwwcvq","False","dbwwg7f"
"politics","Ah right, how do you usually vote?","False","0","3","AtomicKoala","t3_5lmrki","t5_2cneq","1485720575","null","null","0","1483386210","null","t1_dbwwifw","False","dbwwkm3"
"politics","The latter!","False","0","2","AtomicKoala","t3_5lmrki","t5_2cneq","1485720861","null","null","0","1483386928","null","t1_dbwwwqj","False","dbwx574"
"politics",">The emails got more coverage than her policies because she had no policies, sweetie.  Why do you say that she had no policies?","False","0","12","AtomicKoala","t3_5llsm5","t5_2cneq","1485721146","null","null","0","1483387661","null","t1_dbwx9sv","False","dbwxpy0"
"politics","Ah fair enough, interesting. Thank you for voting.","False","0","1","AtomicKoala","t3_5lmrki","t5_2cneq","1485721160","null","null","0","1483387697","null","t1_dbwx7c4","False","dbwxqzt"
"politics",">It creates artificial ceilings on capital investment and food production, limiting gdp growth with transfer payments by the first world.  How does it with compensation to make up the slight increased cost of low carbon options?  > It's robs the third world of becoming competitive economies.  As does climate change, or protectionism - I get you didn't vote for Trump but America did, thus making these places worse off.","False","0","1","AtomicKoala","t3_5lilxr","t5_2cneq","1485722027","null","null","0","1483389864","null","t1_dbwzdbz","False","dbwzi03"
"politics","I'm asking you!  It would have been late enough for him to come to the fore (ie January-February), so the GOP would have struggled to Benghazi him. Hillary should never have run, she should have acted as a decoy candidate.  However he was more socially progressive, to an unhelpful extent. Whereas Hillary was already weak enough on illegals, she was the toughest in the field. O'Malley saw illegals as new Americans - exactly what the GOP understandable fears, the idea Democrats are importing illegals in order to make them citizens.  His tenure as mayor of Baltimore would be easy for the GOP to use against him, and any hope of appearing tough on crime would be diluted by his record as MD governor.   So I'm wondering why you feel he was better? For me what would make him better is that the GOP would have less time to Benghazi him as I said, unlike Sanders or Hillary (Sanders had the VA scandal, far worse than Benghazi which had no substance, as little to the VA scandal as there was, his actions were not great).","False","0","3","AtomicKoala","t3_5lkzbq","t5_2cneq","1485722125","null","null","0","1483390110","null","t1_dbwxxxl","False","dbwzp69"
"politics","This actually sounds like it has substance. Still, innocent until proven guilty, or at least until you've shown a shiteload of facts.","False","0","2","AtomicKoala","t3_5lmgu1","t5_2cneq","1485722247","null","null","0","1483390408","null","t1_dbwzshw","False","dbwzy1u"
"politics","In all fairness 2008 was competitive to the end. After Super Tuesday Hillary had it pretty much locked up (hence Bloomberg announced he wouldn't run).","False","0","4","AtomicKoala","t3_5llxq1","t5_2cneq","1485722301","null","null","0","1483390540","null","t1_dbwuufy","False","dbx01wx"
"politics",">There were millions of uncounted ballots that were thrown away in both CA and NY.   Link?","False","0","0","AtomicKoala","t3_5llxq1","t5_2cneq","1485722312","null","null","0","1483390566","null","t1_dbwyt4v","False","dbx02oj"
"politics","I do find it unfortunate he didn't get more of them to favour tax rises and such, but I suppose that's their responsibility, not necessarily his.","False","0","1","AtomicKoala","t3_5llxq1","t5_2cneq","1485722327","null","null","0","1483390603","null","t1_dbwp332","False","dbx03q3"
"politics",">  I said I never heard of him until you mentioned him. I never even said his name until you did.  Well then why did you declare she was the worst possible candidate when you didn't know the other options..?","False","0","3","AtomicKoala","t3_5lkzbq","t5_2cneq","1485722586","null","null","0","1483391260","null","t1_dbx0bfz","False","dbx0mqw"
"politics","Because of GOP obstructionism.","False","0","3","AtomicKoala","t3_5li0vh","t5_2cneq","1485722615","null","null","0","1483391331","null","t1_dbw6wbc","False","dbx0os2"
