"subreddit","body","stickied","gilded","score","author","link_id","subreddit_id","retrieved_on","author_flair_css_class","author_flair_text","controversiality","created_utc","distinguished","parent_id","edited","id"
"politics","But why? Actual facts don't work against Republicans.","False","0","20","AtomicKoala","t3_5p3scb","t5_2cneq","1486209806","null","null","0","1484926694","null","t1_dco930r","False","dcoas5m"
"politics","Democrats weren't handicapped in Alaska in 2014.  They just failed to turn out and Beglich lost his seat.  Let's face it, you live a right wing country. A 1.5% swing would have kept his seat. But clearly there weren't a few thousand extra Alaskans who didn't want your country moving even further to the right. ","False","0","1","AtomicKoala","t3_5p0u0w","t5_2cneq","1486209854","null","null","0","1484926812","null","t1_dco6s7s","1484927122","dcoavjd"
"politics","Maybe O'Malley might have better baggage wise. Obviously Sanders had much more substantial baggage than her.  Biden probably had more baggage too. Need someone young.","False","0","2","AtomicKoala","t3_5p3scb","t5_2cneq","1486210014","null","null","0","1484927196","null","t1_dcoaybu","False","dcob6y7"
"politics","You think they just would have invented baggage for him anyway too? I suppose.","False","0","2","AtomicKoala","t3_5p3scb","t5_2cneq","1486213604","null","null","0","1484934966","null","t1_dcodrwg","False","dcoi764"
"politics","Right, by electing people who won't cut taxes for the very well off and may even impose some small increases on them, no? ","False","0","1","AtomicKoala","t3_5p0u0w","t5_2cneq","1486213687","null","null","0","1484935114","null","t1_dcoi76a","False","dcoic2t"
"politics","The GOP has radicalised what were conservatives into far right reactionaries.","False","0","11","AtomicKoala","t3_5p59su","t5_2cneq","1486213857","null","null","0","1484935480","null","t1_dcoh1wl","False","dcoinx3"
"politics","He's a classic far right authoritarian ultranationalist. The only thing that's different about him is he's less coherent.","False","0","96","AtomicKoala","t3_5p59su","t5_2cneq","1486213876","null","null","0","1484935525","null","t1_dcoi9zp","False","dcoipbb"
"politics","These guys are just butter they couldn't get a blowjob off a buxom intern.","False","0","10","AtomicKoala","t3_5p59su","t5_2cneq","1486213933","null","null","0","1484935651","null","t1_dcoi50i","False","dcoitek"
"politics","Yup! How did you vote downballot?","False","0","1","AtomicKoala","t3_5p0u0w","t5_2cneq","1486213953","null","null","0","1484935693","null","t1_dcoin5r","False","dcoiuqq"
"politics","Has it? Have you surveyed them? There's a reason their representatives are often pro nuclear, they're big employers for the area.","False","0","1","AtomicKoala","t3_5p3hti","t5_2cneq","1486214049","null","null","0","1484935911","null","t1_dco90c9","False","dcoj1o1"
"politics","Only 30% of eligible Americans voted against him.","False","0","1","AtomicKoala","t3_5p3s9c","t5_2cneq","1486214087","null","null","0","1484935990","null","t1_dcoez0p","False","dcoj4an"
"politics","So the fact that the 2009 federal Democrat trifecta put in place the most anti-inequality spending and taxation combination since LBJ didn't change your mind?","False","0","1","AtomicKoala","t3_5p0u0w","t5_2cneq","1486214280","null","null","0","1484936396","null","t1_dcoiz5p","False","dcojhjf"
"politics","So you don't things that it would be worse without action..?","False","0","1","AtomicKoala","t3_5p0u0w","t5_2cneq","1486214907","null","null","0","1484937741","null","t1_dcojvw4","False","dcokp7o"
"politics","My point is that he's easy to pin down politically. He's a far right authoritarian ultranationalist.","False","0","1","AtomicKoala","t3_5p59su","t5_2cneq","1486214917","null","null","0","1484937763","null","t1_dcojtw8","False","dcokpxb"
"politics","Doesn't it worry you how his nominees have no background in their roles?  I mean his EPA pick doesn't understand climate science - isn't that worrying?","False","0","3","AtomicKoala","t3_5p59su","t5_2cneq","1486214966","null","null","0","1484937876","null","t1_dcokae5","False","dcoktjv"
"politics","No he's not as extreme as Hitler, why do you say that?","False","0","1","AtomicKoala","t3_5p59su","t5_2cneq","1486215019","null","null","0","1484937987","null","t1_dcokvfz","False","dcokx7r"
"politics","So you think anti-inequality measures made no positive difference?","False","0","1","AtomicKoala","t3_5p0u0w","t5_2cneq","1486215041","null","null","0","1484938037","null","t1_dcokuzc","False","dcokyvc"
"politics","Really?","False","0","3","AtomicKoala","t3_5p3w9g","t5_2cneq","1486215083","null","null","0","1484938128","null","t1_dcohwcj","False","dcol1u3"
"politics","Well not really. Conservatives are far more pro trade. The hard to far right party is similar to the GOP but without the pro business element.","False","0","2","AtomicKoala","t3_5p3w9g","t5_2cneq","1486215115","null","null","0","1484938198","null","t1_dcocv3i","False","dcol411"
"politics","My point is surely as a conservative you'd be worried about these picks compared to Obama's or W's?","False","0","3","AtomicKoala","t3_5p59su","t5_2cneq","1486215582","null","null","0","1484939266","null","t1_dcolilz","False","dcom1x5"
"politics","So what action would you support?","False","0","1","AtomicKoala","t3_5p0u0w","t5_2cneq","1486215604","null","null","0","1484939315","null","t1_dcol9ys","False","dcom3gk"
"politics","Ah, well I suppose if you identified with the far right I could see how you'd see his picks more positively - fair enough!","False","0","1","AtomicKoala","t3_5p59su","t5_2cneq","1486215828","null","null","0","1484939824","null","t1_dcom6jv","False","dcomjdy"
"politics","Oh sure. It just got annoying watching Sanders supporters claim they wanted to be like Sweden/Ireland/Finland/Germany while disparaging trade. Sweden has been perhaps the biggest pusher of free trade deals. ","False","0","2","AtomicKoala","t3_5p3w9g","t5_2cneq","1486215857","null","null","0","1484939890","null","t1_dcom5t0","False","dcomlgg"
"politics","So the solution is electing people who won't cut taxes for the very well off and may even impose some small increases on them, right?","False","0","0","AtomicKoala","t3_5p0u0w","t5_2cneq","1486215892","null","null","0","1484939976","null","t1_dcomb7p","False","dcomo62"
"politics","So you generally vote Democrat?","False","0","1","AtomicKoala","t3_5p0u0w","t5_2cneq","1486216106","null","null","0","1484940456","null","t1_dcomsm0","False","dcon3h7"
"politics","Except not. Her plans reduced the relative debt. How can you compare this?","False","0","3","AtomicKoala","t3_5p5oiu","t5_2cneq","1486216305","null","null","0","1484940895","null","t1_dcomksc","False","dconhb4"
"politics","You realise he keeps advocating federal government interference in individual businesses which seek to adjust their workforce or make investments?","False","0","20","AtomicKoala","t3_5p59su","t5_2cneq","1486217567","null","null","0","1484943566","null","t1_dcookqn","False","dcoptc2"
"politics","Republicans, not conservatives.","False","0","1","AtomicKoala","t3_5p4gcg","t5_2cneq","1486217926","null","null","0","1484944376","null","t1_dcokj8b","False","dcoqihg"
"politics","What's illogical about allowing fracking to displace coal? ","False","0","0","AtomicKoala","t3_5p5civ","t5_2cneq","1486221878","null","null","0","1484953836","null","t1_dcosqp3","False","dcoy9ol"
"politics","He also said it was just a campaign device.","False","0","6","AtomicKoala","t3_5p4gcg","t5_2cneq","1486222112","null","null","0","1484954454","null","t1_dcouvv4","False","dcoyqa6"
"politics","Exactly. Only 17% of eligible voters voted Democrat in 2014. It was pathetic to watch Americans hurt the rest of the world so badly out of sheer laziness.","False","0","9","AtomicKoala","t3_5p59c7","t5_2cneq","1486222384","null","null","0","1484955157","null","t1_dcoqv8k","False","dcoz9c9"
"politics","The American people gave the GOP a mandate in 2010 and 2014 for this. They gave the GOP a plurality of federal House votes.  If America did not want this they would have voted against it. They did in 2012. But you cannot ignore every other election.","False","0","-1","AtomicKoala","t3_5p59c7","t5_2cneq","1486222424","null","null","0","1484955264","null","t1_dcos0eq","False","dcozc6w"
"politics",">won't come out for an ethically questionable person  Look, the GOP would have done the same thing to Sanders.  What do you think they would have done with the fact he and his corrupt (socialist?) wife dumped Vermonter nuclear waste on poor hispanics? The GOP know how to divide Democrats mate.   Get ready for 2018. You need to support progressive, liberal, moderate and conservative Democrats.","False","0","3","AtomicKoala","t3_5p59c7","t5_2cneq","1486222470","null","null","1","1484955386","null","t1_dcousb7","False","dcozfg0"
"politics","Well if they knew more about politics they'd actually vote.","False","0","1","AtomicKoala","t3_5p59c7","t5_2cneq","1486222481","null","null","0","1484955409","null","t1_dcoyto8","False","dcozg2q"
"politics","It's becoming clear Trump is obsessed with his generals.  His Homeland Security pick is similar, disagreeing with Trump on security issues.    I wonder what the balance of involvement was here. Why did Bannon and Flynn help with these picks?","False","0","7","AtomicKoala","t3_5p74s6","t5_2cneq","1486222589","null","null","0","1484955696","null","t1_dcoy3vc","False","dcozns7"
"politics","Like Pittsburgh or Cleveland? ","False","0","2","AtomicKoala","t3_5p6qh4","t5_2cneq","1486222896","null","null","0","1484956511","null","t1_dcowekw","False","dcp094e"
"politics","If Democratic voters actually voted in midterms you wouldn't have this problem.  In 2014, the North Carolinian, Alaskan, and Coloradan seats were lost by slim margins. With them, Democrats would control the Senate.  But it seems that Americans did not want a Democratic Senate majority. This is what the American people wanted.  You now have to help them see differently.","False","0","48","AtomicKoala","t3_5p66zp","t5_2cneq","1486223855","null","null","0","1484959054","null","t1_dcophjg","1484960002","dcp246b"
"politics","Probably should have sent some GOP Senators to their beloved gitmo.","False","0","0","AtomicKoala","t3_5p66zp","t5_2cneq","1486223894","null","null","0","1484959161","null","t1_dcopboo","False","dcp270c"
"politics",">One final finding that may drive a lot of Hillary Clinton fans crazy: 33% of Trump voters think that Trump should be allowed to have a private email server.  http://www.publicpolicypolling.com/main/2017/01/trump-unpopular-even-in-state-he-won.html","False","0","1","AtomicKoala","t3_5p5civ","t5_2cneq","1486224008","null","null","0","1484959479","null","t1_dcopga8","False","dcp2f69"
"politics","Eh it's probably good to have some conservative Democrats like Tulsi who are seen as anti-Islam.  Big tent mate.","False","0","0","AtomicKoala","t3_5p669j","t5_2cneq","1486224302","null","null","0","1484960295","null","t1_dcoto6j","False","dcp2zxq"
"politics","Eh, without such regulation you'd have far more people trying to come to the West. You can't deal with that.","False","0","2","AtomicKoala","t3_5p5vcr","t5_2cneq","1486224389","null","null","0","1484960535","null","t1_dcouacv","False","dcp35x3"
"politics","Which makes me struggle to sympathise with Americans, outside of the 17% of eligible voters who voted Democratic in 2014.  5/6 of you chose this path.","False","0","8","AtomicKoala","t3_5p66zp","t5_2cneq","1486224449","null","null","0","1484960704","null","t1_dcp3385","False","dcp3a4k"
"politics","How were they voting in their own best interests..?  Even the ultra rich have a lot to lose from societal breakdown. They certainly have a lot to lose from the planned trade wars.","False","0","13","AtomicKoala","t3_5p7lla","t5_2cneq","1486224522","null","null","0","1484960905","null","t1_dcp2xdg","False","dcp3f76"
"politics","Top 5?  The man's weakness on Russia led to a Russian stooge becoming President.","False","0","2","AtomicKoala","t3_5p7u5v","t5_2cneq","1486224586","null","null","0","1484961080","null","t1_dcp2td1","False","dcp3jqh"
"politics","Too late to send the guilty GOP leaders to Gitmo I suppose.","False","0","5","AtomicKoala","t3_5p7s98","t5_2cneq","1486224618","null","null","0","1484961164","null","t1_dcp39pl","False","dcp3lyz"
"politics","Why did only 17% vote Democrat in 2014 then?  Clearly most of the country felt the country was too left wing in 2014.","False","0","3","AtomicKoala","t3_5p66zp","t5_2cneq","1486225332","null","null","0","1484963153","null","t1_dcp4lcf","False","dcp4zsd"
"politics","Authoritarian ultranationalists often support stuff like this. They just fail to fund it.","False","0","3","AtomicKoala","t3_5p5kng","t5_2cneq","1486225361","null","null","0","1484963237","null","t1_dcp0lv5","False","dcp51tx"
"politics","Eh why didn't more vote democrat then?","False","0","0","AtomicKoala","t3_5p66zp","t5_2cneq","1486232584","null","null","0","1484990642","null","t1_dcp6t0w","1484996362","dcpj978"
"politics","Why the fuck were they BoBers then?","False","0","14","AtomicKoala","t3_5p869f","t5_2cneq","1486232604","null","null","0","1484990755","null","t1_dcp9vnx","False","dcpjaj3"
"politics","Texas had just 51% turnout this year.","False","0","1","AtomicKoala","t3_5p6qh4","t5_2cneq","1486233023","null","null","0","1484993496","null","t1_dcp94gj","False","dcpk549"
"politics","Voting does matter.  40k more Democratic votes in Colorado, 50k in NC and 6k more in Alaska, and Democrats still would control the Senate.  Instead, Democrats under-performed polling by over 5% in 2014, as Democrats don't turn out. ","False","0","10","AtomicKoala","t3_5p888s","t5_2cneq","1486233431","null","null","0","1484996279","null","t1_dcp8u3r","False","dcpkyw8"
"politics","It works far better. The US is an omnishambles.","False","0","3","AtomicKoala","t3_5p7wjc","t5_2cneq","1486234481","null","null","0","1485003095","null","t1_dcpj38l","False","dcpn2sj"
"politics","It's sad but in that sort of scenario it's best to let them go before they reach an age they make connections with so many people. With a GOP federal trifecta that situation is hopeless. Too much pain to fight that.","False","0","-1","AtomicKoala","t3_5p8422","t5_2cneq","1486235680","null","null","0","1485008695","null","t1_dcpcn24","False","dcpphlt"
"politics","36% turnout, Democrats got 45% of the federal House vote.","False","0","1","AtomicKoala","t3_5p66zp","t5_2cneq","1486237936","null","null","0","1485016095","null","t1_dcppz3l","False","dcpty9d"
"politics","So the 4 million vote lead she had in the primaries was what?","False","0","1","AtomicKoala","t3_5p66zp","t5_2cneq","1486237949","null","null","0","1485016134","null","t1_dcpp7r8","False","dcptza0"
"politics","Well TPP was the renegotiation of NAFTA. ","False","0","2","AtomicKoala","t3_5pb714","t5_2cneq","1486238569","null","null","0","1485017807","null","t1_dcpuybv","False","dcpv6ke"
"politics","My point is that Trump would be less powerful in that situation. Thus people could have done more to stop this.","False","0","1","AtomicKoala","t3_5p888s","t5_2cneq","1486239058","null","null","0","1485019119","null","t1_dcpvusj","False","dcpw4ra"
"politics","That's actually a nice tune which would be harmless except for the territorial claims.  *Über alles* referred to German unification, it was the most important goal.","False","0","7","AtomicKoala","t3_5pbub9","t5_2cneq","1486240831","null","null","0","1485023839","null","t1_dcpyiax","False","dcpzmip"
"politics","Where's your evidence this is what the songwriters wanted?","False","0","1","AtomicKoala","t3_5pbub9","t5_2cneq","1486241019","null","null","0","1485024335","null","t1_dcpzqc5","False","dcq00j3"
"politics","Because you need to us Europeans that we haven't lost you.","False","0","1","AtomicKoala","t3_5p888s","t5_2cneq","1486241034","null","null","0","1485024371","null","t1_dcpwcwo","False","dcq01l3"
"politics","http://www.electproject.org/2014g   http://history.house.gov/Institution/Election-Statistics/Election-Statistics/","False","0","1","AtomicKoala","t3_5p66zp","t5_2cneq","1486241047","null","null","0","1485024405","null","t1_dcpyyh1","False","dcq02kq"
"politics","What's the alternative here? You're right, screenings could allow for early treatment when cancer recurs. But there's no scope for them to have government ensured care for their child now.   One day their gofundme will fail, but maybe when he's 20 and made connections with so many people and already suffered so much.   ","False","0","0","AtomicKoala","t3_5p8422","t5_2cneq","1486241132","null","null","0","1485024632","null","t1_dcq01au","False","dcq08v1"
"politics","Well I think he was more of a positive imperialist, a la Napoleon who greatly improved Europe with his wars. Ask some Czech Jews.","False","0","3","AtomicKoala","t3_5paklw","t5_2cneq","1486241185","null","null","0","1485024774","null","t1_dcpxyh5","False","dcq0cq2"
"politics","And Bannon/Flynn.","False","0","3","AtomicKoala","t3_5paklw","t5_2cneq","1486241359","null","null","0","1485025252","null","t1_dcpr46j","False","dcq0pok"
"politics","With say, Christie, Trump would have lost the EC.","False","0","3","AtomicKoala","t3_5payx2","t5_2cneq","1486241489","null","null","0","1485025599","null","t1_dcq0qnk","False","dcq0zdu"
"politics","Nixon was a smart centre right politician with a lot of experience.","False","0","6","AtomicKoala","t3_5payx2","t5_2cneq","1486241515","null","null","0","1485025670","null","t1_dcpvyfo","False","dcq11er"
"politics","In all fairness Saddam's government was getting them killed anyway by refusing to respond appropriately to sanctions.","False","0","-1","AtomicKoala","t3_5payx2","t5_2cneq","1486241547","null","null","0","1485025757","null","t1_dcpuv56","False","dcq13s9"
"politics","It would be good to see Democrats get behind a social conservative like Tulsi.","False","0","-1","AtomicKoala","t3_5payx2","t5_2cneq","1486241569","null","null","0","1485025817","null","t1_dcpytlw","False","dcq15fl"
"politics","Well if they felt the country wasn't left enough more than 17% would have voted Democrat, no?  Could you point to a race where the Democrat option was more right wing than the GOP alternative? The TN race?","False","0","1","AtomicKoala","t3_5p66zp","t5_2cneq","1486241763","null","null","0","1485026327","null","t1_dcq17fx","False","dcq1jx7"
"politics","Because they needed him to win? Manafort enforced Pence for a reason.","False","0","1","AtomicKoala","t3_5payx2","t5_2cneq","1486242334","null","null","0","1485027876","null","t1_dcq2ekl","False","dcq2qj4"
"politics","Crazy isn't it? Saddam was a horrible, evil man.","False","0","1","AtomicKoala","t3_5payx2","t5_2cneq","1486242341","null","null","0","1485027895","null","t1_dcq1ui6","False","dcq2r12"
"politics","Because he isn't annexing neighbours, starving his people, is friendly with the West etc?","False","0","1","AtomicKoala","t3_5payx2","t5_2cneq","1486257860","null","null","0","1485076800","null","t1_dcq33oi","False","dcqy3qi"
"politics","That apathy reflects them not having a strong desire to want the country to change in a leftwards direction. They knew Democrats were likely to lose the Senate.","False","0","1","AtomicKoala","t3_5p66zp","t5_2cneq","1486257872","null","null","0","1485076870","null","t1_dcq2zgt","False","dcqy4lg"
"politics","Except the far right is very weak in Ukraine.  But Russian media will make it sound like they're running the country. ","False","0","1","AtomicKoala","t3_5pcpga","t5_2cneq","1486258096","null","null","0","1485078189","null","t1_dcqjwom","False","dcqykrj"
"politics","I'm glad to hear that. You need to ensure the police are on your side now.","False","0","3","AtomicKoala","t3_5pe7zb","t5_2cneq","1486258193","null","null","0","1485078808","null","t1_dcqtfig","False","dcqys0n"
"politics","If the centre right votes for the far right over the centre left, they're probably not centre right.","False","0","3","AtomicKoala","t3_5pc6gp","t5_2cneq","1486258317","null","null","0","1485079571","null","t1_dcqp22i","False","dcqz0tl"
"politics","Well Cruz was the alternative. Better than Trump, sure. But it'll take more for them to feel regret.","False","0","2","AtomicKoala","t3_5pex01","t5_2cneq","1486258365","null","null","0","1485079869","null","t1_dcqnvf6","False","dcqz4be"
"politics","And what happened in 2010?  The left doesn't vote.","False","0","6","AtomicKoala","t3_5pex01","t5_2cneq","1486258374","null","null","0","1485079926","null","t1_dcqre3p","False","dcqz4ze"
"politics","Hi t was state incarceration that increased, not federal.","False","0","2","AtomicKoala","t3_5pbwpf","t5_2cneq","1486258515","null","null","0","1485080836","null","t1_dcqjba4","False","dcqzfj2"
"politics","So he's going to sign the TPP, the renegotiation of NAFTA?","False","0","0","AtomicKoala","t3_5pg6jn","t5_2cneq","1486258554","null","null","0","1485081096","null","t3_5pg6jn","False","dcqzids"
"politics","Bannon probably knew.","False","0","11","AtomicKoala","t3_5pfjup","t5_2cneq","1486258568","null","null","0","1485081183","null","t1_dcqwvit","False","dcqzje6"
"politics","Is that really the priority now? Us Europeans just want America back. Fight the GOP.","False","0","-1","AtomicKoala","t3_5pcl29","t5_2cneq","1486258608","null","null","0","1485081446","null","t1_dcqlwnl","False","dcqzme8"
"politics","That's illogical until you move away from FPTP Presidential systems at state and federal level.","False","0","1","AtomicKoala","t3_5pcl29","t5_2cneq","1486258617","null","null","0","1485081504","null","t1_dcqis51","False","dcqzn2j"
"politics","Reagan Democrats were the racially anxious types who voted for Trump.","False","0","1","AtomicKoala","t3_5pcl29","t5_2cneq","1486258622","null","null","0","1485081539","null","t1_dcqf061","False","dcqznha"
"politics","What progressive uprising? If Feingold can't win in Wisconsin, the Democratic party can't push out moderates. They already pushed out conservatives.","False","0","0","AtomicKoala","t3_5pcl29","t5_2cneq","1486258638","null","null","0","1485081638","null","t1_dcq5mj1","False","dcqzold"
"politics","Sure, but the point is that Mexico and Canada are parties to the TPP.  Because of that there was no need to modernise NAFTA.  OTOH, we're looking at modernising the EU-Mecico FTA.","False","0","0","AtomicKoala","t3_5pg6jn","t5_2cneq","1486258754","null","null","0","1485082401","null","t1_dcqzm4g","False","dcqzx8o"
"politics","Oh. I suppose O'Malley might have had a better chance.","False","0","1","AtomicKoala","t3_5pex01","t5_2cneq","1486259956","null","null","0","1485089836","null","t1_dcr284a","False","dcr2cpk"
"politics","Yats is far right..?","False","0","1","AtomicKoala","t3_5pcpga","t5_2cneq","1486261307","null","null","0","1485095918","null","t1_dcr443q","False","dcr525l"
"politics","Well sure. Thus if they can't vote for the best of two options there's no point pursuing them.","False","0","1","AtomicKoala","t3_5pex01","t5_2cneq","1486262292","null","null","0","1485099282","null","t1_dcr6t3h","False","dcr70wc"
"politics","Blaming education is what the GOP wants.  Education can only do so much when the problem is far right radicalisation.","False","0","1","AtomicKoala","t3_5phg2u","t5_2cneq","1486263346","null","null","0","1485102259","null","t1_dcr70b2","False","dcr94q0"
"politics","Yup, us Europeans are fucked, got to stick together and move more troops to the border countries.","False","0","10","AtomicKoala","t3_5phnq8","t5_2cneq","1486266378","null","null","0","1485110179","null","t1_dcr9wgm","False","dcrf9x4"
"politics","He is a man though at least. Wouldn't a short man be a better bet than a woman?","False","0","5","AtomicKoala","t3_5phkx7","t5_2cneq","1486266556","null","null","0","1485110636","null","t1_dcrf1js","False","dcrfmw0"
"politics","It meant Democrats lost badly in midterms as they felt they didn't need conservative voters in Presidential elections however. The culmination of that was Hillary doing stupid things like strongly defending abortion rights.","False","0","2","AtomicKoala","t3_5pgv54","t5_2cneq","1486266664","null","null","0","1485110913","null","t1_dcr6q9b","False","dcrfur6"
"politics","Not really. It was two coin flips.    /u/alienbringer's point is fair. It was irresponsible to vote third party for President in Georgia or Wisconsin, but not in Maryland.","False","0","4","AtomicKoala","t3_5pgv54","t5_2cneq","1486266815","null","null","0","1485111298","null","t1_dcrdjw9","False","dcrg5qb"
"politics","I mean she made a lot of mistakes. Ran too far to the left, didn't take out Sanders aggressively, was idiotic on gun rights, but does that deprive people of the responsibility to vote logically?","False","0","-1","AtomicKoala","t3_5pgv54","t5_2cneq","1486266888","null","null","0","1485111483","null","t1_dcrf81y","False","dcrgb3h"
"politics","That's the point.  Someone who doesn't know something is in a better place than someone who has an incorrect belief about it.","False","0","1","AtomicKoala","t3_5pfazo","t5_2cneq","1486267076","null","null","0","1485111954","null","t1_dcra9kj","False","dcrgojn"
"politics","Trump is obsessed with the size of his hands.","False","0","10","AtomicKoala","t3_5pgxlj","t5_2cneq","1486267329","null","null","0","1485112604","null","t1_dcrcifi","False","dcrh746"
"politics","Better than winning with Trump.","False","0","1","AtomicKoala","t3_5pey3o","t5_2cneq","1486267429","null","null","0","1485112855","null","t1_dcrh9n7","False","dcrhed1"
"politics","Only 12% of eligible millennials voted Democrat in 2014. These people need to wake the fuck up and start caring about their country and the wider world.","False","0","2","AtomicKoala","t3_5phblf","t5_2cneq","1486268831","null","null","0","1485116372","null","t1_dcrejkc","False","dcrk85e"
