"link_id","subreddit_id","retrieved_on","author_flair_css_class","author_flair_text","controversiality","subreddit","body","stickied","gilded","score","author","id","edited","parent_id","distinguished","created_utc"
"t3_5mg4nh","t5_2cneq","1485837678","null","null","0","politics","That's disturbing.  Remember when he said it was rigged?","False","0","40","DiscoConspiracy","dc3ezol","False","t1_dc3d0qw","null","1483740540"
"t3_5mg4nh","t5_2cneq","1485837714","null","null","1","politics","Eight, possibly sixteen years.","False","0","-2","DiscoConspiracy","dc3f2dg","False","t1_dc3cq8s","null","1483740629"
"t3_5mg4nh","t5_2cneq","1485837846","null","null","0","politics","I think people are still way too focused on Benghazi to worry about that.","False","0","9","DiscoConspiracy","dc3fccj","False","t1_dc3e34h","null","1483740972"
"t3_5mg4nh","t5_2cneq","1485838030","null","null","0","politics","I guess we're going to start impeachment proceedings on Obama now.","False","0","0","DiscoConspiracy","dc3fpxe","False","t1_dc3cati","null","1483741435"
"t3_5mg4nh","t5_2cneq","1485838207","null","null","0","politics","Unless you rationalize it away, you're going to have a hard time if the truth comes out and it's not in your favor.  I'm fine with being wrong.  Are you? You seem very passionate about being right in this matter.  Here are some more links:  >WikiLeaks ready to drop a bombshell on Russia. But will Russians get to read about it?  https://mobile.twitter.com/wikileaks/status/28800256698  Russia’s FSB to WikiLeaks: We could destroy you  http://foreignpolicy.com/2010/11/01/russias-fsb-to-wikileaks-we-could-destroy-you/  Now, I've seen some Russia stuff on Wikileaks but I don't know how old they are.  And I apologize if the Foreign Policy link brings up a paywall.  You can access it through a Google search.  But why is everything Assange seems to be doing about the U.S. and its allies? Doesn't he have other targets?  Any guesses as to what China would do and how they would react if Wikileaks tries to leak something on them? There are Chinese nationals all over the world who have uncensored Internet.  Perhaps if the Trump-Putin alliance comes through against China, maybe then and only then will Wikileaks start focusing on China.  Of course, anyone who believes this is a possibility might be overstating how trustworthy Putin's Russia is and understating the economic ties China and U.S. has.","False","0","1","DiscoConspiracy","dc3g35x","False","t1_dc3djzi","null","1483741880"
"t3_5mf43b","t5_2cneq","1485839025","null","null","0","politics","There is no proof.","False","0","2","DiscoConspiracy","dc3hs5p","False","t1_dc3gxiy","null","1483743991"
"t3_5mg4nh","t5_2cneq","1485839055","null","null","0","politics","Eww.  I could only stand to watch for like a second.  Person needs a hijab.  Or even a burka.  I don't care if it's hot out there.  People should just not be dressed on beaches like that.","False","0","1","DiscoConspiracy","dc3hugb","False","t1_dc3gw57","null","1483744073"
"t3_5mg4nh","t5_2cneq","1485839101","null","null","0","politics","Stresses of the job?","False","0","2","DiscoConspiracy","dc3hxu2","False","t1_dc3hu0t","null","1483744196"
"t3_5mg4nh","t5_2cneq","1485839625","null","null","0","politics","Ah.  What makes you certain?  But you may be right.  Anyone in the GOP, Trump included, who ever went to Russia may have been subjected to security camera footage.","False","0","3","DiscoConspiracy","dc3j10b","False","t1_dc3d6oj","null","1483745614"
"t3_5mg4nh","t5_2cneq","1485839657","null","null","0","politics","He would still be President, though.  That ship has sailed.  He, his cabinet, and his supporters cut ties to Russia and we're good.","False","0","2","DiscoConspiracy","dc3j3eh","False","t1_dc3cvz8","null","1483745699"
"t3_5mg4nh","t5_2cneq","1485839678","null","null","0","politics","Do you think Putin, Erdogan, and Duterte will be my friend? I really want them to be my friend.","False","0","1","DiscoConspiracy","dc3j512","False","t1_dc3eipw","null","1483745757"
"t3_5mg4nh","t5_2cneq","1485839696","null","null","0","politics","Not written like a politician.  They shouldn't have used the term liberal democratic order.  Especially liberal.","False","0","0","DiscoConspiracy","dc3j6d9","False","t1_dc3blyy","null","1483745805"
"t3_5mg4nh","t5_2cneq","1485839969","null","null","0","politics","Is that why Wikileaks upped the reward for people to find more dirt on the Obama administration, well beyond the point it should matter?  ~~So tell me.  If Assange WAS or IS a Russian asset, how would you feel?~~","False","0","1","DiscoConspiracy","dc3jqmw","False","t1_dc3jm1a","null","1483746534"
"t3_5mg4nh","t5_2cneq","1485840036","null","null","0","politics","I saw that more as sarcasm, really.  But one can never know for sure.","False","0","7","DiscoConspiracy","dc3jvm8","False","t1_dc3jge9","null","1483746712"
"t3_5mg4nh","t5_2cneq","1485840115","null","null","0","politics","When Hillary said she would accept the result of the election, I remember worrying that maybe it was not the right move.  She could have made a careful response that gives her an out if something like election tampering or outright foreign tampering happened.  I remember thinking about this around the time I got pretty concerned Russia was going to try something.","False","0","5","DiscoConspiracy","dc3k1ll","False","t1_dc3juak","null","1483746929"
"t3_5mg4nh","t5_2cneq","1485840146","null","null","0","politics","> Assange is a hero for all humanity for standing up to the Obama administration.  So Wikileaks has targeted the Obama administration, or is just publishing what they received only and not targeting anyone?","False","0","1","DiscoConspiracy","dc3k3t0","False","t1_dc3jyq2","null","1483747009"
"t3_5mg4nh","t5_2cneq","1485840277","null","null","0","politics","Nope.  Not until Russia subsidizes American welfare.","False","0","1","DiscoConspiracy","dc3kdn5","False","t1_dc3k9hw","null","1483747368"
"t3_5mg6is","t5_2cneq","1485840373","null","null","0","politics","I already know how this is going to go online.  Still no evidence.  Doesn't matter.  He won.  Get over it.  Russia did the U.S. a service.  Long live Mother Russia.  Edit: I forgot about whataboutism!","False","0","16","DiscoConspiracy","dc3kkq1","1483747984","t3_5mg6is","null","1483747632"
"t3_5mg6is","t5_2cneq","1485840448","null","null","0","politics","Is Trump writing and overseeing his own media statements?","False","0","5","DiscoConspiracy","dc3kqd7","False","t1_dc3jhn4","null","1483747849"
"t3_5meisp","t5_2cneq","1485840562","null","null","0","politics","So when will Russia give us free and/or affordable health care for all? Does anyone know?","False","0","5","DiscoConspiracy","dc3kyt6","False","t1_dc3k6lu","null","1483748165"
"t3_5meisp","t5_2cneq","1485840661","null","null","0","politics","Really, if he's in some way working for the Russian government it--directly or indirectly--we might be at a point where he can just admit it and get away with it.  We have several loyal Comrades in the U.S. and around the world who would cheer him on.","False","0","1","DiscoConspiracy","dc3l6d8","False","t1_dc3bevx","null","1483748451"
"t3_5meisp","t5_2cneq","1485840684","null","null","0","politics","What ever happened to Assange?","False","0","1","DiscoConspiracy","dc3l82a","False","t1_dc3atgo","null","1483748514"
"t3_5meisp","t5_2cneq","1485840715","null","null","0","politics","> the dictator  Putin?   I believe the correct term is Autocrat.  Or maybe Oligarch.  Or, you can just call him the People's Man.","False","0","1","DiscoConspiracy","dc3labo","False","t1_dc3jwf6","null","1483748596"
"t3_5meisp","t5_2cneq","1485840781","null","null","0","politics","Where's the proof?","False","0","2","DiscoConspiracy","dc3lfap","False","t1_dc352pc","null","1483748782"
"t3_5mg4nh","t5_2cneq","1485840815","null","null","0","politics","Did Putin swear the Oath of Office for President?","False","0","1","DiscoConspiracy","dc3lhw3","False","t1_dc3lewm","null","1483748882"
"t3_5mg4nh","t5_2cneq","1485840962","null","null","0","politics","How do we know Russia didn't do it to tie up loose ends?","False","0","2","DiscoConspiracy","dc3lsz3","False","t1_dc3kqh2","null","1483749306"
"t3_5mg4nh","t5_2cneq","1485841083","null","null","0","politics","Ultimately, Putin gets what he wants.  Always.  France and Canada are screwed.  They should start considering Russian as their second language and have an open border policy with Russia to bring in as many Russian tourists as possible.","False","0","1","DiscoConspiracy","dc3m1zf","False","t1_dc3imm2","null","1483749651"
"t3_5mg4nh","t5_2cneq","1485841101","null","null","0","politics","US oil assets are now Russian assets!","False","0","1","DiscoConspiracy","dc3m3cd","False","t1_dc3ig6y","null","1483749703"
"t3_5mg4nh","t5_2cneq","1485841147","null","null","0","politics","Their team won.  End of story.  The details don't matter.  Outcome-oriented.","False","0","2","DiscoConspiracy","dc3m6pk","False","t1_dc3lnhu","null","1483749833"
"t3_5mg4nh","t5_2cneq","1485841220","null","null","0","politics","If there are any Russian agents in this sub, I hope they have very awesome spy action thriller-type moves.  Or are at least good at cards.","False","0","1","DiscoConspiracy","dc3mc6z","False","t1_dc3i3m7","null","1483750042"
"t3_5mg4nh","t5_2cneq","1485841252","null","null","0","politics","I agree.  I'm pretty sure it's an existential matter for them.","False","0","2","DiscoConspiracy","dc3mele","False","t1_dc3jsa6","null","1483750136"
"t3_5mg4nh","t5_2cneq","1485841581","null","null","0","politics","He might have supporters that want that.  There would be some irony in it, since I believe Republicans put in term limits after FDR and probably would have fought term extensions for any Democrat.  I'm worried about Republicans consolidating power and basically making elections meaningless or somehow One Party only.","False","0","1","DiscoConspiracy","dc3n379","False","t1_dc3my2k","null","1483751105"
"t3_5meisp","t5_2cneq","1485843160","null","null","0","politics","Nevermind, looks like you already got it.  Whether it's proof or proof is another matter.","False","0","1","DiscoConspiracy","dc3qdj4","False","t1_dc3q670","null","1483755803"
"t3_5mg6is","t5_2cneq","1485845276","null","null","0","politics","I thought those were volunteers.  Were they not?","False","0","1","DiscoConspiracy","dc3urwq","False","t1_dc3unfu","null","1483762515"
"t3_5mg6is","t5_2cneq","1485845285","null","null","0","politics","no wai","False","0","2","DiscoConspiracy","dc3uslp","False","t1_dc3uk3h","null","1483762547"
"t3_5mg6is","t5_2cneq","1485845293","null","null","0","politics","Is too.  Try page 8ish of your pdf.","False","0","3","DiscoConspiracy","dc3ut8j","False","t1_dc3uh9m","null","1483762576"
"t3_5mg6is","t5_2cneq","1485845400","null","null","0","politics","Would traitor have to apply to only enemies we are at war with? How does that definition work in today's world?","False","0","1","DiscoConspiracy","dc3v18p","False","t1_dc3togq","null","1483762937"
"t3_5mg6is","t5_2cneq","1485845428","null","null","0","politics","Everyone was asking for proof, though.  Perhaps the mistake was in assuming people would accept it without more detail.","False","0","8","DiscoConspiracy","dc3v3bc","False","t1_dc3thqw","null","1483763030"
"t3_5mg6is","t5_2cneq","1485845462","null","null","0","politics","As vindictive as some of those on the Right are, and how much their pride might have been damaged that they lost two elections, I'm worried Obama might be facing trumped up charges and endless scandals once he is out of office.  I remember Ken Starr.","False","0","1","DiscoConspiracy","dc3v5u9","False","t1_dc3tz4x","null","1483763154"
"t3_5mg6is","t5_2cneq","1485845496","null","null","0","politics","Do you remember Watergate? Why did that happen, and do you agree with it?","False","0","1","DiscoConspiracy","dc3v8g7","False","t1_dc3t56c","null","1483763275"
"t3_5mg6is","t5_2cneq","1485845514","null","null","0","politics","Period.  That's it for us.  The U.S. is done.  gg all.","False","0","1","DiscoConspiracy","dc3v9sl","False","t1_dc3u7of","null","1483763340"
"t3_5mg6is","t5_2cneq","1485845556","null","null","0","politics","Or, perhaps more accurately unless we can conclusively show Hillary would have won had it not been for Putin's meddling:  *was elected within the BACKDROP of heavy Putin influence.","False","0","1","DiscoConspiracy","dc3vcyq","False","t1_dc3thm6","null","1483763490"
"t3_5mg6is","t5_2cneq","1485845585","null","null","0","politics","I think the story is that he would be more friendly to Putin, drop sanctions, and encourage the breakup of NATO by asking them for protection money.","False","0","1","DiscoConspiracy","dc3vexs","False","t1_dc3sj9t","null","1483763582"
"t3_5mg6is","t5_2cneq","1485845627","null","null","0","politics","I've seen political cartoons from probably somewhere near Russia depicting China and Russia fighting side by side against evil imperialists.  I'm worried.  Rather worried.","False","0","1","DiscoConspiracy","dc3vi5u","False","t1_dc3s8se","null","1483763733"
"t3_5mg6is","t5_2cneq","1485845638","null","null","0","politics","That's a bridge too far for those with too much pride to lose.  We can hope there is a significant contingent in Congress, that are Republicans, who will actively protect us and help us with our concerns.","False","0","1","DiscoConspiracy","dc3vj0f","False","t1_dc3s8f2","null","1483763773"
"t3_5mg6is","t5_2cneq","1485845678","null","null","0","politics","Our new Russian overlords will give us free stuff. Be happy.  Be praise.  Love, and Live, Mother Russia.","False","0","1","DiscoConspiracy","dc3vlyo","False","t1_dc3rx0f","null","1483763913"
"t3_5mg6is","t5_2cneq","1485845707","null","null","0","politics","Yup, we received an unclassified assessment I believe.  The document(s) that are classified and have more evidence will apparently remain.","False","0","1","DiscoConspiracy","dc3vo4y","False","t1_dc3vbzp","null","1483764018"
"t3_5mg6is","t5_2cneq","1485845742","null","null","0","politics","We did talk a bit about Russia before the elections, though.","False","0","1","DiscoConspiracy","dc3vqpr","False","t1_dc3t6io","null","1483764140"
"t3_5mg6is","t5_2cneq","1485845751","null","null","0","politics",">That aside if Hilary didn't have anything to hide in the first place then maybe she would be president elect right now and not Trump.  Nope.  A Clinton. Not going to happen on conservatives' watch.","False","0","1","DiscoConspiracy","dc3vrff","False","t1_dc3rmf7","null","1483764175"
"t3_5mg6is","t5_2cneq","1485845802","null","null","0","politics","Russia 1st Policy! Glorious, Glorious Mother Russia!","False","0","1","DiscoConspiracy","dc3vv8r","False","t1_dc3r11u","null","1483764356"
"t3_5mg6is","t5_2cneq","1485845817","null","null","0","politics","I think you mean GREYcoats.","False","0","1","DiscoConspiracy","dc3vwbf","False","t1_dc3sy8r","null","1483764406"
"t3_5mg6is","t5_2cneq","1485845830","null","null","0","politics","I really worry for our intelligence assets going forward.  Especially going forward.  Who can you trust?","False","0","2","DiscoConspiracy","dc3vxbb","False","t1_dc3sz9l","null","1483764454"
"t3_5mg6is","t5_2cneq","1485845856","null","null","0","politics","Snuggin it up in the Kremlin.","False","0","1","DiscoConspiracy","dc3vz8i","False","t1_dc3r8ua","null","1483764545"
"t3_5mg6is","t5_2cneq","1485845899","null","null","0","politics","We all know what the TRUE conspiracy is, here.","False","0","1","DiscoConspiracy","dc3w2jh","False","t1_dc3rv5v","null","1483764701"
"t3_5mg6is","t5_2cneq","1485846000","null","null","0","politics","Federal open carry across the U.S.  It's happening!","False","0","1","DiscoConspiracy","dc3wa2y","False","t1_dc3qdzh","null","1483765059"
"t3_5mg6is","t5_2cneq","1485846069","null","null","0","politics","Well, depending on one's perspective it's sort of like the Dow hitting 19999 points and then falling again.","False","0","1","DiscoConspiracy","dc3wf8e","False","t1_dc3q0yf","null","1483765307"
"t3_5mg6is","t5_2cneq","1485846201","null","null","0","politics","> What evidence is in the report? I can't wait to get home and see this! Finally, the nail in the coffin, the smoking gun!  Depending on your perspective, you may or may not be disappointed.  Like giving up your hopes to see the Dow reach 20000, only to be disappointed that it wasn't going to happen today.","False","0","1","DiscoConspiracy","dc3wp4f","False","t1_dc3wknj","null","1483765787"
"t3_5mg6is","t5_2cneq","1485846226","null","null","0","politics","Do you happen to know of any Internet translator utilities that will appropriately turn certain key words into all capital letters? I think the Redditor who posted the herring needed it.","False","0","1","DiscoConspiracy","dc3wqyj","False","t1_dc3v3tn","null","1483765878"
"t3_5mg6is","t5_2cneq","1485846237","null","null","0","politics","What would Reagan have said?","False","0","1","DiscoConspiracy","dc3wrum","False","t1_dc3pfp6","null","1483765921"
"t3_5mg6is","t5_2cneq","1485846265","null","null","0","politics","I think you could probably run for office on a Pro-Putin agenda and get elected.  Until/if that starts to get looked down upon or made illegal, anyway.","False","0","1","DiscoConspiracy","dc3wtrf","False","t1_dc3p99k","null","1483766016"
"t3_5mg6is","t5_2cneq","1485846285","null","null","0","politics","Pay no attention behind the Red Curtain.","False","0","1","DiscoConspiracy","dc3wvb3","False","t1_dc3r0c6","null","1483766094"
"t3_5mg6is","t5_2cneq","1485846298","null","null","0","politics","> They'll gladly take the side of being lied to in order to murder brown people, and sucking Russia's dick.  That's a terrible way to go out.","False","0","1","DiscoConspiracy","dc3ww6t","False","t1_dc3p6x1","null","1483766136"
"t3_5mg6is","t5_2cneq","1485846350","null","null","0","politics","Remember the Appeasement policy leading up to WW II.","False","0","1","DiscoConspiracy","dc3x04u","False","t1_dc3pwbo","null","1483766325"
"t3_5mg6is","t5_2cneq","1485846373","null","null","0","politics","We should have seen it coming.","False","0","1","DiscoConspiracy","dc3x1tr","False","t1_dc3qndq","null","1483766407"
"t3_5mg6is","t5_2cneq","1485846397","null","null","0","politics","What do you suspect, if anything, happened to Wikileaks back in 2010?","False","0","1","DiscoConspiracy","dc3x3nf","False","t1_dc3wq6z","null","1483766499"
"t3_5mg6is","t5_2cneq","1485846406","null","null","0","politics","I read it.  Can I get where you interpreted that?","False","0","1","DiscoConspiracy","dc3x4bh","False","t1_dc3wmwv","null","1483766531"
"t3_5mg6is","t5_2cneq","1485846435","null","null","0","politics","http://www.politifact.com/punditfact/statements/2017/jan/06/jesse-watters/claim-john-podestas-email-password-was-password-la/  It's interesting how new this article is, though.  And could Podesta's password have been grandfathered in?","False","0","1","DiscoConspiracy","dc3x6i8","False","t1_dc3or4t","null","1483766639"
"t3_5mg6is","t5_2cneq","1485846442","null","null","0","politics","Putin always gets what he wants.  Always.  That seems to just be reality and a fact of life.  As real as us needing to breathe air.","False","0","1","DiscoConspiracy","dc3x71l","False","t1_dc3r4f4","null","1483766667"
"t3_5mg6is","t5_2cneq","1485846466","null","null","0","politics","Yup.  Assange has no ulterior motives.  Why would he? He has been 100% accurate, 100% truthful, 100% moral.","False","0","2","DiscoConspiracy","dc3x8sl","False","t1_dc3qtc3","null","1483766754"
"t3_5mg6is","t5_2cneq","1485846473","null","null","0","politics","You sure Russian agents couldn't have shot the staffer?","False","0","1","DiscoConspiracy","dc3x9ci","False","t1_dc3opvz","null","1483766782"
"t3_5mg6is","t5_2cneq","1485846492","null","null","0","politics","Well we are on REDdit.","False","0","1","DiscoConspiracy","dc3xatd","False","t1_dc3vw7z","null","1483766856"
"t3_5mg6is","t5_2cneq","1485846501","null","null","0","politics","Top minds, away!","False","0","1","DiscoConspiracy","dc3xbdm","False","t1_dc3r5hs","null","1483766885"
"t3_5mg6is","t5_2cneq","1485846530","null","null","1","politics","Also, ACORN.  Boogidy boo!","False","0","-3","DiscoConspiracy","dc3xdog","False","t1_dc3wobt","null","1483767006"
"t3_5mg6is","t5_2cneq","1485846574","null","null","0","politics","Government is the solution, not the problem!","False","0","1","DiscoConspiracy","dc3xgvb","False","t1_dc3qk9a","null","1483767167"
"t3_5mg6is","t5_2cneq","1485846607","null","null","0","politics","Maybe he even got the idea from Reddit.  We did it, Reddit! We had an influence.  We had an impact.  We had MEANING.","False","0","1","DiscoConspiracy","dc3xjd5","False","t1_dc3o13a","null","1483767292"
"t3_5mg6is","t5_2cneq","1485846635","null","null","0","politics","I disagree.  We would hear no end of it from Republicans.  Investigations would start immediately and publicly.","False","0","0","DiscoConspiracy","dc3xljw","False","t1_dc3nvos","null","1483767404"
"t3_5mg6is","t5_2cneq","1485846656","null","null","0","politics","Do you think Soros will be interested in being my friend?","False","0","2","DiscoConspiracy","dc3xn1h","False","t1_dc3qaq8","null","1483767481"
"t3_5mg6is","t5_2cneq","1485846696","null","null","0","politics","Sorry, no taskie backsies.  The deal is done.  All there is left is to try to minimize the damage.  I've already modified at least one aspect of my financial situation.  We may be in for it rough.","False","0","2","DiscoConspiracy","dc3xq3s","False","t1_dc3nu7f","null","1483767642"
"t3_5mg6is","t5_2cneq","1485846788","null","null","0","politics","I'd probably still take issue with it.","False","0","1","DiscoConspiracy","dc3xwyh","False","t1_dc3sna6","null","1483767998"
"t3_5mg6is","t5_2cneq","1485846823","null","null","0","politics","Oh and parts of Reddit REALLY hate Putin.  Like on a deep, personal level.  Like Putin came to their home and strangled their dog, with his bare hands, on the streets claiming he was just a Strong Man making Hard Choices.","False","0","1","DiscoConspiracy","dc3xzmh","False","t1_dc3n5je","null","1483768142"
"t3_5mg6is","t5_2cneq","1485846844","null","null","0","politics","Really worried about our intelligence assets going forward.","False","0","1","DiscoConspiracy","dc3y15f","False","t1_dc3o0bk","null","1483768222"
"t3_5mg6is","t5_2cneq","1485846852","null","null","0","politics","What, I thought that was only for baseball? Or does football have hot dogs too?","False","0","1","DiscoConspiracy","dc3y1rf","False","t1_dc3n3ll","null","1483768254"
"t3_5mg6is","t5_2cneq","1485846915","null","null","0","politics","What do you think Romney might have done to limit Russia?","False","0","0","DiscoConspiracy","dc3y6ij","False","t1_dc3ulbf","null","1483768502"
"t3_5mhrtt","t5_2cneq","1485846972","null","null","0","politics","Is there anything we can do about it?","False","0","1","DiscoConspiracy","dc3yat6","False","t1_dc3y9wi","null","1483768731"
"t3_5mhrtt","t5_2cneq","1485847165","null","null","0","politics","I don't know about Trump specifically, but who all got the classified report? I'm worried for our intelligence assets or anyone in Russia who might have had the gaul to stand up to Putin.","False","0","1","DiscoConspiracy","dc3yp81","False","t1_dc3yild","null","1483769516"
"t3_5mhrtt","t5_2cneq","1485847180","null","null","0","politics","I think you've got some quotes out of context.  And maybe even edited?  Sorta like how people just LOVED that supposed Russia-Obama handshake snub.  And the bowing stuff, even if other presidents have done it because it's traditional.  How is your Facebook feed right now?  Were you upset when Bush visited a mosque after 9/11? If this report is to be believed.  https://www.washingtonpost.com/news/the-fix/wp/2016/02/04/why-obamas-mosque-visit-is-criticized-in-a-way-george-w-bushs-wasnt/?utm_term=.a483b1be11e9","False","0","8","DiscoConspiracy","dc3yqc9","False","t1_dc3yef9","null","1483769578"
"t3_5mhrtt","t5_2cneq","1485847227","null","null","1","politics","Mainstream or LAMEstream?","False","0","-1","DiscoConspiracy","dc3ytv7","False","t1_dc3y14x","null","1483769771"
"t3_5mhrtt","t5_2cneq","1485847246","null","null","0","politics","You don't remember the Russia-Obama snub?  Note: If you're actually searching for it, it's on Youtube.  Try to look at the video first before reading the headline and find out what you see.","False","0","3","DiscoConspiracy","dc3yv9o","1483770077","t1_dc3yt7p","null","1483769849"
"t3_5mhrtt","t5_2cneq","1485847270","null","null","0","politics","This is appropriate:  http://i.imgur.com/VNHIV1M.jpg","False","0","2","DiscoConspiracy","dc3yx1y","False","t1_dc3w6he","null","1483769948"
"t3_5mhrtt","t5_2cneq","1485847278","null","null","0","politics","Yup.","False","0","1","DiscoConspiracy","dc3yxn3","False","t1_dc3yknf","null","1483769982"
"t3_5mhrtt","t5_2cneq","1485847321","null","null","0","politics","The video of him making the announcement was dramatic and goofy. It was meant for emotional effect.","False","0","5","DiscoConspiracy","dc3z0t9","False","t1_dc3wgrw","null","1483770160"
"t3_5mhrtt","t5_2cneq","1485847328","null","null","0","politics","Will our own assets be ok?  Will you tell me they'll be ok? Are they ok?","False","0","0","DiscoConspiracy","dc3z1bx","False","t1_dc3su96","null","1483770189"
"t3_5mhrtt","t5_2cneq","1485847360","null","null","0","politics","Who started the fire?","False","0","3","DiscoConspiracy","dc3z3qk","False","t1_dc3yc6s","null","1483770324"
