"link_id","subreddit_id","retrieved_on","author_flair_css_class","author_flair_text","controversiality","subreddit","body","stickied","gilded","score","author","id","edited","parent_id","distinguished","created_utc"
"t3_5p59su","t5_2cneq","1486219528","null","null","0","politics","Can one walk the entire way if they were just inaugurated and wanted to? Or is that not safe nor practical?","False","0","1","DiscoConspiracy","dcotoe9","False","t1_dcoshdi","null","1484948086"
"t3_5p59su","t5_2cneq","1486219588","null","null","0","politics","I also hope Trump succeeds for Team America, as he hinted at in his speech.  Not just Team Red.","False","0","1","DiscoConspiracy","dcotsqx","False","t1_dcotf47","null","1484948233"
"t3_5p3qf8","t5_2cneq","1486219659","null","null","0","politics","> Conspiracy time: This is all a ploy to make Mike Pence president.  I've been thinking about that, too.","False","0","1","DiscoConspiracy","dcotxtc","False","t1_dcoa1q9","null","1484948400"
"t3_5p3scb","t5_2cneq","1486220083","null","null","0","politics","16 years?","False","0","1","DiscoConspiracy","dcourgb","False","t1_dcog0es","null","1484949381"
"t3_5p3scb","t5_2cneq","1486220127","null","null","0","politics","Mother Russia is calling.  She wants her wayward children back.","False","0","1","DiscoConspiracy","dcouuhz","False","t1_dcoeobg","null","1484949482"
"t3_5mg6is","t5_2cneq","1486220150","null","null","0","politics","Why is that?","False","0","1","DiscoConspiracy","dcouw6u","False","t1_dc5pxmt","null","1484949538"
"t3_5p4w4d","t5_2cneq","1486221863","null","null","0","politics","Not just people, but those people.  Not. On. My. Dime!!!","False","0","0","DiscoConspiracy","dcoy8ln","False","t1_dcowytd","null","1484953793"
"t3_5p4w4d","t5_2cneq","1486221893","null","null","0","politics","E for Effort, though.","False","0","6","DiscoConspiracy","dcoyaps","False","t1_dcopucp","null","1484953874"
"t3_5p4w4d","t5_2cneq","1486221901","null","null","0","politics","We'd have insurrection and impeachments hearings in Congress on Day 1.","False","0","2","DiscoConspiracy","dcoybd5","False","t1_dconv1i","null","1484953898"
"t3_5p4w4d","t5_2cneq","1486221937","null","null","0","politics","Did Hillary do better in the Rust Belt back in 2008?","False","0","1","DiscoConspiracy","dcoydu3","False","t1_dcootw4","null","1484953991"
"t3_5p4w4d","t5_2cneq","1486221966","null","null","0","politics","President Donald J. Trump is going to lead ~~America~~ Russia to be great again.  Fixed.  Vodka for everyone! (other than religious or dry counties, then we won't force you to partake)","False","0","1","DiscoConspiracy","dcoyftd","False","t1_dcordl1","null","1484954063"
"t3_5p4w4d","t5_2cneq","1486222056","null","null","0","politics","What is going to happen when full automation happens and a very large proportion of American workers can no longer find work? Do we just abolish responsibility and just decide to ban or limit automation artificially, against economic common sense?","False","0","1","DiscoConspiracy","dcoym7t","False","t1_dcogon5","null","1484954299"
"t3_5p4w4d","t5_2cneq","1486222095","null","null","0","politics","You're going to be very disappointed (or maybe you have the means to not care) if insurance premiums don't lower even after repeal.","False","0","1","DiscoConspiracy","dcoyp0p","False","t1_dcoqnm7","null","1484954406"
"t3_5p4w4d","t5_2cneq","1486222119","null","null","0","politics","It's going to be the most fabulous, amazing bridge.  Plated with gold.  Built by hard-working Americans.  The People's People.","False","0","1","DiscoConspiracy","dcoyqsp","False","t1_dcoo10j","null","1484954473"
"t3_5p4w4d","t5_2cneq","1486222152","null","null","0","politics","> I feel sorry for he left that needs all of life handed to them, take no personal responsibility for anything,  Theoretically, if Russia came in and said that they would provide free, quality healthcare or insurance for all so long as we joined the Russian Federation, would you approve of this? As long as no handouts are given on your dime?","False","0","1","DiscoConspiracy","dcoyt03","False","t1_dcomhmm","null","1484954555"
"t3_5p4w4d","t5_2cneq","1486222211","null","null","0","politics","So what went wrong here? Why didn't Goldwater win? Could this happen again? Will certain interests allow it to happen, or will  they not allow it through all means necessary--whether illegal or unethical?  https://en.wikipedia.org/wiki/Barry_Goldwater#/media/File:ElectoralCollege1964.svg","False","0","1","DiscoConspiracy","dcoyx78","False","t1_dcoyloc","null","1484954711"
"t3_5p4w4d","t5_2cneq","1486222288","null","null","0","politics","Do you think he will imprison political opponents or restrict 1st amendment rights? Will we be Erdogan'd?","False","0","1","DiscoConspiracy","dcoz2ly","False","t1_dcoyro4","null","1484954908"
"t3_5p4w4d","t5_2cneq","1486222305","null","null","0","politics","Someone please tell me that Bernie still has a chance.","False","0","1","DiscoConspiracy","dcoz3qh","False","t1_dcodu74","null","1484954951"
"t3_5p59su","t5_2cneq","1486222561","null","null","0","politics","Any pic or videos of this? I missed it.  I hope he doesn't have it.  That would suck.  He ran for President too late.","False","0","1","DiscoConspiracy","dcozlq4","False","t1_dcoytox","null","1484955619"
"t3_5p59su","t5_2cneq","1486222588","null","null","0","politics","It's very important for certain Republicans to stick it to those people.  Those LEECHES.","False","0","3","DiscoConspiracy","dcoznpk","False","t1_dcozeu2","null","1484955693"
"t3_5p59su","t5_2cneq","1486222648","null","null","0","politics","Russia.  ACORN.","False","0","1","DiscoConspiracy","dcozrrf","False","t1_dcoxyb3","null","1484955846"
"t3_5p3s9c","t5_2cneq","1486222887","null","null","0","politics","Why not 16 years?","False","0","0","DiscoConspiracy","dcp08m4","False","t1_dcozo6o","null","1484956490"
"t3_5p4w4d","t5_2cneq","1486222960","null","null","0","politics","Would you be interested in completely signing away American sovereignty to the Russian Federation, in exchange for free healthcare for all, so long as it is not on your dime?","False","0","1","DiscoConspiracy","dcp0do9","False","t1_dcp0b5f","null","1484956686"
"t3_5p59su","t5_2cneq","1486222990","null","null","0","politics","Not this election, but previous one.  Did a certain past POTUS that we recently have win both the Electoral College and Popular Vote? Why did that happen? Were mistakes made? Who made those mistakes? Should we just find ways to keep Democrats from voting so no further mistakes happen?","False","0","1","DiscoConspiracy","dcp0fqs","False","t1_dcp0clc","null","1484956765"
"t3_5p4tc8","t5_2cneq","1486223145","null","null","0","politics","Heavy Metal Jebus.","False","0","1","DiscoConspiracy","dcp0qne","False","t1_dcogdmd","null","1484957184"
"t3_5p4e84","t5_2cneq","1486223224","null","null","0","politics","It's more important to stick it to those people instead of getting a handout.","False","0","1","DiscoConspiracy","dcp0vzj","False","t1_dcof5zr","null","1484957387"
"t3_5p5onr","t5_2cneq","1486223259","null","null","0","politics","Bye NAFTA and the world.  This relationship is just not working out anymore.  I'm writing a note now.  --the U.S.","False","0","0","DiscoConspiracy","dcp0yfe","False","t1_dcozi01","null","1484957475"
"t3_5p5onr","t5_2cneq","1486223274","null","null","0","politics","I'm literally shaking right now.","False","0","4","DiscoConspiracy","dcp0zik","False","t1_dcorbjt","null","1484957517"
"t3_5p5onr","t5_2cneq","1486223521","null","null","0","politics","Followed by Apocalypse and the heralding of Jesus's arrival?","False","0","0","DiscoConspiracy","dcp1gqm","False","t1_dcozawy","null","1484958157"
"t3_5p4w4d","t5_2cneq","1486223548","null","null","0","politics","Glad to hear it.  This implies this hypothetical is impossible.  Because I'd rather our journalists not get imprisoned or killed on a daily basis and opposition web sites and people hacked or harassed.","False","0","1","DiscoConspiracy","dcp1ik5","False","t1_dcp1f38","null","1484958224"
"t3_5p59su","t5_2cneq","1486223608","null","null","0","politics","gg America  gg","False","0","1","DiscoConspiracy","dcp1msj","False","t1_dcp1ev8","null","1484958383"
"t3_5p7rgn","t5_2cneq","1486224132","null","null","0","politics","Guess I was right in that possibly, maybe, all Exec Orders will not be posted anywhere and be kept secret.  This means he could remove the sanctions from Russia, perhaps, and no one will know it until it's too late.","False","0","13","DiscoConspiracy","dcp2o28","False","t3_5p7rgn","null","1484959829"
"t3_5p7rgn","t5_2cneq","1486224164","null","null","0","politics","A golden age where Russia comes before America, and Russia rises again instead of the South.  Make America Russia Again.","False","0","2","DiscoConspiracy","dcp2q8x","False","t1_dcp2lyz","null","1484959916"
"t3_5p59su","t5_2cneq","1486224222","null","null","0","politics","16 years.","False","0","1","DiscoConspiracy","dcp2uah","False","t1_dcp0b4q","null","1484960075"
"t3_5p5onr","t5_2cneq","1486224370","null","null","0","politics","I don't think I've heard Trump use this argument, just saying that NAFTA was a great deal for everyone but the U.S.  He should point it out that it was bad for other countries, too!","False","0","1","DiscoConspiracy","dcp34kh","False","t1_dcp318y","null","1484960480"
"t3_5p4gn3","t5_2cneq","1486224501","null","null","0","politics","Is this where we take the possibly Republican and/or conservative and say it's ok, that this is just investigative journalism, and it's good that the hackers exposed this? While those that were thankful for the DNC leaks take the exact opposite stance that they did before, with some sort of rationalization that they were always going to do anyway?","False","0","1","DiscoConspiracy","dcp3dvl","False","t3_5p4gn3","null","1484960852"
"t3_5p7rgn","t5_2cneq","1486224609","null","null","0","politics","The comment before me was deleted.  Did I scare the person away? Am I stronk, like Bear?","False","0","2","DiscoConspiracy","dcp3lap","False","t1_dcp3eau","null","1484961139"
"t3_5p6qh4","t5_2cneq","1486224884","null","null","0","politics","Can this be Exec Ordered away?","False","0","1","DiscoConspiracy","dcp44n8","False","t3_5p6qh4","null","1484961892"
"t3_5p59su","t5_2cneq","1486226287","null","null","0","politics","It's kinda cringe.","False","0","1","DiscoConspiracy","dcp6vh8","False","t1_dcp5v4c","null","1484965923"
"t3_5p59su","t5_2cneq","1486226318","null","null","0","politics","I read it.  I do not understand it.  It's worse than those cleverly written state amendments on the ballot last year.","False","0","1","DiscoConspiracy","dcp6xnz","False","t1_dcp5s4e","null","1484966012"
"t3_5p59su","t5_2cneq","1486226372","null","null","0","politics","Alright.  He became President to late, if the health stories are true.","False","0","1","DiscoConspiracy","dcp71lg","False","t1_dcp6q7y","null","1484966174"
"t3_5p6qh4","t5_2cneq","1486226587","null","null","0","politics","Prove.  Show me the evidence.  I refuse to believe it.","False","0","4","DiscoConspiracy","dcp7gu8","False","t1_dcp4kbq","null","1484966817"
"t3_5p6qh4","t5_2cneq","1486231886","null","null","0","politics","What was the key to cleaning it up in Texas?","False","0","1","DiscoConspiracy","dcphv53","False","t1_dcphkme","null","1484986580"
"t3_5p6qh4","t5_2cneq","1486231916","null","null","0","politics","Given certain vindictiveness that exists among certain politicians in a certain party, along with my fear that dissidents and opposition will be jailed, I could see it as a possibility.  I see it as people's pride was shattered in 2008 and 2012.  They need to make up for it somehow.","False","0","1","DiscoConspiracy","dcphx9v","False","t1_dcpe2fn","null","1484986743"
"t3_5p59su","t5_2cneq","1486231951","null","null","0","politics","Going to try for 16, despite currently existing term limits?","False","0","1","DiscoConspiracy","dcphzm3","False","t1_dcpbd2b","null","1484986926"
"t3_5p59su","t5_2cneq","1486233020","null","null","0","politics","Where does that leave Chamberlain?","False","0","2","DiscoConspiracy","dcpk4w7","False","t1_dcpjsx7","null","1484993477"
"t3_5parf8","t5_2cneq","1486240177","null","null","0","politics","It's important to be realistic, though.  What do we do in the face of greater automation, for example?","False","0","2","DiscoConspiracy","dcpyavt","False","t1_dcpucun","null","1485022062"
"t3_5po0ko","t5_2cneq","1486297450","null","null","0","politics","Has anyone already said But Obama! yet?  The moment Republicans start failing and losing their support, should those that voted for them this cycle come to some sort of realization, is the moment we no longer technically have elections.  I've seen Obama cited as a mistake or an error. There are two ways I can look at this.  1) It's like when Democrats say Bush was a mistake. Just partisan, mostly meaningless, political posturing from Republicans.  2) The wrong sort of people voted for Obama. Therefore, to prevent such mistakes from happening again they must double down on voter suppression, pass voting laws more favorable to Republicans, and institute a One Party State and/or dictatorship with either meaningless or no elections.","False","0","1","DiscoConspiracy","dct7crm","1485209094","t3_5po0ko","null","1485203569"
"t3_5ppzk3","t5_2cneq","1486297550","null","null","0","politics","Hopefully it does not mean that more people will have a chance to cheat on taxes.  And it's too bad for putting America back to work, since the federal government is a major employer.  I guess it's just seen as glorified welfare to some people, and just serves to restrict more Republicans from work.  And we've been here before, per Washington Post:  >The last two major, across-the-board freezes were instituted by Presidents Carter and Reagan, who imposed them after taking office. In 1982, the Government Accountability Office issued a report concluding that both freezes ended up costing more money than they saved, and were “not an effective means of controlling federal employment.  https://www.washingtonpost.com/powerpost/trump-freezes-hiring-of-federal-workers/2017/01/23/f14d8180-e190-11e6-ba11-63c4b4fb5a63_story.html?utm_term=.3263efbf5360#comments","False","0","3","DiscoConspiracy","dct7ka4","False","t3_5ppzk3","null","1485203794"
"t3_5prh0p","t5_2cneq","1486297751","null","null","0","politics","Wonderful. :/  Meanwhile, those against the ACA will CONTINUE to bring up Aetna in talking points.","False","0","52","DiscoConspiracy","dct7zdd","False","t3_5prh0p","null","1485204252"
"t3_5pp6ry","t5_2cneq","1486298288","null","null","0","politics","We've had steady growth in the stock market since 2009.  Take a look at a chart of the Dow and S&P.  Is it because of Democrat policies or Congress action/inaction? I don't know.  And words from major figures like the U.S. President can move markets.  Cite Reagan all you want (or inversely, Carter), but I'm of the opinion Republican policies eventually catch up with the market and not always in a good way.  But it's fine.  As long as we stick it to the Democrats and liberals.  We've won.  We can hope the markets will continue its upward movement or at least never fall back down again, but I'm not counting on it.  I do understand that one can write it all off as the usual market forces or market correction after big government, though.","False","0","1","DiscoConspiracy","dct93sl","False","t1_dct7upn","null","1485205471"
"t3_5pp6ry","t5_2cneq","1486298447","null","null","0","politics",">You get more money, since your taxes will be lowered. If you care about those people, DONATE to save their lifes!!  That's just a drop in a vast ocean.  Ineffective.  Now it is time to complete the act, accept what Russophile Republicans actually want, and join the Russian Federation, where:  >the Constitution of the Russian Federation has provided all citizens the right to free healthcare under Mandatory Medical Insurance since 1996.  https://en.wikipedia.org/wiki/Healthcare_in_Russia  You still get a win.  You get to say, loudly and clearly, Not on my dime! Because the Russians will be paying for it.  No more burden on U.S. citizens to pay for those people, those certain terrible soul sucking mooching people.  Because there will no longer be a U.S.","False","0","1","DiscoConspiracy","dct9fo3","False","t1_dct7j22","null","1485205832"
"t3_5pp6ry","t5_2cneq","1486298532","null","null","0","politics",">if only he hadn't said he was going to repeal and replace  Good luck with that.  Republicans have been trying to kill ACA several times since it was past, through ineffective votes and the legal system.  I'm hoping for a good replacement, but I can't count it.  We're not to trust government, ever, remember?","False","0","1","DiscoConspiracy","dct9m4p","False","t1_dct756r","null","1485206028"
"t3_5pp6ry","t5_2cneq","1486298576","null","null","0","politics","I though WaPo was fake news?","False","0","2","DiscoConspiracy","dct9pgm","False","t1_dct6fzm","null","1485206130"
"t3_5pp6ry","t5_2cneq","1486298689","null","null","0","politics","Now it is time to complete the act, accept what Russophile Republicans actually want, and join the Russian Federation, where:  >the Constitution of the Russian Federation has provided all citizens the right to free healthcare under Mandatory Medical Insurance since 1996.  https://en.wikipedia.org/wiki/Healthcare_in_Russia  Republicans still get a win.  Republicans get to say, loudly and clearly, Not on my dime! Because the Russians will be paying for it.  No more burden on U.S. citizens to pay for those people, those certain terrible soul sucking mooching people.  Because there will no longer be a U.S.","False","0","3","DiscoConspiracy","dct9xy8","False","t1_dct5cri","null","1485206386"
"t3_5pp6ry","t5_2cneq","1486298801","null","null","0","politics","Well at least they believe in Darwin and evolution, apparently.","False","0","1","DiscoConspiracy","dcta6bm","False","t1_dct5jmv","null","1485206641"
"t3_5pp6ry","t5_2cneq","1486298834","null","null","0","politics","It's like some sick, terrible fetus fetish. :(","False","0","1","DiscoConspiracy","dcta8s1","False","t1_dct59xf","null","1485206716"
"t3_5pp6ry","t5_2cneq","1486298937","null","null","0","politics","It's undeniable that Christian conservatives in powerful positions in politics and Muslim conservatives in powerful positions in politics have similar rules, just different methods of doling punishment.","False","0","1","DiscoConspiracy","dctagj7","False","t1_dct4e6x","null","1485206948"
"t3_5pp6ry","t5_2cneq","1486299212","null","null","0","politics","Certain conservatives circles did keep saying Trump wasn't a real conservative.","False","0","1","DiscoConspiracy","dctb18f","False","t1_dct1qc9","null","1485207573"
"t3_5pp6ry","t5_2cneq","1486299244","null","null","0","politics","If it was that easy, we'd already have free healthcare and free education for those who need it.  Because there would be plenty of donated money and scholarship money (that's not rationed).","False","0","1","DiscoConspiracy","dctb3oe","False","t1_dct1jy6","null","1485207648"
"t3_5pp6ry","t5_2cneq","1486299271","null","null","0","politics","Now it is time to complete the act, accept what Russophile Republicans actually want, and join the Russian Federation, where:  >the Constitution of the Russian Federation has provided all citizens the right to free healthcare under Mandatory Medical Insurance since 1996.  https://en.wikipedia.org/wiki/Healthcare_in_Russia  You still get a win.  You get to say, loudly and clearly, Not on my dime! Because the Russians will be paying for it.  No more burden on U.S. citizens to pay for those people, those certain terrible soul sucking mooching people.  Because there will no longer be a U.S.","False","0","1","DiscoConspiracy","dctb5p6","False","t1_dct116w","null","1485207709"
"t3_5pp6ry","t5_2cneq","1486299319","null","null","0","politics","It's more important to be self righteous in denying non-bankrupting inducing healthcare for those people than actually governing.","False","0","1","DiscoConspiracy","dctb9a8","False","t1_dct1292","null","1485207815"
"t3_5pp6ry","t5_2cneq","1486299323","null","null","0","politics","It's more important to be self righteous in denying non-bankrupting inducing healthcare for those people than actually governing.","False","0","1","DiscoConspiracy","dctb9lz","False","t1_dct1292","null","1485207825"
"t3_5pp6ry","t5_2cneq","1486299373","null","null","0","politics","So you're ok with repealing the law that says ERs have to treat everyone? I heard that law was made under Reagan.  Why should hospitals be forced to pay for patients who can't afford the cost of care? It's the patients' fault for letting their condition get to an emergency state and not having $500,000 in their health savings account.","False","0","1","DiscoConspiracy","dctbddf","False","t1_dct2je0","null","1485207937"
"t3_5pp6ry","t5_2cneq","1486299466","null","null","0","politics","Is it ok for the government to spend trillions on foreign shores but not billions on healthcare here in the U.S.?","False","0","2","DiscoConspiracy","dctbkey","False","t1_dct7ynu","null","1485208151"
"t3_5pp6ry","t5_2cneq","1486299518","null","null","0","politics","Would conservative voters during the Jim Crow era have voted for a full repeal of Jim Crow laws? Why or why not?","False","0","1","DiscoConspiracy","dctbo9j","False","t1_dcszmr5","null","1485208265"
"t3_5pp6ry","t5_2cneq","1486299640","null","null","0","politics","It's fine.  We'll all join the Russian Federation and have free healthcare that may or may not still exist.  It'll be fine.  Nothing to worry about. Long live Mother Russia.  She has reigned for thousands of years and shall reign for thousands more.","False","0","1","DiscoConspiracy","dctbxew","False","t1_dcszqgh","null","1485208543"
"t3_5pp6ry","t5_2cneq","1486299680","null","null","0","politics","And would those same conservatives of that certain party have voted for Obama as President?  I believe these were also members of that party:  https://en.wikipedia.org/wiki/Scopes_Trial  That party, same as the certain party.  Also, this is for you:  https://en.wikipedia.org/wiki/Barry_Goldwater#/media/File:ElectoralCollege1964.svg  Look familiar?","False","0","1","DiscoConspiracy","dctc0dq","False","t1_dctbunl","null","1485208637"
"t3_5pq6fp","t5_2cneq","1486299927","null","null","0","politics","Someone, somewhere, or some party, is getting desperate.  We have to wait to see which ones it is.","False","0","1","DiscoConspiracy","dctciwl","False","t1_dct3aym","null","1485209216"
"t3_5pq6fp","t5_2cneq","1486299948","null","null","0","politics","If true, there is no room for no men in Trump's White House.  Only yes men.","False","0","0","DiscoConspiracy","dctcki3","False","t3_5pq6fp","null","1485209269"
"t3_5pq0g7","t5_2cneq","1486299977","null","null","0","politics","I'm willing to wait and see, for now, to see if this turns out to be the disaster I hope it's not.","False","0","1","DiscoConspiracy","dctcmo9","False","t3_5pq0g7","null","1485209340"
"t3_5pp6ry","t5_2cneq","1486299996","null","null","0","politics","Perhaps you can explain this map, then.  Why did it happen? Could it happen again? Did Goldwater ever have a chance?  https://en.wikipedia.org/wiki/Barry_Goldwater#/media/File:ElectoralCollege1964.svg","False","0","1","DiscoConspiracy","dctco0p","False","t1_dctcimu","null","1485209382"
"t3_5pp6ry","t5_2cneq","1486300084","null","null","0","politics",">The idea that they're throwing this thing out with nothing to take its place is just absurd to me.  I'm very sorry if that happens.  If it does not, I can only suggest looking closely at the replacement to see if it was meaningful replacement that is about as good or better than the ACA.","False","0","1","DiscoConspiracy","dctcuoy","False","t1_dctamw9","null","1485209599"
"t3_5pp6ry","t5_2cneq","1486300105","null","null","0","politics","I don't think your insurance premiums are going to go down.  Or if it does, that it won't be a terrible worthless plan since you get what you pay for.","False","0","2","DiscoConspiracy","dctcw7h","False","t1_dcta2b5","null","1485209647"
"t3_5prlgf","t5_2cneq","1486307595","null","null","0","politics","In Trump's America, much like other countries with organized state propaganda, everyone has a Role to play in the Grand Stage.","False","0","2","DiscoConspiracy","dctshfo","False","t3_5prlgf","null","1485228695"
"t3_5pplp0","t5_2cneq","1486307611","null","null","0","politics","Am I too late to come in here and say fake news because sources say?","False","0","1","DiscoConspiracy","dctsip9","False","t3_5pplp0","null","1485228738"
"t3_5psyo0","t5_2cneq","1486307629","null","null","0","politics","How screwed are we, as a nation?","False","0","39","DiscoConspiracy","dctsk0i","False","t1_dctog4n","null","1485228784"
"t3_5ptiv2","t5_2cneq","1486307646","null","null","0","politics","Everyone keeps saying Where's the proof?  So where's the proof? Where's the evidence? Show me the proof.","False","0","1","DiscoConspiracy","dctslbm","False","t3_5ptiv2","null","1485228829"
"t3_5ptiv2","t5_2cneq","1486307715","null","null","0","politics","But what if that means Trump loses?","False","0","3","DiscoConspiracy","dctsqh8","False","t1_dcts3tg","null","1485229010"
