"link_id","subreddit_id","retrieved_on","author_flair_css_class","author_flair_text","controversiality","subreddit","body","stickied","gilded","score","author","id","edited","parent_id","distinguished","created_utc"
"t3_5nme2z","t5_2cneq","1486012866","null","null","0","politics","> But if this continues to blow up in bigger and bigger ways it's going to rally us to unite.  I want to be hopeful here.  That's what SHOULD happen.  But with people outright denying this as a possibility, minimizing it, or just not caring we might not see that happen.  Plus, I believe a not insignificant number of Americans have convinced themselves (or were convinced) that Russia is not a threat and that they should love Mother Russia.","False","0","1","DiscoConspiracy","dcdcklp","False","t1_dccolf3","null","1484300224"
"t3_5nme2z","t5_2cneq","1486012886","null","null","0","politics","I believe they were around during the Scottish referendum, too.  Pretty sure I saw a Russian pro-Scottish split web site at the time.","False","0","2","DiscoConspiracy","dcdcm0x","False","t1_dccq9ee","null","1484300338"
"t3_5nme2z","t5_2cneq","1486012904","null","null","0","politics","Can Brexit be revoted on? This time without any Russian interference and to ensure voting integrity.  Or would that not be fair to those who voted against?  It's less like the Presidential election here, though.  I don't think it would be unfair to call a revote.  Maybe just embarrassing if the number comes up even greater pro-Brexit.","False","0","1","DiscoConspiracy","dcdcnd2","False","t1_dccyhpu","null","1484300453"
"t3_5nme2z","t5_2cneq","1486012915","null","null","0","politics","Does that explain those 3 am tweets? Or at least the one 3 am tweet?","False","0","1","DiscoConspiracy","dcdco8b","False","t1_dccph7c","null","1484300527"
"t3_5nme2z","t5_2cneq","1486012938","null","null","0","politics",">International law, including the law for armed conflict, applies to actions in cyberspace, said part of a message sent over the Red Phone on Oct. 31, according to a senior U.S. official. We will hold Russia to those standards.  http://www.nbcnews.com/news/us-news/what-obama-said-putin-red-phone-about-election-hack-n697116  A Red Line on a Red Phone?  And did he mean primarily if Russia had tried to flip voting machines?","False","0","1","DiscoConspiracy","dcdcpxs","False","t1_dcd4bfj","null","1484300673"
"t3_5nme2z","t5_2cneq","1486012946","null","null","0","politics","Nah.  I don't think so.  Or at least I hope not.  I saw a little article recently on deployments in Germany along with a quote that claimed Russia thought them invading Eastern Europe was stupid or something.  It was rather badly edited and/or mispelled.  Here it is.  Either my memory was off, the editing/spelling was corrected (it seemed like a short hastily written article at the time), or Edge messed with the formatting.  http://www.msn.com/en-us/news/world/us-tanks-roll-into-germany-to-protect-against-potential-russian-invasion/ar-BBy31SL?ocid=spartandhp  Less ominous: https://www.msn.com/en-us/news/world/us-tanks-roll-into-germany-to-bolster-nato-deterrent/ar-BBxYuab","False","0","1","DiscoConspiracy","dcdcqjy","1484300926","t1_dcd92fz","null","1484300723"
"t3_5nme2z","t5_2cneq","1486012984","null","null","0","politics","Why's that?","False","0","3","DiscoConspiracy","dcdctay","False","t1_dcd4duj","null","1484300955"
"t3_5nme2z","t5_2cneq","1486012998","null","null","0","politics","Can the international community do something about Russia's suspected spying on personal bedrooms/hotel rooms (if that is indeed a thing)? Or is it a matter of their country, their rules, their way of life, their culture, etc.","False","0","1","DiscoConspiracy","dcdcuf6","False","t1_dcdc7u5","null","1484301047"
"t3_5nme2z","t5_2cneq","1486013009","null","null","0","politics","Well that's a downer.  You think he will get into it with China?","False","0","1","DiscoConspiracy","dcdcv5v","False","t1_dcdc950","null","1484301110"
"t3_5nl97u","t5_2cneq","1486013062","null","null","0","politics","How's Arpaio doing these days? Still going strong? Liking the Hawaiian weather? Still making videos here and there?","False","0","1","DiscoConspiracy","dcdcz3i","False","t1_dcdajb0","null","1484301450"
"t3_5nntbx","t5_2cneq","1486013075","null","null","0","politics","If there's anything to the health angle, that might actually be literally true.","False","0","2","DiscoConspiracy","dcdd02l","False","t1_dcdcymc","null","1484301534"
"t3_5nntbx","t5_2cneq","1486013079","null","null","0","politics","When did we all step into a spy novel?  I knew that weird visual migraine I had a couple weeks ago meant something.  I entered a different reality than the one I started in.  We're in the one where Russia won the Cold War.","False","0","6","DiscoConspiracy","dcdd0fx","False","t1_dcdcyen","null","1484301568"
"t3_5nntbx","t5_2cneq","1486013091","null","null","0","politics","Faith-based reporting, am I right?","False","0","-3","DiscoConspiracy","dcdd1cx","False","t1_dcdcn5p","null","1484301645"
"t3_5nntbx","t5_2cneq","1486013102","null","null","0","politics","Perhaps we will learn, or it will be later determined by our lawmakers, that this method of campaigning is actually legal.","False","0","1","DiscoConspiracy","dcdd23e","False","t1_dcdcwxx","null","1484301708"
"t3_5nntbx","t5_2cneq","1486013109","null","null","0","politics","Is he for Iran, though? Or can he not play those cards yet? Or maybe those cards aren't even a thing anymore and Russia-Iran are moving away from each other?","False","0","2","DiscoConspiracy","dcdd2n7","False","t1_dcdaird","null","1484301755"
"t3_5nntbx","t5_2cneq","1486013114","null","null","0","politics","Who is that guy?","False","0","1","DiscoConspiracy","dcdd326","False","t1_dcdbjc3","null","1484301792"
"t3_5nntbx","t5_2cneq","1486013156","null","null","0","politics","I don't know.  I liked it.  I think it pretty much sums up what at least some peoples' thoughts are regarding Russia.","False","0","7","DiscoConspiracy","dcdd66x","1484302294","t1_dcdazm1","null","1484302060"
"t3_5nme2z","t5_2cneq","1486013176","null","null","0","politics","I don't even think Trump has to be impeached on this.  In fact, I generally would prefer not.  That would not be my hope here.  Just be straight up honest with the American people, if this blackmail stuff is true.  Get those cords and strings from the Kremlin cut, and quickly.  Then we can be at least have more assurance the motto Make America Great Again is genuine (as opposed to making Russia great again).","False","0","1","DiscoConspiracy","dcdd7o2","False","t1_dcdd5q8","null","1484302190"
"t3_5nntbx","t5_2cneq","1486013204","null","null","0","politics","That and the let's move on tweet.  One could interpret that as him being dismissive...like, Yeah, Russia may have helped me [possibly illegally].  But so what? I won.  Get over it.  What's the main thing for Russia and the U.S. to solve? ISIS, right? But I'm not convinced that will last much longer.  How is the fight with them going?","False","0","21","DiscoConspiracy","dcdd9pt","False","t1_dcdc5sc","null","1484302367"
"t3_5nntbx","t5_2cneq","1486013257","null","null","0","politics","> Bastard probably has an iphone though.  I'm a bit illiterate here, sorry.  What does that mean, in practice?","False","0","1","DiscoConspiracy","dcdddsg","False","t1_dcdcabj","null","1484302723"
"t3_5nntbx","t5_2cneq","1486013273","null","null","0","politics","Logan Act? How does that work? Did Carter and/or Bill Clinton do some stuff against the Logan Act in their day, or was it on the up and up in some way?","False","0","0","DiscoConspiracy","dcddez2","False","t1_dcd1f2q","null","1484302826"
"t3_5nntbx","t5_2cneq","1486013282","null","null","0","politics",">undermining democracy.  I'm sad that this could be written away by people as the U.S. not being a democracy.","False","0","5","DiscoConspiracy","dcddfmz","False","t1_dcd8tzm","null","1484302889"
"t3_5nntbx","t5_2cneq","1486013296","null","null","0","politics","> The GOP used to be the party who LOVED all things military, yet trump's repeated insults hitting a broad spectrum of the military community seemingly went unnoticed by red state voters.  I think they've got victory bloodlust, honestly.  Maybe they'll come to their senses.","False","0","53","DiscoConspiracy","dcddgps","False","t1_dcdbtxa","null","1484302981"
"t3_5nntbx","t5_2cneq","1486013304","null","null","0","politics","Are you at least outside of the U.S., though?","False","0","2","DiscoConspiracy","dcddhbr","False","t1_dcd0cpw","null","1484303034"
"t3_5nntbx","t5_2cneq","1486013317","null","null","0","politics",">I think they will keep him to take all the blame for the shit that's about to go down...  When you say that, are you saying that the repeal of the ACA is the least of our worries here?","False","0","2","DiscoConspiracy","dcddi98","False","t1_dcdarme","null","1484303115"
"t3_5nneff","t5_2cneq","1486013371","null","null","0","politics","Until it happens to you.  Until it happens to you.  I know that many here in /r/politics are all beyond caring at this point, but I still care.  So I hope, I hope for you and any of the other numerous Americans with this mentality that neither you nor anyone you love or care about has to face life without proper health insurance and the mess that is the system we live in when you're between the void.  Maybe you've already been there.  Maybe, through luck, grit, determination, and bootstraps you pulled yourself through.  That's great.  But not everyone can be that fortunate, especially if the luck and situation to pull themselves out of it is not there.  I don't know what would be worse, here.  The prospect I outlined above, or people having to look at themselves in the mirror and think back to discussions like this.  But that's alright.  Do you think Russia will be willing to provide us free and/or affordable health care and insurance? Would you approve of it, by chance, as long as it's not on your dime?","False","0","4","DiscoConspiracy","dcddm8x","False","t1_dccvow3","null","1484303468"
"t3_5nntbx","t5_2cneq","1486013411","null","null","0","politics","Clinton bad Trump good.","False","0","1","DiscoConspiracy","dcddpah","False","t1_dcdcqx0","null","1484303728"
"t3_5nntbx","t5_2cneq","1486013414","null","null","0","politics","We could have had Bernie!  We missed our chance, /r/politics .  (actually, I don't know if that would have worked either.  I'd like to think it would have.  But he might also have been pro-Russia so I dunno).","False","0","1","DiscoConspiracy","dcddpij","False","t1_dcd0tza","null","1484303745"
"t3_5nntbx","t5_2cneq","1486013438","null","null","0","politics","I'd really hate to unjustly find myself on the wrong side of that, so no thanks.","False","0","2","DiscoConspiracy","dcddrco","False","t1_dcd071j","null","1484303900"
"t3_5nntbx","t5_2cneq","1486013446","null","null","0","politics","Party politics and political parties pretty much ruined that prospect, yeah?  I thought the Founders weren't keen on political parties either or something.","False","0","1","DiscoConspiracy","dcddrup","False","t1_dcd6z7d","null","1484303945"
"t3_5nntbx","t5_2cneq","1486013459","null","null","0","politics","Can someone technically ask the SC nominee to promise that they won't go with treason?","False","0","1","DiscoConspiracy","dcddsw5","False","t1_dcd72c4","null","1484304038"
"t3_5nntbx","t5_2cneq","1486013470","null","null","0","politics","In your view, how did a hypothetical love affair with Russia start? What leads a person to conspire with the Russian government?","False","0","1","DiscoConspiracy","dcddtqo","False","t1_dcdb4uf","null","1484304110"
"t3_5nntbx","t5_2cneq","1486013480","null","null","0","politics","We need Beck with his blackboard of circles and squiggly lines, stat.  Or at least the hilarious Jon Stewart impression.  I kinda miss those days.","False","0","7","DiscoConspiracy","dcdduek","False","t1_dcd7h93","null","1484304163"
"t3_5nme2z","t5_2cneq","1486013494","null","null","0","politics","I'm not sure? Did I not state my question clearly?","False","0","1","DiscoConspiracy","dcddvgm","False","t1_dcdds9s","null","1484304255"
"t3_5nn6ef","t5_2cneq","1486013511","null","null","0","politics","Have you seen much anti-millennial spam in your day and what is your take on it? It's kinda hurtful for me to be put in a label like that, like it's some bad thing or a disease.  Sure, I'm young and probably naive, but I feel I always respected my elders.  But I'm also willing to share how I feel and if I think our country is about to get screwed.","False","0","3","DiscoConspiracy","dcddwrs","False","t1_dcddagf","null","1484304363"
"t3_5nn6ef","t5_2cneq","1486013540","null","null","0","politics","Where are we at with all this now? I'm going to bed.","False","0","1","DiscoConspiracy","dcddyws","False","t1_dccvfv3","null","1484304541"
"t3_5nn6ef","t5_2cneq","1486013549","null","null","0","politics","> The positive spin: American's hard working intelligence operatives are working tirelessly to identify and neutralise misinformation that is circulating in the wake of Russian hacking.  How are they doing that? Have you seen anything?","False","0","1","DiscoConspiracy","dcddzji","False","t1_dccuu20","null","1484304594"
"t3_5nn6ef","t5_2cneq","1486013558","null","null","0","politics","> And I just read that China is directly threatening military action due to Tillerson's comments today.  OMG WHY","False","0","2","DiscoConspiracy","dcde07q","False","t1_dcd831k","null","1484304650"
"t3_5nneff","t5_2cneq","1486021385","null","null","0","politics","I'm not sure what you're referring to here.  Edit: Also, you might be interested in this.  It appeared in another thread and tracks premium increases.  http://imgur.com/a/LB8eV  Trump is MAGAing already!","False","0","1","DiscoConspiracy","dcdu9j5","1484332017","t1_dcdfcbz","null","1484329882"
"t3_5nn6ef","t5_2cneq","1486021702","null","null","0","politics","Any chance the questions were designed to weed out reactions regarding sensitive matters?","False","0","1","DiscoConspiracy","dcdux5k","False","t1_dcdgrei","null","1484330610"
"t3_5nn6ef","t5_2cneq","1486022059","null","null","0","politics","Not that in itself.  It's the way people sometimes refer to millennials as if they were some kind of Other. Some sort of problem to be rectified.  I don't remember hearing anything about it prior to Obama's election.  Likely thing to me is that everyone heard that millennials went big for Democrats and people are resentful or dismissive to them for that.","False","0","2","DiscoConspiracy","dcdvny1","False","t1_dcdiqqe","null","1484331433"
"t3_5npue7","t5_2cneq","1486022214","null","null","0","politics","What was that person going on about that he deleted it?","False","0","3","DiscoConspiracy","dcdvzg6","False","t1_dcdgm09","null","1484331786"
"t3_5nqo8d","t5_2cneq","1486022549","null","null","0","politics","Hands off MY money you DIRTY leech!  --Definitely not a personal responsibility, zero f's type conservative  (also said while it's entirely possible no actual money is being taken out of their pockets...unless you go higher up in the economic food chain, that is)","False","0","1","DiscoConspiracy","dcdwoh9","False","t3_5nqo8d","null","1484332552"
"t3_5nqo8d","t5_2cneq","1486022567","null","null","0","politics","ikr  Government jobs remain cushy as ever.  And I seem to recall even those jobs were a target for hardcore conservatives.  They don't like government bureaucrats. ","False","0","1","DiscoConspiracy","dcdwpuz","False","t1_dcdwgbb","null","1484332596"
"t3_5nqo8d","t5_2cneq","1486022597","null","null","0","politics","We know that the free market is a mystical, powerful force for good and indifference.  Have some more faith.","False","0","1","DiscoConspiracy","dcdws4c","False","t1_dcdvgeu","null","1484332665"
"t3_5nrcvo","t5_2cneq","1486022666","null","null","1","politics","Innocuous take for once? They're already making plans for foreign policy, trade, and other matters together.  Nothing particularly sinister.","False","0","22","DiscoConspiracy","dcdwxaf","False","t3_5nrcvo","null","1484332824"
"t3_5nrcvo","t5_2cneq","1486022698","null","null","0","politics","Great account! I'm a little surprised the word hasn't been available for longer.  I don't think I knew what kompromat was until recently, unless a vague memory from some movie or another applies.","False","0","1","DiscoConspiracy","dcdwzne","False","t1_dcdwdn8","null","1484332893"
"t3_5nrcvo","t5_2cneq","1486022786","null","null","0","politics","And how would you feel if Obama had done this same thing in the run up between the election to January 20th 2009?","False","0","2","DiscoConspiracy","dcdx69e","False","t1_dcdt0o7","null","1484333097"
"t3_5nrcvo","t5_2cneq","1486022824","null","null","0","politics","It's hilarious how it seems they didn't really start to run with it until after that one article pointing to question some of the Facebook fake news articles they might have seen that was shared to them by people they trust.","False","0","1","DiscoConspiracy","dcdx94u","False","t1_dcdu0lf","null","1484333186"
"t3_5nrcvo","t5_2cneq","1486022963","null","null","0","politics","Wonder if he will arm himself with his personal security detail on Day 1 of his Presidency and if they'll be at his inauguration, surrounding him, in plain view of the camera.","False","0","13","DiscoConspiracy","dcdxjjt","False","t1_dcdsdxk","null","1484333507"
"t3_5nrcvo","t5_2cneq","1486023008","null","null","0","politics","That's really the best part in all this.","False","0","10","DiscoConspiracy","dcdxmxk","False","t1_dcdu2za","null","1484333611"
"t3_5nrcvo","t5_2cneq","1486023041","null","null","0","politics","Maybe Putin wants to share that Israeli thing.  I'm surprised he hasn't done that yet to try to pour water over this.  Especially since it would be basically regurgitated scandal.  This faction in American politics is VERY good at that.","False","0","1","DiscoConspiracy","dcdxpci","False","t1_dcdr88t","null","1484333688"
"t3_5nrcvo","t5_2cneq","1486023429","null","null","0","politics","Continuous, spammy deflection from people saying the U.S. engages in Kompromat in one, two, three....","False","0","0","DiscoConspiracy","dcdyig1","False","t1_dcdqg7t","null","1484334579"
"t3_5nrcvo","t5_2cneq","1486023460","null","null","0","politics","Do people have like a list of talking points in front of them when they post? Or a flowchart?","False","0","1","DiscoConspiracy","dcdykpi","False","t1_dcdq7xz","null","1484334649"
"t3_5nrcvo","t5_2cneq","1486023487","null","null","0","politics","Neckbearded, FEDORA wearing supporters?","False","0","-1","DiscoConspiracy","dcdymr1","False","t1_dcdvcff","null","1484334712"
"t3_5nrcvo","t5_2cneq","1486023599","null","null","0","politics","Certain Republicans don't need laws, except when it comes to witch-hunting Democrats unfortunately.","False","0","0","DiscoConspiracy","dcdyv6e","False","t1_dcdvndj","null","1484334974"
"t3_5nrcvo","t5_2cneq","1486023636","null","null","0","politics","> America would be more unified if something very clear came out, if such a thing exists.  We can hope.","False","0","1","DiscoConspiracy","dcdyxxy","False","t1_dcdtcnx","null","1484335062"
"t3_5nrcvo","t5_2cneq","1486023871","null","null","0","politics","Oh no.  I've been on a Russia tangent for awhile now.  Just trying to keep an at least somewhat balanced perspective.  Never know when our new Administration might try to take away anonymity from the Internet or something insane like that.  I want it on record that I've made an attempt to not see EVERYTHING in a negative light.  Guess where I got the idea from? Russia.  http://www.businessinsider.com/russia-internet-ban-anonymity-2011-12  Guess where our Administration just MIGHT get the idea from, if they were inclined to go this route?","False","0","6","DiscoConspiracy","dcdzfih","False","t1_dcdz81t","null","1484335605"
"t3_5nrcvo","t5_2cneq","1486024098","null","null","0","politics","I don't think so.  If these stories are true, is there maybe a way to just cut the cord and line to the Kremlin, instead, if it turns out he's not willingly working with them?","False","0","0","DiscoConspiracy","dcdzwk9","False","t1_dcdppcs","null","1484336143"
"t3_5nrcvo","t5_2cneq","1486024146","null","null","0","politics","> I just think anything from the Dems can be easily explained away as sore losers regardless how much evidence there is.  Wished people would understand this goes WAY beyond the elections now.  Clinton lost, it's done, and any attempts to Bernie her were pretty much a nonstarter.","False","0","2","DiscoConspiracy","dce0050","False","t1_dcdrasc","null","1484336253"
"t3_5nrcvo","t5_2cneq","1486024180","null","null","0","politics","In certain authoritarian and oppressive societies, or lead up to one, political dissidents tend to get imprisoned.  I'm a little worried.","False","0","1","DiscoConspiracy","dce02ob","False","t1_dcdr5pe","null","1484336334"
"t3_5nrcvo","t5_2cneq","1486024218","null","null","0","politics","I can see the emails from my the shore of my house, here.","False","0","1","DiscoConspiracy","dce05j9","False","t1_dcdw38f","null","1484336425"
"t3_5nrcvo","t5_2cneq","1486024310","null","null","0","politics","Explain, please?","False","0","4","DiscoConspiracy","dce0cdh","False","t1_dcdylbe","null","1484336641"
"t3_5nrcvo","t5_2cneq","1486024404","null","null","0","politics","How many people in the right states?","False","0","0","DiscoConspiracy","dce0jfu","False","t1_dcdx8le","null","1484336858"
"t3_5nrcvo","t5_2cneq","1486024445","null","null","0","politics","Followed by the shutting down or consolidation of the CIA and burning of our assets abroad, I'm afraid.","False","0","4","DiscoConspiracy","dce0mj6","False","t1_dcdui7s","null","1484336953"
"t3_5nrcvo","t5_2cneq","1486024467","null","null","1","politics","Freedom died that cold November day, and America with it in the arms of the Party of Liberty.  They didn't mean to, but it happened.  It's just time we accept it and move on.","False","0","2","DiscoConspiracy","dce0o7t","False","t1_dcdzyw0","null","1484337005"
"t3_5nrcvo","t5_2cneq","1486024537","null","null","0","politics","Nah.","False","0","1","DiscoConspiracy","dce0tef","False","t1_dcdsoeq","null","1484337165"
"t3_5nrcvo","t5_2cneq","1486024570","null","null","0","politics","> So far as I can tell, they're making efforts to sway public opinion against Trump to cultivate an atmosphere in which people will be more receptive to taking action against him  There's some risk in this backfiring, if it hasn't already.","False","0","3","DiscoConspiracy","dce0vx5","False","t1_dce0o04","null","1484337241"
"t3_5nrcvo","t5_2cneq","1486024751","null","null","0","politics","Was the contact before or after? ","False","0","1","DiscoConspiracy","dce19iw","False","t1_dcdy9b4","null","1484337651"
"t3_5nrcvo","t5_2cneq","1486024821","null","null","0","politics","I did wonder if the expulsions were actually specifically targeted.","False","0","2","DiscoConspiracy","dce1epn","False","t1_dcdrr1o","null","1484337813"
"t3_5nrcvo","t5_2cneq","1486024944","null","null","0","politics","Wrong.","False","0","1","DiscoConspiracy","dce1o0o","False","t1_dce127a","null","1484338101"
"t3_5nrcvo","t5_2cneq","1486025501","null","null","0","politics","Honestly: When was the last time that law was followed? I first heard about that law when Carter was doing stuff in the Middle East, I think. Unless I'm mistaken on the law or the situation, which is likely.  I'm not a lawyer, expert, etc.  Just sitting on my armchair here with my laptop.","False","0","-1","DiscoConspiracy","dce2tr3","False","t1_dce2nuc","null","1484339383"
"t3_5npue7","t5_2cneq","1486027774","null","null","0","politics","Like literally getting paid a visit by someone? How are they finding them?  Talk about NAZI Germany (with obvious less extremes).","False","0","1","DiscoConspiracy","dce7jtw","False","t1_dce6f7e","null","1484345008"
"t3_5nrcvo","t5_2cneq","1486030026","null","null","0","politics","Not that it will happen, but we really need to keep an eye out on these sort of things.  I don't know what we can do if things start heading towards that direction.  If we still have our institutions by then, we still have legal recourse.  This stuff is out there.  Maybe I understand a little bit how Republicans felt when Obama was elected...twice.","False","0","2","DiscoConspiracy","dcec8gz","False","t1_dcebclw","null","1484351228"
"t3_5ns6br","t5_2cneq","1486030863","null","null","0","politics","I'd have wanted to have a good relationship with our intelligence agencies.  Not for concern to myself or my power, but because intelligence is important.","False","0","3","DiscoConspiracy","dcedz1i","False","t1_dce0910","null","1484353703"
"t3_5ns6br","t5_2cneq","1486030876","null","null","0","politics","Would this still have happened if we still had the Fairness Doctrine?","False","0","1","DiscoConspiracy","dcedzxm","False","t1_dce6rlt","null","1484353740"
"t3_5ns6br","t5_2cneq","1486030892","null","null","0","politics","Very sad! Very unfair!","False","0","1","DiscoConspiracy","dcee153","False","t1_dcecezq","null","1484353787"
