"link_id","subreddit_id","retrieved_on","author_flair_css_class","author_flair_text","controversiality","subreddit","body","stickied","gilded","score","author","id","edited","parent_id","distinguished","created_utc"
"t3_5lapxb","t5_2cneq","1485686182","null","null","0","politics","And they likely won't even give us free healthcare.","False","0","1","DiscoConspiracy","dbuznp6","False","t1_dbuywqi","null","1483253370"
"t3_5lapxb","t5_2cneq","1485686202","null","null","0","politics","I really liked Amazon and free press while we had it.","False","0","2","DiscoConspiracy","dbuzp8l","False","t3_5lapxb","null","1483253476"
"t3_5lbdw1","t5_2cneq","1485686285","null","null","0","politics","Palin too?","False","0","1","DiscoConspiracy","dbuzvgb","False","t1_dbuy77p","null","1483253919"
"t3_5lbdw1","t5_2cneq","1485686328","null","null","0","politics","I'm sorry, this web site is blocked in my home country.  Can you summarize what it says, including whether Snopes says the story is False or not?","False","0","2","DiscoConspiracy","dbuzyq3","False","t1_dbuw5f5","null","1483254158"
"t3_5lbdw1","t5_2cneq","1485686346","null","null","0","politics","Would you be upset if Hillary won, for instance, and it was shown Iran, China, or even Russia hacked to ATTEMPT to improve her chances of winning?","False","0","10","DiscoConspiracy","dbv001l","False","t1_dbuz4bq","null","1483254259"
"t3_5lbdw1","t5_2cneq","1485686396","null","null","0","politics","Then obviously that means Palin is a liberal Communist Marxist shill.","False","0","2","DiscoConspiracy","dbv03tm","False","t1_dbut5jn","null","1483254546"
"t3_5lbdw1","t5_2cneq","1485686446","null","null","0","politics","I believe we should take calls from Taiwan.  Since we will have Russia on our side, there's nothing to worry about am I right?","False","0","0","DiscoConspiracy","dbv07kz","False","t1_dbunvnv","null","1483254821"
"t3_5lbdw1","t5_2cneq","1485686558","null","null","0","politics","Are there a lot of Russians that play DOTA?  I understand that maybe they're on Eve Online and CS:GO a lot.","False","0","1","DiscoConspiracy","dbv0fzj","False","t1_dbujvll","null","1483255426"
"t3_5lbdw1","t5_2cneq","1485686600","null","null","0","politics","I agree with your prediction of strong-arming.  Should health insurance premiums NOT go down after the repeal of the ACA, I predict the Trump Administration trying to bludgeon the free market into submission.","False","0","4","DiscoConspiracy","dbv0j6b","False","t1_dbuoiml","null","1483255663"
"t3_5lbdw1","t5_2cneq","1485686606","null","null","0","politics","Under Trump, where in the world might we end up?","False","0","2","DiscoConspiracy","dbv0jny","False","t1_dbv09m6","null","1483255702"
"t3_5lbdw1","t5_2cneq","1485686625","null","null","0","politics","Are you telling me Soviet Russia never truly went away? I can see that.  The mindset among the leaders is still there.  Especially Lavrov, I feel.","False","0","2","DiscoConspiracy","dbv0l0k","False","t1_dbuy5oe","null","1483255800"
"t3_5lbdw1","t5_2cneq","1485686655","null","null","0","politics","Any ideas on how to defend against this sort of stuff?  I think China does psyops, too, but only when directly related to them (like the South Sea).  Or they might just be REALLY nationalistic Chinese.  Probably that.  China, if you're out there...  (No, I'm not going to do it.  Please no.)","False","0","1","DiscoConspiracy","dbv0n8n","False","t1_dbujcr7","null","1483255966"
"t3_5lbdw1","t5_2cneq","1485686663","null","null","0","politics","I always wanted Trump for Christmas.","False","0","1","DiscoConspiracy","dbv0nvc","False","t1_dbut3t1","null","1483256015"
"t3_5lbdw1","t5_2cneq","1485686733","null","null","0","politics","They're gunna eat their Capitalists and Bankers next.  And maybe even trash up Wall Street, where I believe a lot of the American public's money is invested.  All the Left had to do to trigger this was to support a Clinton's run for Presidency.","False","0","1","DiscoConspiracy","dbv0t4y","False","t1_dbur3jo","null","1483256424"
"t3_5lbdw1","t5_2cneq","1485686857","null","null","0","politics","How sure are you of this and why?  It may be that there will be members of the GOP who will now become an anti-West force.  Like Russia.  Like Iran.  Like Chavez.","False","0","1","DiscoConspiracy","dbv12gw","False","t1_dbuvzot","null","1483257169"
"t3_5lbdw1","t5_2cneq","1485686873","null","null","0","politics","I'm kinda surprised Russia didn't veto it.  The Kremlin should care more about Israel than that, especially if they want to take the U.S.'s place.  Unless that's their plan.  Try to put even more distance between the two nations.","False","0","2","DiscoConspiracy","dbv13n0","False","t1_dbuwy0z","null","1483257267"
"t3_5lbdw1","t5_2cneq","1485686906","null","null","0","politics","I mean, I don't have the statistics but it might be possible  Which makes me wonder who the % or so was it that stayed out and why.  I would guess they were these people:  1) Those sure of Hillary's victory  2) Those who weren't energized by either candidate  3) Those who stayed home because Bernie or Cruz didn't get the nomination  4) People who just didn't have the time or were unable to vote (work schedule, clandestine voter suppression efforts, etc.)","False","0","1","DiscoConspiracy","dbv163d","False","t1_dbuoal0","null","1483257476"
"t3_5lbdw1","t5_2cneq","1485686909","null","null","0","politics","I miss Harambe.","False","0","1","DiscoConspiracy","dbv16cj","False","t1_dbufwag","null","1483257499"
"t3_5lbdw1","t5_2cneq","1485686921","null","null","0","politics","Bernin down the house.","False","0","0","DiscoConspiracy","dbv1788","False","t1_dbunuc6","null","1483257573"
"t3_5lbdw1","t5_2cneq","1485686957","null","null","0","politics","I'm not confident of that.","False","0","2","DiscoConspiracy","dbv19xr","False","t1_dbufvzr","null","1483257813"
"t3_5lbdw1","t5_2cneq","1485686992","null","null","0","politics","I think the point may be, he beat Hillary.  He beat a Clinton.  More importantly, he beat a DEMOCRAT.    It may be that the most avid team/sports-based Republicans have felt humiliated and indignant these past 8 years . They hate Democrats so much.  They hate Obama so much.  Heck, right outside my polling location in 2008 someone put an Obama picture by the entrance so everyone can walk on it.  This goes very deep.  I believe Republicans will tow the line.  I just don't know the number.","False","0","1","DiscoConspiracy","dbv1cko","False","t1_dbunqym","null","1483258047"
"t3_5lbdw1","t5_2cneq","1485687014","null","null","0","politics","Is it true that the economy tends not to do as well under Republicans or is that some sort of selective bias.  We've had an upward climb in the stock market since early 2009.  I expect a fall, but I don't know.  It could also become the biggest bull market in history.","False","0","1","DiscoConspiracy","dbv1e7s","False","t1_dbupa85","null","1483258193"
"t3_5lbdw1","t5_2cneq","1485687029","null","null","0","politics","> What I can't wait for is the first time that Congress vetoes something insane from Trump's admin and he takes to Twitter to shit on a Congress dominated by his own party.  That would be a truly epic thing to behold.","False","0","2","DiscoConspiracy","dbv1fbp","False","t1_dbv11gc","null","1483258287"
"t3_5lapxb","t5_2cneq","1485687045","null","null","0","politics","Simple.  Putin always gets what he wants.  Period.  No one can, or is willing to, stand up to him.  Any that do get crushed under his bootheels.  Now we will just have to see if this suspected trend I think I see finally breaks.","False","0","0","DiscoConspiracy","dbv1gkq","False","t1_dbuyvss","null","1483258394"
"t3_5lapxb","t5_2cneq","1485687057","null","null","0","politics","Imagine if he tried to warn us with his unpresidented comment.","False","0","1","DiscoConspiracy","dbv1hgq","False","t1_dbuw4v0","null","1483258471"
"t3_5lapxb","t5_2cneq","1485687060","null","null","0","politics","Today, we are all Putin.","False","0","1","DiscoConspiracy","dbv1ho8","False","t1_dbuwr7b","null","1483258489"
"t3_5lapxb","t5_2cneq","1485687067","null","null","0","politics","Russophiism is a thing.","False","0","1","DiscoConspiracy","dbv1i7q","False","t1_dbuqm2w","null","1483258535"
"t3_5lapxb","t5_2cneq","1485687098","null","null","0","politics","I'm definitely going to be looking out for my tax returns.","False","0","1","DiscoConspiracy","dbv1kjx","False","t1_dbuprfk","null","1483258744"
"t3_5lapxb","t5_2cneq","1485687103","null","null","0","politics","It's called being smart in business.","False","0","1","DiscoConspiracy","dbv1kwh","False","t1_dbug1mo","null","1483258774"
"t3_5lapxb","t5_2cneq","1485687132","null","null","0","politics","That recent DNC person who got killed and there was a big conspiracy thing on it, maybe Russia did it to tie up loose ends?","False","0","1","DiscoConspiracy","dbv1n4n","False","t1_dbu91gt","null","1483258977"
"t3_5lapxb","t5_2cneq","1485687139","null","null","0","politics","Cruz, Cruz, and Cruz!","False","0","1","DiscoConspiracy","dbv1nmm","False","t1_dbukura","null","1483259023"
"t3_5lapxb","t5_2cneq","1485687146","null","null","0","politics","> They'll also continue to chant America is #1 while completely ignoring facts like how we're not number one in very a large number of important life quality and economic metrics.  And I think letting Putin have his way pretty much guarantees the U.S. slips even further from #1 on the world stage.  Also...Inb4 the recent Syria deal.  Yes, I know.  Anyone who thought about responding with that need not if you don't really want to.  I know.","False","0","1","DiscoConspiracy","dbv1o68","False","t1_dbuebci","null","1483259070"
"t3_5lbdw1","t5_2cneq","1485687202","null","null","0","politics","If that's what Putin wants, I'm convinced it's going to happen.  Not only that, we may already be seeing a movement towards pro-Putinism/pro-Russia in some European countries.","False","0","1","DiscoConspiracy","dbv1sem","False","t1_dbv1lzh","null","1483259443"
"t3_5lapxb","t5_2cneq","1485687217","null","null","0","politics","I liked it.   Maybe it's the key words.  Washington Post (an organization).  Darker Suspicions (sounds nefarious).","False","0","1","DiscoConspiracy","dbv1thi","False","t1_dbukoin","null","1483259543"
"t3_5lapxb","t5_2cneq","1485687222","null","null","0","politics","How would you feel if there was any truth to Russia holding blackmail material on GOP and Republican politicians and leaders?","False","0","1","DiscoConspiracy","dbv1tvk","False","t1_dbuxin4","null","1483259579"
"t3_5lapxb","t5_2cneq","1485687239","null","null","0","politics","I hope not.  It makes me ill just thinking about it.  And to think, it would probably become some sort of sick Pepe meme.","False","0","1","DiscoConspiracy","dbv1v58","False","t1_dbuw4qh","null","1483259695"
"t3_5lapxb","t5_2cneq","1485687263","null","null","0","politics","Extreme example.  However...  I don't see Mitch saying that, but a complete 100% uber partisan that's just a regular person out in the streets saying that?  I think it's possible.  And scary.","False","0","4","DiscoConspiracy","dbv1wxm","False","t1_dbuvi6m","null","1483259866"
"t3_5lapxb","t5_2cneq","1485687278","null","null","0","politics","I was worried the documents relating to that would mysteriously go missing some time.  As far as I know, they're still on display in their frame.","False","0","3","DiscoConspiracy","dbv1y02","False","t1_dbuvjuu","null","1483259965"
"t3_5lapxb","t5_2cneq","1485687343","null","null","0","politics","That would assume our government agencies are super, super, competent.","False","0","2","DiscoConspiracy","dbv22y5","False","t1_dbucfbt","null","1483260427"
"t3_5lapxb","t5_2cneq","1485687347","null","null","0","politics","Who has more power and force in the world to make things happen?  Not Cuba.  Also, I think it's more about engaging directly with the Cuban people.  Not necessarily the government.  With Putin's Russia, we seem to have people of significance want to engage directly with Putin--solely and primarily.","False","0","2","DiscoConspiracy","dbv237x","False","t1_dbuqyvn","null","1483260453"
"t3_5ldbg0","t5_2cneq","1485687394","null","null","0","politics","He does have a point.  We could also go back to a barter system.  Trade sheeps, chickens, carrots, that sort of thing.","False","0","3","DiscoConspiracy","dbv26rg","False","t3_5ldbg0","null","1483260795"
"t3_5lbhw3","t5_2cneq","1485687452","null","null","0","politics","So if these legislators piss off their populace enough, assuming they're not cheering on their efforts, could not even gerrymandered districts be safe wins for them anymore?","False","0","1","DiscoConspiracy","dbv2b39","False","t3_5lbhw3","null","1483261193"
"t3_5lci8r","t5_2cneq","1485687488","null","null","0","politics","No.  Russia has no limits, no bounds.  Russia, and Putin, are forever.","False","0","-1","DiscoConspiracy","dbv2dqq","False","t3_5lci8r","null","1483261444"
"t3_5ld26n","t5_2cneq","1485687508","null","null","0","politics",">I think it's unfair if we don't know. It could be somebody else. I also know things that other people don't know so we cannot be sure, Trump said.  >Asked what that information included, the Republican President-elect said, You will find out on Tuesday or Wednesday.  I'm predicting a shocking revelation that we might already know, but that will be respun into new news.  Trump has to pour cold water over the Russia thing.","False","0","1","DiscoConspiracy","dbv2fbu","False","t3_5ld26n","null","1483261590"
"t3_5ld26n","t5_2cneq","1485687531","null","null","0","politics","Why not?","False","0","0","DiscoConspiracy","dbv2h07","False","t1_dbv06fj","null","1483261750"
"t3_5lapxb","t5_2cneq","1485692853","null","null","0","politics","I agree that he is popular.  However, Trump will win by a true landslide, 90%, next election.  The question is whether that will be on his own merits, principled ones and not manipulative ones, or with help.","False","0","1","DiscoConspiracy","dbvdijq","False","t1_dbv2iyb","null","1483292312"
"t3_5ld9rb","t5_2cneq","1485693073","null","null","0","politics","I remember the whole quote and I don't believe that is what he was saying.  >U.S. intelligence officials have said that they are confident Russia was behind the hacks of political figures, which could have played a role in Trump's defeat over Democratic presidential candidate Hillary Clinton.  >I think it's unfair if we don't know. It could be somebody else. I also know things that other people don't know so we cannot be sure, Trump said.  >Asked what that information included, the Republican President-elect said, You will find out on Tuesday or Wednesday.  http://www.reuters.com/article/us-usa-trump-idUSKBN14L0PP  He might be referring to how he knows or is some possession of information that we will find out Tuesday or Wednesday.  Possibly a bombshell, like the backroom behind the U.S. not vetoing the latest UN resolution.  It doesn't matter whether or not that information would be highly massaged or blown out of proportion.  What matters is how the message is portrayed.","False","0","2","DiscoConspiracy","dbvdz3p","False","t3_5ld9rb","null","1483293048"
"t3_5le5jv","t5_2cneq","1485693102","null","null","0","politics","You also forgot game the rules and ignore tradition.","False","0","4","DiscoConspiracy","dbve19h","False","t1_dbvd09f","null","1483293141"
"t3_5le5jv","t5_2cneq","1485693118","null","null","0","politics","Yes, it's the outcome that matters.  Not the steps to that outcome, whether unethical or not.  The Law is the Law.  Period.","False","0","5","DiscoConspiracy","dbve2fp","False","t1_dbvcgk4","null","1483293193"
"t3_5lfn6r","t5_2cneq","1485693431","null","null","0","politics","Well...One Party State under Republicans and all.  Am I right?  I just hope that since no one wants to help pay for anything, really, that Russia will be able to subsidize our health care and social programs for us.  How would that go over with Republicans if that happened?","False","0","4","DiscoConspiracy","dbvepyj","False","t1_dbvehng","null","1483294177"
"t3_5lfn6r","t5_2cneq","1485693475","null","null","0","politics","I want to put this up, so if anything happens--natural disaster, nuclear exchange that decimates me--this sign will remain among the ruins.  http://i.imgur.com/VNHIV1M.jpg","False","0","2","DiscoConspiracy","dbvet92","False","t1_dbvdpmi","null","1483294309"
"t3_5ld9rb","t5_2cneq","1485709673","null","null","0","politics","I may have spoke too soon.  Still, that might just be part of his conversational style.  > He added: “And I know a lot about hacking. And hacking is a very hard thing to prove. So it could be somebody else. And I also know things that other people don’t know, and so they cannot be sure of the situation.”  http://www.nytimes.com/2016/12/31/us/politics/donald-trump-russia-hacking.html?_r=0","False","0","1","DiscoConspiracy","dbwahzx","False","t1_dbvi2wq","null","1483341224"
"t3_5ld766","t5_2cneq","1485709756","null","null","0","politics","Doesn't Russia fund or have their own neonazis and/or fascists?","False","0","2","DiscoConspiracy","dbwao89","False","t1_dbw75qn","null","1483341634"
"t3_5ld766","t5_2cneq","1485709812","null","null","0","politics","Where's the proof?","False","0","1","DiscoConspiracy","dbwasdu","False","t1_dbv59os","null","1483341919"
"t3_5ld766","t5_2cneq","1485709879","null","null","0","politics","What happened with the FBI and those Hillary emails?","False","0","1","DiscoConspiracy","dbwaxce","False","t1_dbv8o5f","null","1483342263"
"t3_5ld766","t5_2cneq","1485709972","null","null","0","politics","It only had two choices.  Couldn't there have been more choices? Such as full independence?","False","0","1","DiscoConspiracy","dbwb49u","False","t1_dbv70w5","null","1483342756"
"t3_5ld766","t5_2cneq","1485710007","null","null","0","politics",">**Commitment to peace**  >As with many in Europe who had witnessed the horrors of the First World War and its aftermath, Chamberlain was committed to peace. The theory was that dictatorships arose where peoples had grievances, and that by removing the source of these grievances, the dictatorship would become less aggressive. It was a popular belief that the Treaty of Versailles was the underlying cause of Adolf Hitler's grievances. Chamberlain, as even his political detractors admitted, was an honourable man, raised in the old school of European politics. His attempts to deal with Nazi Germany through diplomatic channels and to quell any sign of dissent from within, particularly from Churchill, were called by Chamberlain The general policy of appeasement (30 June 1934).  https://en.wikipedia.org/wiki/Neville_Chamberlain%27s_European_Policy#Commitment_to_peace","False","0","1","DiscoConspiracy","dbwb6ir","False","t1_dbv6cnn","null","1483342921"
"t3_5ld766","t5_2cneq","1485710054","null","null","0","politics",">I want to punch the former in the face  You don't have to do that.","False","0","1","DiscoConspiracy","dbwb9e3","False","t1_dbvd91d","null","1483343124"
"t3_5ld766","t5_2cneq","1485710108","null","null","0","politics","Perhaps only history from the 1800s onward matters.  This means the U.S. is not a real country and rightfully belongs to Mother Russia.  /s","False","0","1","DiscoConspiracy","dbwbdek","False","t1_dbv4tbz","null","1483343426"
"t3_5ld766","t5_2cneq","1485710157","null","null","0","politics","Do you believe Cruz has pretty much forgiven Trump for the things he said?","False","0","1","DiscoConspiracy","dbwbh2k","False","t1_dbvdvtl","null","1483343698"
"t3_5ld766","t5_2cneq","1485710171","null","null","0","politics","I don't necessarily believe Trump is or HAS to be an instant cup of WW III.","False","0","1","DiscoConspiracy","dbwbi3k","False","t1_dbvkxr2","null","1483343775"
"t3_5ld766","t5_2cneq","1485710223","null","null","0","politics","> If they continue to act like total dicks, sanctions go back on.  By then it might be too late.  With the help of sanctions removal, Russia will have completely recovered and surpassed where they were before.  This gives them options.  I joke about Putin being around forever, but I think he has given hints he may be ready to retire (http://www.upi.com/Top_News/World-News/2015/03/27/Putin-hints-he-may-not-run-in-2018/6821427464714/).  And then we might have Lavrov or some other hawk in the Kremlin instead.","False","0","1","DiscoConspiracy","dbwbm1h","False","t1_dbvbys6","null","1483344079"
"t3_5ld766","t5_2cneq","1485710255","null","null","0","politics","Wrong.","False","0","1","DiscoConspiracy","dbwboda","False","t1_dbvzsg4","null","1483344252"
"t3_5lfmnt","t5_2cneq","1485710312","null","null","0","politics","2016 was a hell of a year.","False","0","2","DiscoConspiracy","dbwbskh","False","t1_dbvsnen","null","1483344574"
"t3_5lin3k","t5_2cneq","1485710355","null","null","0","politics","https://en.wikipedia.org/wiki/Shoe-banging_incident","False","0","0","DiscoConspiracy","dbwbvtb","False","t1_dbw28yx","null","1483344829"
"t3_5lfys8","t5_2cneq","1485710394","null","null","0","politics","Is this where we find out whether or not there was a deal made with Hillary or the Clintons that they will stay out of politics in exchange for no court cases?","False","0","1","DiscoConspiracy","dbwbyr8","False","t3_5lfys8","null","1483345056"
"t3_5lhho8","t5_2cneq","1485710405","null","null","0","politics","Will we be ok?","False","0","1","DiscoConspiracy","dbwbzio","False","t1_dbw67tc","null","1483345113"
"t3_5lfn6r","t5_2cneq","1485710413","null","null","0","politics","The People's Revolution in the U.S., under Russia, will continue.","False","0","1","DiscoConspiracy","dbwc069","False","t1_dbvf02v","null","1483345163"
"t3_5ld766","t5_2cneq","1485716692","null","null","0","politics","Where's the proof?","False","0","1","DiscoConspiracy","dbwoolb","False","t1_dbwcgw8","null","1483376230"
"t3_5llq30","t5_2cneq","1485717103","null","null","0","politics","Lets go ahead and interpret away as many rights and liberties as we can.  Here is how I think this idea could evolve:  On the street because of a bad economy, and nothing to do with one's own lack of merits? Tough.  Not the government's problem.  Seek charity, or get a job that doesn't exist!  Near complete automation in our future? It doesn't matter.  Everyone will need to get a job that no longer exists.  We're in the here and the now and don't have to prepare an infrastructure to support the future.  And even if we did, it's against America's founding ideals to free load, even though the Founders might not have ever envisioned a world of automation.  In need of emergency medical care? Can't pay for it? Turn them away.  Life's tough and unfair.  It's just how it is.  Bootstraps! Could preventative care that the person could not afford have prevented the ER visit? Who cares.  Let them go bankrupt, until we take even that option away.  Debtor's prisons it is.  Don't want to bake a cake for an same-sex couple? That's fine.  But discriminate against a favored religion? Shut their business and lock them up!  Can't afford college or even trade school? No problem.  Stay poor, rise in ranks in a nonexistent job since they all require degrees, or take a gamble and start a business--if it fails, become even more poor! In this future, we just took away Limited Liability and other entities because there were too many deadbeat businesses.  Worried about getting pregnant? Contraceptives made illegal, by government no less? That's too bad.  Be married, moral, religious, abstain, and sleep in two separate beds.  Even Israel and probably even Russia take care of the citizens more than currently appears planned for our future.  Can anyone else please help me with the dystopia I'm envisioning here if we take a completely hands off approach?","False","0","5","DiscoConspiracy","dbwpiq9","False","t1_dbwn3pe","null","1483377377"
"t3_5llq30","t5_2cneq","1485717150","null","null","0","politics","See, those people are homeless, poor, and happy.  Why can't we all be the same?","False","0","1","DiscoConspiracy","dbwpm94","False","t1_dbwn1ym","null","1483377508"
"t3_5llq30","t5_2cneq","1485717167","null","null","0","politics","I just hope this promised future can happen without sacrificing our free market and economic ideals.","False","0","1","DiscoConspiracy","dbwpnfk","False","t1_dbwljdj","null","1483377551"
"t3_5ll7yd","t5_2cneq","1485717231","null","null","0","politics","Will Trump be Putin's apprentice? Or will it be the other way around?","False","0","2","DiscoConspiracy","dbwps6p","False","t3_5ll7yd","null","1483377728"
"t3_5lii1e","t5_2cneq","1485717437","null","null","0","politics","i haven't seen anyone say this is fake news. Why?","False","0","2","DiscoConspiracy","dbwq7cs","False","t3_5lii1e","null","1483378289"
"t3_5ll9x7","t5_2cneq","1485717503","null","null","0","politics","If Republicans completely dismantle safety net programs, and if Trump's supporters become negatively affected with no sign of improvement, will fake news take up the slack and say how great we all are now?","False","0","1","DiscoConspiracy","dbwqc6h","False","t3_5ll9x7","null","1483378461"
"t3_5lgldi","t5_2cneq","1485717579","null","null","0","politics","I believe you left out Erdogan.","False","0","1","DiscoConspiracy","dbwqhqz","False","t1_dbw6cz9","null","1483378665"
"t3_5lgldi","t5_2cneq","1485717621","null","null","0","politics","Told ya.  Edit: But how, if under Duterte they're moving closer to China, will Duterte and Trump reconcile the Taiwan policy?","False","0","1","DiscoConspiracy","dbwqksd","1483379068","t3_5lgldi","null","1483378778"
"t3_5ll827","t5_2cneq","1485717645","null","null","0","politics","Trump will bludgeon the free market into submission through sheer force of will and great hair.","False","0","1","DiscoConspiracy","dbwqmob","False","t1_dbwjk81","null","1483378848"
