"author","score","stickied","gilded","body","subreddit","controversiality","author_flair_css_class","author_flair_text","subreddit_id","retrieved_on","link_id","distinguished","created_utc","id","edited","parent_id"
"Donald_J_Putin","0","False","0","Has the new Senate been started?  I believe that they started on the third.    Regardless, by the time it comes to voting, Pence will certainly be the tie breaker.","politics","1","maryland-flag","Maryland","t5_2cneq","1485860130","t3_5mm0dj","null","1483822938","dc4p79q","False","t1_dc4p17d"
"Donald_J_Putin","1","False","0","Only the racist ones.","politics","0","maryland-flag","Maryland","t5_2cneq","1485860135","t3_5krc8m","null","1483822955","dc4p7or","False","t1_dbq1rfy"
"Donald_J_Putin","8","False","0","Nice try with ""alt left"".  ","politics","0","maryland-flag","Maryland","t5_2cneq","1485860192","t3_5mmm4t","null","1483823121","dc4pby4","False","t1_dc4p12o"
"Donald_J_Putin","10","False","0","What does Putin want.  That's the real question.","politics","0","maryland-flag","Maryland","t5_2cneq","1485860823","t3_5mmmou","null","1483824900","dc4qn5y","False","t1_dc4orh4"
"Donald_J_Putin","6","False","0","> start applying tariffs to pay for then logically you have to put the money up front.  Tarriffs are paid for by domestic consumers.  But this certainly will be how he justifies it.  ","politics","0","maryland-flag","Maryland","t5_2cneq","1485860855","t3_5mmqe0","null","1483824985","dc4qphj","False","t1_dc4pjog"
"Donald_J_Putin","15","False","0","Genius people... http://imgur.com/a/j1H7T","politics","0","maryland-flag","Maryland","t5_2cneq","1485860907","t3_5mmors","null","1483825126","dc4qtc9","False","t1_dc4ontd"
"Donald_J_Putin","3","False","0","So we should simply find a way to vet and grant legal status to those workers.  But I'm sure you aren't for that either.    Jobs aren't taken.  Thats a misunderstanding of economics.  Immigrants, legal or illegal, add to the demand for labor as much as they supply if not more.  The bigger issue isn't that it affects labor markets negatively (they largely don't), but that losing all that prime age labor, albeit unskilled workers primarily, is that the cost of agricultural products and food prep will shoot up, making us all feel poorer.","politics","0","maryland-flag","Maryland","t5_2cneq","1485862123","t3_5mmyaw","null","1483828319","dc4tca9","False","t1_dc4qu21"
"Donald_J_Putin","2","False","0","Yes, they do help it.  Everytime you get cheaper produce and prepared foods, you are benefiting from it.","politics","0","maryland-flag","Maryland","t5_2cneq","1485862140","t3_5mmyaw","null","1483828357","dc4tdci","False","t1_dc4r1r2"
"Donald_J_Putin","4","False","0","http://wamu.org/story/12/03/02/immigrants_cope_with_the_stress_of_long_hours_low_pay/  Or pretty much any study of migrant laborers will show you that.  ","politics","0","maryland-flag","Maryland","t5_2cneq","1485862162","t3_5mmyaw","null","1483828417","dc4tf0b","False","t1_dc4smt8"
"Donald_J_Putin","2","False","0","It feels like the same misguided sentiments of the british in voting for the Brexit is similar to the misguided fears of those Americans who are against amnesty and tacking illegal immigration without forcibly deporting 11-12 million people.","politics","0","maryland-flag","Maryland","t5_2cneq","1485862225","t3_5mmyaw","null","1483828588","dc4tjpw","False","t1_dc4s3ie"
"Donald_J_Putin","2","False","0","Hey 2010 me: Romney will loose, unemployment will fall, wages will rise and we will have the abosulte worst of all the candidates this past election cycle win the whole enchilada.  I'm pretty sure 2010 me will know exactly who I mean.","politics","0","maryland-flag","Maryland","t5_2cneq","1485862273","t3_5mmyaw","null","1483828716","dc4tnaq","False","t1_dc4r188"
"Donald_J_Putin","11","False","0","Comment without reading the article?","politics","0","maryland-flag","Maryland","t5_2cneq","1485870826","t3_5mp4b8","null","1483852993","dc5bbk9","False","t1_dc5a0zn"
"Donald_J_Putin","2","False","0","Teen vogue has a good article last week actually. And the author brutalized Tucker Carlson on his show when he tried to attack it. ","politics","0","maryland-flag","Maryland","t5_2cneq","1485870912","t3_5mp7yq","null","1483853312","dc5bhw7","False","t1_dc5bdmq"
"Donald_J_Putin","39","False","0","Sadly, the black caucus leaders are getting old as dirt.  As much as I love and respect them.  Barbara Lee, Clyburn, and Elijah Cummings are all in their twilight.  I really hope there is some fresh blood coming in.","politics","0","maryland-flag","Maryland","t5_2cneq","1485878088","t3_5mr5sp","null","1483890334","dc5q3y8","False","t3_5mr5sp"
"Donald_J_Putin","9","False","0","I know you are just an Obama hater, but others reading this comment may like Tanahesis Coates article on his interview with Obama the other week.  It was critical of O for precisely this and was a great article  https://www.theatlantic.com/magazine/archive/2017/01/my-president-was-black/508793/  ","politics","0","maryland-flag","Maryland","t5_2cneq","1485878111","t3_5mr5sp","null","1483890412","dc5q5md","False","t1_dc5ohn9"
"Donald_J_Putin","11","False","0","Obama's impact on the black communities in particular was tempered precisely because he was the first black president.  Any specific actions he may have taken to favor black americans would have been attacked brutally.  But he still accomplished a lot.  the PPACA and some other measures were very impactful for black americans.  But certainly not enough.  https://www.theatlantic.com/magazine/archive/2017/01/my-president-was-black/508793/","politics","0","maryland-flag","Maryland","t5_2cneq","1485878136","t3_5mr5sp","null","1483890496","dc5q7hb","False","t1_dc5phhn"
"Donald_J_Putin","16","False","0","http://ll-media.tmz.com/2016/11/17/1117-mike-pence-selfie-twitter-8.jpg","politics","0","maryland-flag","Maryland","t5_2cneq","1485878160","t3_5mr5sp","null","1483890579","dc5q99y","False","t1_dc5plmx"
"Donald_J_Putin","15","False","0","https://www.washingtonpost.com/posteverything/wp/2016/07/21/white-people-think-racism-is-getting-worse-against-white-people/  Yeah, wont anyone think of the poor white people!!  Talk about persecution complex.","politics","0","maryland-flag","Maryland","t5_2cneq","1485878184","t3_5mr5sp","null","1483890653","dc5qay4","False","t1_dc5ofeo"
"Donald_J_Putin","31","False","0","Adam Shiff has been doing a good job these past weeks holding trump's pea-sized nuts to the fire.  ","politics","0","maryland-flag","Maryland","t5_2cneq","1485878199","t3_5mrbfw","null","1483890701","dc5qc23","False","t3_5mrbfw"
"Donald_J_Putin","1","False","0","This genius?  http://imgur.com/d9DM7Ja","politics","0","maryland-flag","Maryland","t5_2cneq","1485878213","t3_5mrcne","null","1483890749","dc5qd5b","False","t3_5mrcne"
"Donald_J_Putin","9","False","0","He's serving drinks.  edit: looks like he is guarding the door.","politics","0","maryland-flag","Maryland","t5_2cneq","1485878342","t3_5mr5sp","null","1483891177","dc5qmqp","False","t1_dc5qf4u"
"Donald_J_Putin","20","False","0","Change your flair to Macedonia.","politics","0","maryland-flag","Maryland","t5_2cneq","1485878518","t3_5mrgv1","null","1483891736","dc5qznb","False","t1_dc5qvze"
"Donald_J_Putin","2","False","0","9 out of 10 times his tweets contradict his spox.","politics","0","maryland-flag","Maryland","t5_2cneq","1485878551","t3_5mrc17","null","1483891841","dc5r23f","False","t1_dc5q5xm"
"Donald_J_Putin","2","False","0","The sanctions against Russia expire, some early this year.  The POTUS can decide whether to continue them at that point.  ","politics","0","maryland-flag","Maryland","t5_2cneq","1485879124","t3_5mrgkg","null","1483893601","dc5s8dq","False","t1_dc5rwz0"
"Donald_J_Putin","17","False","0","The average isn't a problem - having a mix of old and young is normal.  Its when all the leadership is over 70 that I worry.","politics","0","maryland-flag","Maryland","t5_2cneq","1485879359","t3_5mr5sp","null","1483894310","dc5spu7","False","t1_dc5se0o"
"Donald_J_Putin","20","False","0","> These cowards were all behind Hillary 100% during the primary.  Like most of the democratic party voters.  ","politics","0","maryland-flag","Maryland","t5_2cneq","1485879646","t3_5mr5sp","null","1483895144","dc5tb0n","False","t1_dc5t8fd"
"Donald_J_Putin","6","False","0","It could just be skewed.  Not many below 40 or above 80","politics","0","maryland-flag","Maryland","t5_2cneq","1485879987","t3_5mr5sp","null","1483896107","dc5u021","False","t1_dc5tpaw"
"Donald_J_Putin","2","False","0","Sounds like they do this time.  We will see.  ","politics","0","maryland-flag","Maryland","t5_2cneq","1485880009","t3_5mrohu","null","1483896170","dc5u1pr","False","t1_dc5t22q"
"Donald_J_Putin","14","False","0","Huffington Post is liberal, but not a waterboy for the DNC like Fox is for the RNC.","politics","0","maryland-flag","Maryland","t5_2cneq","1485880138","t3_5mrq9q","null","1483896523","dc5ub4n","False","t1_dc5t9vo"
"Donald_J_Putin","12","False","0","Considering Arriana despised the Clintons for a couple decades, I'd say they aren't.","politics","0","maryland-flag","Maryland","t5_2cneq","1485880191","t3_5mrq9q","null","1483896670","dc5uf2b","False","t1_dc5udsx"
"Donald_J_Putin","7","False","0","> There is no debate here these are facts.  Unless you have some verifiable metric for it, its your opinion.  Not facts.","politics","0","maryland-flag","Maryland","t5_2cneq","1485880257","t3_5mrq9q","null","1483896851","dc5ujvx","False","t1_dc5uh4t"
"Donald_J_Putin","9","False","0","I didn't deny they have a liberal bias.  But they are nowhere near Breidtbart which publishes false race baiting news on a daily basis.","politics","0","maryland-flag","Maryland","t5_2cneq","1485880462","t3_5mrq9q","null","1483897421","dc5uz6d","False","t1_dc5upb8"
"Donald_J_Putin","8","False","0","No, walls work great to show love.  http://imgur.com/a/OWJcB","politics","0","maryland-flag","Maryland","t5_2cneq","1485882801","t3_5msb7k","null","1483903370","dc5zrxz","False","t1_dc5z5eh"
"Donald_J_Putin","0","False","0","To build useless things?","politics","1","maryland-flag","Maryland","t5_2cneq","1485882818","t3_5msb7k","null","1483903411","dc5zt6j","False","t1_dc5zf1b"
"Donald_J_Putin","4","False","0","> Bridges, roads, and fiber optic cables aren't useless.  No, we are specifically talking about a wall with mexico.  ","politics","0","maryland-flag","Maryland","t5_2cneq","1485882967","t3_5msb7k","null","1483903761","dc6047r","False","t1_dc5zxe1"
"Donald_J_Putin","21","False","0","Wow, I was wondering if someone here was going to defend McConnell.  I guess its like those random polls that show there is still 5% of people who actually like how Congress is doing there job.","politics","0","maryland-flag","Maryland","t5_2cneq","1485883005","t3_5ms93g","null","1483903855","dc6071v","False","t1_dc5ywz8"
"Donald_J_Putin","7","False","0",">Who cares man. Just get the funding to put Americans back to work building shit. **Walls**, bridges, roads, fiber, **IDGAF**.  Yeah, sure sounds like you were advocating building useless stuff like a wall and IDGAF","politics","0","maryland-flag","Maryland","t5_2cneq","1485883119","t3_5msb7k","null","1483904138","dc60fbd","False","t1_dc60a1b"
"Donald_J_Putin","1","False","0","Well half your list implies you want to spend money for spending sake.","politics","0","maryland-flag","Maryland","t5_2cneq","1485884247","t3_5msb7k","null","1483906958","dc62q2m","False","t1_dc60rwt"
"Donald_J_Putin","1","False","0","I dont think anyone was arguing about building things of value.  ","politics","0","maryland-flag","Maryland","t5_2cneq","1485885775","t3_5msb7k","null","1483910920","dc65uqt","False","t1_dc63zlt"
"Donald_J_Putin","11","False","0","You mean that the other way around. ","politics","0","maryland-flag","Maryland","t5_2cneq","1485886087","t3_5mt694","null","1483911707","dc66hme","False","t1_dc667zo"
"Donald_J_Putin","1","False","0","Yeah. Virtually all bullshit ideas. I think the point of the responses to your comment is that building wall would not stimulate the economy. ","politics","0","maryland-flag","Maryland","t5_2cneq","1485886117","t3_5msb7k","null","1483911787","dc66jss","False","t1_dc66bvg"
"Donald_J_Putin","3","False","0","Get over it.  The guy in the whitehouse this month is the problem.","politics","0","maryland-flag","Maryland","t5_2cneq","1485888201","t3_5mr5sp","null","1483916934","dc6aupm","False","t1_dc69c78"
"Donald_J_Putin","1","False","0","We are not in recession.  ","politics","0","maryland-flag","Maryland","t5_2cneq","1485888232","t3_5msb7k","null","1483917018","dc6ax2q","False","t1_dc67f2z"
"Donald_J_Putin","2","False","0","I like Donna Edwards too.  These folks should be higher up in the party","politics","0","maryland-flag","Maryland","t5_2cneq","1485891106","t3_5mr5sp","null","1483923977","dc6gsaq","False","t1_dc6fizy"
"Donald_J_Putin","3","False","0","Really?!... yeah.  Really.  What the fuck?  Looks like he deleted it.  I guess he mixed up the novelty fake trump account with the real thing and just blindly amen'ed it.  Really weird.","politics","0","maryland-flag","Maryland","t5_2cneq","1485891448","t3_5mukm7","null","1483924923","dc6hhch","1483925105","t3_5mukm7"
"Donald_J_Putin","6","False","0","Powerful and emotional.  Of course she is preaching to the choir, but for those of us against Trump it is very nice to hear.  ","politics","0","maryland-flag","Maryland","t5_2cneq","1485895867","t3_5mvi0b","null","1483938020","dc6qfbm","False","t1_dc6o6ta"
"Donald_J_Putin","3","False","0","No, you're tears.","politics","0","maryland-flag","Maryland","t5_2cneq","1485895904","t3_5mvi0b","null","1483938148","dc6qi2v","False","t1_dc6pg48"
"Donald_J_Putin","3","False","0","I think the confusion you are having is that there is a person on first base who has the unusual name ""who"".","politics","0","maryland-flag","Maryland","t5_2cneq","1485895918","t3_5mvi0b","null","1483938192","dc6qj4a","False","t1_dc6pv9w"
"Donald_J_Putin","74","False","0","So basically you dismiss the whole heartfelt speech because you think she was being dismissive of MMA, like its lower class entertainment?  Awards shows suck balls but the whole point of them is for the film and television industry to self congratulate itself for being more important than it is.  Who cares if they take a jab at Trump?","politics","0","maryland-flag","Maryland","t5_2cneq","1485895992","t3_5mvi40","null","1483938459","dc6qoo5","False","t1_dc6q2wa"
"Donald_J_Putin","2","False","0","Not yet.  Soon . ","politics","0","maryland-flag","Maryland","t5_2cneq","1485896061","t3_5mvp37","null","1483938707","dc6qtux","False","t1_dc6q6mi"
"Donald_J_Putin","67","False","0","The actions of Trump to this point should not be normalized.  People should speak out, protest and hold him to his words.  This is really the heart of it:  >This instinct to humiliate, when it’s modeled by someone in the public platform, by someone powerful, it filters down into everybody’s life, because it kinda gives permission for other people to do the same thing. Disrespect invites disrespect, violence incites violence. And when the powerful use their position to bully others we all lose. O.K., go on with it.  Do you really disagree with any of that?","politics","0","maryland-flag","Maryland","t5_2cneq","1485896169","t3_5mvi40","null","1483939094","dc6r1ya","False","t1_dc6qv1y"
"Donald_J_Putin","10","False","0","Most voters in every city. ","politics","0","maryland-flag","Maryland","t5_2cneq","1485904520","t3_5my0w3","null","1483976562","dc77ovf","False","t1_dc76ri5"
"Donald_J_Putin","7","False","0","President Celebrity doesn't appreciate that jab.  ","politics","0","maryland-flag","Maryland","t5_2cneq","1485904564","t3_5mxzy7","null","1483976682","dc77s50","False","t1_dc75td5"
"Donald_J_Putin","12","False","0","More so than reality TV hucksters. ","politics","0","maryland-flag","Maryland","t5_2cneq","1485904572","t3_5mxzy7","null","1483976701","dc77sp7","False","t1_dc76z3p"
"Donald_J_Putin","7","False","0","Its funny to watch people do mental gymnastics to pretend its an innocent meme.","politics","0","maryland-flag","Maryland","t5_2cneq","1485907645","t3_5mys8u","null","1483984227","dc7e301","False","t1_dc7e0jb"
"Donald_J_Putin","11","False","0","The swastika isn't a nazi symbol.  Its been an indian one for centuries.","politics","0","maryland-flag","Maryland","t5_2cneq","1485907656","t3_5mys8u","null","1483984252","dc7e3ro","False","t1_dc7do5h"
"Donald_J_Putin","3","False","0","I just think its weird that the Russian embassy is using the same meme that Trump supporters are so fond of.","politics","0","maryland-flag","Maryland","t5_2cneq","1485907803","t3_5mys8u","null","1483984602","dc7ees9","False","t1_dc7e91r"
"Donald_J_Putin","1","False","0","https://www.youtube.com/watch?v=vkxxxuWLSac","politics","0","maryland-flag","Maryland","t5_2cneq","1485907807","t3_5myyvc","null","1483984615","dc7ef5o","False","t3_5myyvc"
"Donald_J_Putin","4","False","0","All I know is Pepe is a symbol used by the alt right.  It's not exactly a secret handshake.","politics","0","maryland-flag","Maryland","t5_2cneq","1485908242","t3_5mys8u","null","1483985639","dc7fb3k","False","t1_dc7eqfc"
"Donald_J_Putin","9","False","0","1% of congress is actual voting.  99% is parliamentary procedures used to shape and/or delay legislation and votes.","politics","0","maryland-flag","Maryland","t5_2cneq","1485908294","t3_5myx9b","null","1483985766","dc7fezo","False","t1_dc7fa1d"
"Donald_J_Putin","7","False","0","Also, the reason Trump won is that people like Megan McCain and her father normalized his campaign and fell in line.","politics","0","maryland-flag","Maryland","t5_2cneq","1485908351","t3_5mz9mg","null","1483985903","dc7fj9j","False","t1_dc7ff7f"
"Donald_J_Putin","6","False","0","> alt right is a clumsy attempt to delegitimize them  Huh?","politics","0","maryland-flag","Maryland","t5_2cneq","1485908511","t3_5mys8u","null","1483986285","dc7fv36","False","t1_dc7fl7u"
"Donald_J_Putin","2","False","0","> You don't see how declaring a cartoon frog meme as the symbol of a political group is an attempt to attack said group?  No, its a symbol they appropriated on their own.  ","politics","0","maryland-flag","Maryland","t5_2cneq","1485909040","t3_5mys8u","null","1483987535","dc7gy71","False","t1_dc7gn27"
"Donald_J_Putin","1","False","0","https://en.wikipedia.org/wiki/District_of_Columbia_home_rule","politics","0","maryland-flag","Maryland","t5_2cneq","1485910370","t3_5mzosa","null","1483990619","dc7jom3","False","t1_dc7izo4"
"Donald_J_Putin","5","False","0","For the kool aid drinkers?  Nah.  https://www.instagram.com/p/BH7pXnKj5t_/","politics","0","maryland-flag","Maryland","t5_2cneq","1485933771","t3_5n5mm2","null","1484065392","dc8v91l","False","t1_dc8u8gl"
"Donald_J_Putin","1","False","0","How can Sue Collins stick by the GOP for so long?  Will she go full Spector next time she's up for reelection?","politics","0","maryland-flag","Maryland","t5_2cneq","1485933792","t3_5n5puv","null","1484065447","dc8vans","False","t3_5n5puv"
"Donald_J_Putin","158","False","0","Bush did the same thing for Fox News, elevating it from a third tier news network to number one.","politics","0","maryland-flag","Maryland","t5_2cneq","1485964944","t3_5ndlvw","null","1484157644","dcamkct","False","t1_dcamch4"
"Donald_J_Putin","8","False","0","He clearly didn't want to answer a hard question and went to one of his own supporters.  That's not going to always work - the press pool doesn't take nice to those things.  ","politics","0","maryland-flag","Maryland","t5_2cneq","1485964976","t3_5ndlvw","null","1484157712","dcammmm","False","t1_dcam5dq"
"Donald_J_Putin","4","False","0","> When they are this disingenuous it's no surprise he won.  Right.  That's the reason.  Wasn't that a foreign nation engaged in a disinformation and propaganda campaign to get Trump elected.","politics","0","maryland-flag","Maryland","t5_2cneq","1485965000","t3_5ndlvw","null","1484157764","dcamoel","False","t1_dcamea0"
"Donald_J_Putin","1","False","0","I see its snowing in Russia right now.  ","politics","0","maryland-flag","Maryland","t5_2cneq","1485965007","t3_5ndlvw","null","1484157778","dcamoxc","False","t1_dcam5sl"
"Donald_J_Putin","4","False","0","> CNN reported that reading leaked emails from wiki leaks was illega  No, they didn't . ","politics","0","maryland-flag","Maryland","t5_2cneq","1485965014","t3_5ndlvw","null","1484157795","dcampho","False","t1_dcamgdv"
"Donald_J_Putin","408","False","0","...like had he banned specific press organizations like Wapo from the press pool during the campaign.  Something like that would have tipped us off to it.","politics","0","maryland-flag","Maryland","t5_2cneq","1485965037","t3_5ndlvw","null","1484157846","dcamr5p","False","t1_dcamdqi"
"Donald_J_Putin","92","False","0","It took two years from Watergate to resignation.  Here's hoping that 2018 is a watershed year.","politics","0","maryland-flag","Maryland","t5_2cneq","1485965055","t3_5ndlvw","null","1484157884","dcamsfs","False","t1_dcam175"
"Donald_J_Putin","-1","False","0","Yeah, totally the same level of danger to the country.","politics","0","maryland-flag","Maryland","t5_2cneq","1485965065","t3_5ndlvw","null","1484157905","dcamt60","False","t1_dcamczc"
"Donald_J_Putin","5","False","0","I'm quite confident that reports that his campaign met with mid level russian officials, which is at least impeachable.  ","politics","0","maryland-flag","Maryland","t5_2cneq","1485965084","t3_5ndlvw","null","1484157949","dcamulc","False","t1_dcam41l"
"Donald_J_Putin","1","False","0","Duh.  What tipped you off to that?","politics","0","maryland-flag","Maryland","t5_2cneq","1485965122","t3_5ndlvw","null","1484158030","dcamxa5","False","t1_dcam32s"
"Donald_J_Putin","7","False","0","Yeah, he brings supporters to cheer his answers.  ","politics","0","maryland-flag","Maryland","t5_2cneq","1485965135","t3_5ndlvw","null","1484158060","dcamy9t","False","t1_dcam8z0"
"Donald_J_Putin","5","False","0","I'm guessing two years.  Either congress will start worrying about hemorrhaging seats in 2018 or Trump will get frustrated by his impotence and step down.  Regardless, the next two years will be historical in terms of presidential politics which will make Watergate seem small. ","politics","0","maryland-flag","Maryland","t5_2cneq","1485965176","t3_5ndlvw","null","1484158148","dcan174","False","t1_dcam0ob"
"Donald_J_Putin","1","False","0","> Donald Trump will still be your President.  At least for the next year or two while congress takes control.","politics","0","maryland-flag","Maryland","t5_2cneq","1485965195","t3_5ndlvw","null","1484158191","dcan2ke","False","t1_dcam7rm"
"Donald_J_Putin","1","False","0","No, because his campaign sent people to meet with mid level russian officials to coordinate information leaks.  ","politics","0","maryland-flag","Maryland","t5_2cneq","1485965211","t3_5ndlvw","null","1484158229","dcan3rl","False","t1_dcambu4"
"Donald_J_Putin","2","False","0","""Its illegal to possess these illegal documents..."" not read them.  Yes, obtaining private email information through hacking is illegal.","politics","0","maryland-flag","Maryland","t5_2cneq","1485965242","t3_5ndlvw","null","1484158292","dcan5w5","False","t1_dcan1yn"
"Donald_J_Putin","3","False","0","Well, sure, I'd rather they put Clinton in charge, or even Rmoney.  Heck, I'd tale Kasich.  Hell, I'd take frothy santorum.  Still better than Trump.  And, Pence would have to run with Trump around his neck.  That would be hard after Trump leaves in disgrace.  And Ford, who wasn't very much tied to Nixon, still lost to Carter.","politics","0","maryland-flag","Maryland","t5_2cneq","1485966915","t3_5ndlvw","null","1484162021","dcaqjfw","False","t1_dcap371"
"Donald_J_Putin","1","False","0","""Its illegal to posses these stolen documents""  Its like you didn't listen to a 15 second quote.","politics","0","maryland-flag","Maryland","t5_2cneq","1485966932","t3_5ndlvw","null","1484162058","dcaqkol","False","t1_dcaocrt"
"Donald_J_Putin","1","False","0","> means reading it at all?  Feel free to cite your case law on this.","politics","0","maryland-flag","Maryland","t5_2cneq","1485966950","t3_5ndlvw","null","1484162102","dcaqm23","False","t1_dcao6t5"
"Donald_J_Putin","3","False","0","Unlikely, but people often forget that 2006 was a complete surprise for the DNCC.  Leadership didn't even have the phone numbers of all the winning candidates that night to call and congratulate them.    Its certainly a possibility that if corruption becomes undeniable and GOP digs a hole defending Trump, even some relatively safe red districts could be contested.  Of course, the dems in 2006 ran on rolling back the Iraq war and putting a check on W, not impeachment.  They were pretty adamant about not wanting to impeach.","politics","0","maryland-flag","Maryland","t5_2cneq","1485967019","t3_5ndlvw","null","1484162254","dcaqr3e","False","t1_dcanscu"
"Donald_J_Putin","0","False","0","I was thinking Roger Stone who said he had met with people involved in wikileaks and was in contact with people in the Kremlin about imminent leaks.","politics","0","maryland-flag","Maryland","t5_2cneq","1485967037","t3_5ndlvw","null","1484162296","dcaqseo","False","t1_dcanrhu"
"Donald_J_Putin","1","False","0","Yeah, I agree its similar in the sense that the coverup becomes the controversy beyond the act itself.  In this case, however, the claims themselves are bad enough to impeach IMO (not the pissing part).","politics","0","maryland-flag","Maryland","t5_2cneq","1485967064","t3_5ndlvw","null","1484162359","dcaqufl","False","t1_dcanntd"
