"author","score","stickied","gilded","body","subreddit","controversiality","author_flair_css_class","author_flair_text","subreddit_id","retrieved_on","link_id","distinguished","created_utc","id","edited","parent_id"
"Donald_J_Putin","1","False","0","I guess he is.  I just hate the comparison.","politics","0","maryland-flag","Maryland","t5_2cneq","1486212159","t3_5p4w4d","null","1484932028","dcoff9f","False","t1_dcof96w"
"Donald_J_Putin","1","False","0","I didn't say exactly.  I said at least.","politics","0","maryland-flag","Maryland","t5_2cneq","1486212190","t3_5p4dbw","null","1484932090","dcofhb1","False","t1_dcofd0j"
"Donald_J_Putin","3","False","0","I guess in my mind I want to see a difference between someone who wants to help the common man versus someone who simply wants to appeal to the common man.","politics","0","maryland-flag","Maryland","t5_2cneq","1486212285","t3_5p4w4d","null","1484932283","dcofnvw","False","t1_dcofi67"
"Donald_J_Putin","1","False","0","Ha, jokes on you - America will drop bombs first.","politics","0","maryland-flag","Maryland","t5_2cneq","1486212295","t3_5p4tc8","null","1484932304","dcofona","False","t1_dcofm9p"
"Donald_J_Putin","1","False","0","http://imgur.com/a/5pde6","politics","0","maryland-flag","Maryland","t5_2cneq","1486212301","t3_5p4tc8","null","1484932317","dcofp3t","False","t1_dcofm86"
"Donald_J_Putin","1","False","0","They all seem to be closing their eyes and breathing deeply.  I say the Obamas do it.","politics","0","maryland-flag","Maryland","t5_2cneq","1486212317","t3_5p4tc8","null","1484932345","dcofq65","False","t1_dcofm7a"
"Donald_J_Putin","2","False","0","Along with 60 million of us.","politics","0","maryland-flag","Maryland","t5_2cneq","1486212323","t3_5p4tc8","null","1484932359","dcofqou","False","t1_dcofm62"
"Donald_J_Putin","1","False","0","Where are the Jodie Foster fans when you need them?","politics","0","maryland-flag","Maryland","t5_2cneq","1486212333","t3_5p4tc8","null","1484932378","dcofrdv","False","t1_dcoflzj"
"Donald_J_Putin","1","False","0","https://www.washingtonpost.com/politics/how-voters-who-heavily-supported-obama-switched-over-to-trump/2016/11/10/65019658-a77a-11e6-ba59-a7d93165c6d4_story.html  Sorry to say, it happened.","politics","0","maryland-flag","Maryland","t5_2cneq","1486212377","t3_5p4dbw","null","1484932467","dcofujm","False","t1_dcofqk7"
"Donald_J_Putin","12","False","0","Wait until you see the crowd tomorrow and realize that you are wrong.","politics","0","maryland-flag","Maryland","t5_2cneq","1486212438","t3_5p4w5e","null","1484932585","dcofys6","False","t1_dcoe7t5"
"Donald_J_Putin","4","False","0","""The time for empty talk is over""  Glad we agree.","politics","0","maryland-flag","Maryland","t5_2cneq","1486212447","t3_5p4tc8","null","1484932602","dcofzcz","False","t3_5p4tc8"
"Donald_J_Putin","1","False","0","That actually would have been a good time to drop the mic and walk off stage.","politics","0","maryland-flag","Maryland","t5_2cneq","1486212486","t3_5p4tc8","null","1484932678","dcog1xo","False","t1_dcog0n3"
"Donald_J_Putin","41","False","0","Finally, white people are represented by the government.  /s","politics","0","maryland-flag","Maryland","t5_2cneq","1486212502","t3_5p4yub","null","1484932711","dcog33m","False","t1_dcoehy3"
"Donald_J_Putin","13","False","0","To be fair, DC is a very democratic city, so Trump fans have to drive in from farther away.  I think in 2012 and 2008, everyone in DC showed up for the event.  ","politics","0","maryland-flag","Maryland","t5_2cneq","1486212525","t3_5p4yub","null","1484932757","dcog4qq","False","t1_dcof73c"
"Donald_J_Putin","1","False","0","It always is.  Because most of america likes to pretend they are righteous.  ","politics","0","maryland-flag","Maryland","t5_2cneq","1486212659","t3_5p4tc8","null","1484933017","dcogdx9","False","t1_dcogcff"
"Donald_J_Putin","1","False","0","Nothing memorable.  Awkward cadence and lots of snorts.  No olive branch or magnanimity.  ","politics","0","maryland-flag","Maryland","t5_2cneq","1486212675","t3_5p4tc8","null","1484933047","dcogezy","False","t1_dcogcaw"
"Donald_J_Putin","9","False","0","Who, Bannon?","politics","0","maryland-flag","Maryland","t5_2cneq","1486212746","t3_5p52iv","null","1484933181","dcogjtz","False","t1_dcoggn5"
"Donald_J_Putin","12","False","0","> conducting business privately   That's certainly as bad.","politics","0","maryland-flag","Maryland","t5_2cneq","1486212758","t3_5p52iv","null","1484933206","dcogkp8","False","t1_dcogdh7"
"Donald_J_Putin","5","False","0",">spent a shit load of time with lawyers   And someone hasn't done anything to avoid conflicts.  He is all BS and his supporters lap it up.  You really think those stacks of paper were real?","politics","0","maryland-flag","Maryland","t5_2cneq","1486212792","t3_5p52iv","null","1484933270","dcogmyz","False","t1_dcofo9n"
"Donald_J_Putin","1","False","0","Good to know.  I guess I didn't know how bad Jeffries is.","politics","0","maryland-flag","Maryland","t5_2cneq","1486213339","t3_5p4pkr","null","1484934400","dcohor8","False","t1_dcohlho"
"Donald_J_Putin","1","False","0","Yeah, part of the advantage of being old, I guess - just show up with a SS number.  ","politics","0","maryland-flag","Maryland","t5_2cneq","1486213464","t3_5p4f9t","null","1484934663","dcohx9a","False","t1_dcohs49"
"Donald_J_Putin","6","False","0","That's like trying to get away with robbing a bank by returning the money once caught.  ","politics","0","maryland-flag","Maryland","t5_2cneq","1486213493","t3_5p52iv","null","1484934728","dcohzdd","False","t1_dcogyh7"
"Donald_J_Putin","3","False","0","His films werent negotiating deals with international entities.  And I'm not sure any policy conflicts Reagan would have with reruns of his films on TNT.","politics","0","maryland-flag","Maryland","t5_2cneq","1486213519","t3_5p52iv","null","1484934783","dcoi176","False","t1_dcog16u"
"Donald_J_Putin","6","False","0","And he won't.  ","politics","0","maryland-flag","Maryland","t5_2cneq","1486213526","t3_5p52iv","null","1484934800","dcoi1q4","False","t1_dcognse"
"Donald_J_Putin","11","False","0","Not if he plans on getting nothing done and just blaming them for it.","politics","0","maryland-flag","Maryland","t5_2cneq","1486213546","t3_5p59su","null","1484934842","dcoi32l","False","t1_dcoi1d8"
"Donald_J_Putin","3","False","0","You are confusing the place in San Francisco where many a porno were filmed with the president.","politics","0","maryland-flag","Maryland","t5_2cneq","1486213567","t3_5p583z","null","1484934885","dcoi4gk","False","t1_dcogl9d"
"Donald_J_Putin","3","False","0","http://imgur.com/a/gi9iV","politics","0","maryland-flag","Maryland","t5_2cneq","1486213583","t3_5p583z","null","1484934922","dcoi5p9","False","t1_dcohk24"
"Donald_J_Putin","7","False","0","I made it an imgur pic so the lazy would click!  :)","politics","0","maryland-flag","Maryland","t5_2cneq","1486214251","t3_5p4e84","null","1484936333","dcojffk","False","t1_dcoj1uz"
"Donald_J_Putin","2","False","0","Except his hotel isn't a charity.  A charity is the recipient of proceeds, not the generator of them.  You are confusing the horse and the cart.","politics","0","maryland-flag","Maryland","t5_2cneq","1486214269","t3_5p52iv","null","1484936372","dcojgqu","False","t1_dcoi9sd"
"Donald_J_Putin","1","False","0","Ryan always looking out for Schumer.  Dont stain your shirt.","politics","0","maryland-flag","Maryland","t5_2cneq","1486214312","t3_5p59su","null","1484936459","dcojjl3","False","t1_dcojhxb"
"Donald_J_Putin","0","False","0","<while signing away america>","politics","0","maryland-flag","Maryland","t5_2cneq","1486214322","t3_5p59su","null","1484936482","dcojkcr","False","t1_dcojhsl"
"Donald_J_Putin","3","False","0","And this is why Trump will be remembered in 100 years as being the end.","politics","0","maryland-flag","Maryland","t5_2cneq","1486214388","t3_5p5civ","null","1484936604","dcojodt","False","t3_5p5civ"
"Donald_J_Putin","1","False","0","> the fuck? Isn't this obvious what hes actually going for?  gulp it up.","politics","0","maryland-flag","Maryland","t5_2cneq","1486215089","t3_5p52iv","null","1484938143","dcol29o","False","t1_dcojv2a"
"Donald_J_Putin","42","False","0","Hopefully not a Religious Freedom Act like in Indiana.  (yes, there was a RFA passed by Bill Clinton, but it wasnt close to what was in the IRFA)","politics","0","maryland-flag","Maryland","t5_2cneq","1486215226","t3_5p5l8h","null","1484938452","dcolc4j","False","t1_dcok0eq"
"Donald_J_Putin","1","False","0","> HEY GUIS MEMBER WHEN THE NFL DONATED THEIR ORGANIZATION TO BREAST CANCER HURR DURR > seriously. you're so dumb its astounding.  Nice.  ","politics","0","maryland-flag","Maryland","t5_2cneq","1486215262","t3_5p52iv","null","1484938533","dcoles9","False","t1_dcolbvn"
"Donald_J_Putin","1","False","0","Meanwhile, no one gives a fuck about it.  you chillax.","politics","0","maryland-flag","Maryland","t5_2cneq","1486215298","t3_5p5te0","null","1484938615","dcolhdr","False","t1_dcolfm4"
"Donald_J_Putin","5","False","0","It would probably hurt their party more than even Trump could if they impeached him.  A vast majority of their supporters are Tumpets and will throw a fit.  I seriously doubt the GOP has the balls to fracture their own party like its 1972.","politics","0","maryland-flag","Maryland","t5_2cneq","1486215559","t3_5p5kng","null","1484939214","dcom0b2","False","t1_dcojjo3"
"Donald_J_Putin","11","False","0","Nothing different will happen with Trump in regards to legislation.  Everything Pence wants will get done regardless.","politics","0","maryland-flag","Maryland","t5_2cneq","1486215579","t3_5p5kng","null","1484939259","dcom1nv","False","t1_dcoky16"
"Donald_J_Putin","19","False","0","beg more.","politics","0","maryland-flag","Maryland","t5_2cneq","1486215915","t3_5p5svw","null","1484940027","dcompsg","False","t1_dcomlvh"
"Donald_J_Putin","0","False","0","You banned yet?","politics","0","maryland-flag","Maryland","t5_2cneq","1486215970","t3_5p52iv","null","1484940151","dcomtqt","False","t1_dcojv2a"
"Donald_J_Putin","4","False","0","There are lots of independents who go both ways, though.","politics","0","maryland-flag","Maryland","t5_2cneq","1486215981","t3_5p5kng","null","1484940174","dcomuhr","False","t1_dcomscq"
"Donald_J_Putin","15","False","0","Didn't a number of Obama people get asked to stay on for now?","politics","0","maryland-flag","Maryland","t5_2cneq","1486216035","t3_5p5mvk","null","1484940293","dcomyca","False","t1_dcokcdv"
"Donald_J_Putin","29","False","0","He is now in the bubble that is the White House and obviously hasn't taken on any advisors willing to express dissenting opinions to him.  I'm sure he now gets his news largely from Breidbart and watching FOX.","politics","0","maryland-flag","Maryland","t5_2cneq","1486216077","t3_5p5ug4","null","1484940391","dcon1eb","False","t1_dcom626"
"Donald_J_Putin","95","False","0","I'll be there.  See you then!","politics","0","maryland-flag","Maryland","t5_2cneq","1486216087","t3_5p5ug4","null","1484940413","dcon233","False","t1_dcolpel"
"Donald_J_Putin","35","False","0","People seem to forget that DC is a big metro area full of non-republicans.  ","politics","0","maryland-flag","Maryland","t5_2cneq","1486216129","t3_5p5ug4","null","1484940509","dcon550","False","t1_dcolof2"
"Donald_J_Putin","53","False","0","God forbid a person not be allowed to discriminate based on gender, race, and sexual identity.","politics","0","maryland-flag","Maryland","t5_2cneq","1486216232","t3_5p5l8h","null","1484940731","dconc30","False","t1_dconak5"
"Donald_J_Putin","4","False","0","> It's what happens when you give white trash money.  I think its more about Trump getting off on taking small jabs at his opposition.  Its petty of him to do, but it distracts from other things more serious.","politics","0","maryland-flag","Maryland","t5_2cneq","1486216336","t3_5p5svw","null","1484940965","dconjhr","False","t1_dcolkvt"
"Donald_J_Putin","27","False","0","So do you also think businesses should be able to discriminate based on race?  You want the CRA repealed?","politics","0","maryland-flag","Maryland","t5_2cneq","1486216380","t3_5p5l8h","null","1484941065","dconmnc","False","t1_dconinn"
"Donald_J_Putin","1","False","0","Damn, kinda hoping you would slink back to T_D","politics","0","maryland-flag","Maryland","t5_2cneq","1486216445","t3_5p52iv","null","1484941219","dconrfv","False","t1_dconkj6"
"Donald_J_Putin","12","False","0","240 years aint a bad run, tho.  And people like Hamilton certainly weren't about protecting the aristocrats.","politics","0","maryland-flag","Maryland","t5_2cneq","1486216512","t3_5p5wps","null","1484941371","dconw8j","False","t1_dcomipt"
"Donald_J_Putin","1","False","0","What do you think about the 2nd amendment?","politics","0","maryland-flag","Maryland","t5_2cneq","1486216540","t3_5p5wps","null","1484941435","dcony95","False","t1_dconhxr"
"Donald_J_Putin","9","False","0","I would give you gold, but I'd rather not contribute more to this website that enables Trump and his supporters.","politics","0","maryland-flag","Maryland","t5_2cneq","1486216604","t3_5p5wps","null","1484941584","dcoo2wo","False","t1_dconip6"
"Donald_J_Putin","13","False","0","I don't think Obama was a con artist.","politics","0","maryland-flag","Maryland","t5_2cneq","1486216614","t3_5p5wps","null","1484941607","dcoo3l8","False","t1_dcomded"
"Donald_J_Putin","1","False","0","I do what I want, as do you.","politics","0","maryland-flag","Maryland","t5_2cneq","1486216675","t3_5p52iv","null","1484941749","dcoo7zc","False","t1_dconzrx"
"Donald_J_Putin","20","False","0","Except Trump has a history of discriminating in his businesses.  Why expect different now?","politics","0","maryland-flag","Maryland","t5_2cneq","1486216740","t3_5p5vcr","null","1484941895","dcoockw","False","t1_dcoo3ip"
"Donald_J_Putin","17","False","0","and rich.","politics","0","maryland-flag","Maryland","t5_2cneq","1486216745","t3_5p5vcr","null","1484941908","dcoocz2","False","t1_dconn41"
"Donald_J_Putin","9","False","0","> Also the ""natives"" immigrated here too at one point.  There wasn't a country or people living here when they did.  ","politics","0","maryland-flag","Maryland","t5_2cneq","1486216763","t3_5p5vcr","null","1484941948","dcooe8v","False","t1_dcoo29d"
"Donald_J_Putin","22","False","0","There were many riots during the civil riots era that were violent and destructive.  I think both peaceful and violent protests have a place in the world.  ","politics","0","maryland-flag","Maryland","t5_2cneq","1486216803","t3_5p60ti","null","1484942039","dcooh5z","False","t1_dconyz2"
"Donald_J_Putin","14","False","0","When? 30 years ago?","politics","0","maryland-flag","Maryland","t5_2cneq","1486216957","t3_5p5vcr","null","1484942387","dcoos2a","False","t1_dcoolyz"
"Donald_J_Putin","3","False","0","Thanks for the thoughtful answer. ","politics","0","maryland-flag","Maryland","t5_2cneq","1486216981","t3_5p5wps","null","1484942442","dcoottz","False","t1_dcool35"
"Donald_J_Putin","10","False","0","The protesters seem energized.","politics","0","maryland-flag","Maryland","t5_2cneq","1486217010","t3_5p63c8","null","1484942507","dcoovzq","False","t1_dconp3b"
"Donald_J_Putin","8","False","0","Lol.  Are you justifying his third grade speaking to a desire to reach out to 3rd graders?  I think you are digging yourself into a pit of bullshittery. ","politics","0","maryland-flag","Maryland","t5_2cneq","1486217044","t3_5p63c8","null","1484942585","dcooyfn","False","t1_dcoouj2"
"Donald_J_Putin","13","False","0","Busy at work... on reddit.","politics","0","maryland-flag","Maryland","t5_2cneq","1486217124","t3_5p63c8","null","1484942773","dcop49p","False","t1_dconqvd"
"Donald_J_Putin","6","False","0","Well that tackiness goes back a long time, and somewhat rooted in his desire since young to be part of the manhattan elite.  They never liked him which he was always insecure about.","politics","0","maryland-flag","Maryland","t5_2cneq","1486217711","t3_5p5svw","null","1484943885","dcoq3b5","False","t1_dcop872"
"Donald_J_Putin","2","False","0","Actually, you said:  >Third graders are watching the speech too  Which is a funny justification for his shit speech.  ","politics","0","maryland-flag","Maryland","t5_2cneq","1486217733","t3_5p63c8","null","1484943937","dcoq4wx","False","t1_dcop4x2"
"Donald_J_Putin","2","False","0","Only the end of the world is the end of the world.","politics","0","maryland-flag","Maryland","t5_2cneq","1486217743","t3_5p5civ","null","1484943959","dcoq5ll","False","t1_dcop1qc"
"Donald_J_Putin","2","False","0","You would think he would want more demand to continue to boost property values.","politics","0","maryland-flag","Maryland","t5_2cneq","1486217769","t3_5p64uy","null","1484944018","dcoq7fe","False","t1_dcoprtl"
"Donald_J_Putin","7","False","0","> Black and hispanics who primarely benefitted from this  Wrong.","politics","0","maryland-flag","Maryland","t5_2cneq","1486217784","t3_5p64uy","null","1484944048","dcoq8f2","False","t1_dcopkqn"
"Donald_J_Putin","1","False","0","I only saw these on TV, but I felt like the protests during W's parade were bigger.  I was assuming its because of events planned for tomorrow.","politics","0","maryland-flag","Maryland","t5_2cneq","1486217829","t3_5p61cp","null","1484944152","dcoqbl3","False","t1_dcoohge"
"Donald_J_Putin","2","False","0","I actually was at the WTO protests in Seattle back then.  It was crazy.","politics","0","maryland-flag","Maryland","t5_2cneq","1486218071","t3_5p61cp","null","1484944710","dcoqsoj","False","t1_dcoqqsv"
"Donald_J_Putin","20","False","0","> Lugenspresse  And Trump's nazi supporters are the reason its being used now.","politics","0","maryland-flag","Maryland","t5_2cneq","1486218132","t3_5p69v3","null","1484944847","dcoqwzb","False","t1_dcopmue"
"Donald_J_Putin","3","False","0","> Guys.. like do you not fucking get it? When you cry about impeaching him the second he takes office, nobody is going to take it seriously if he ever actually fucks up and deserves to be impeached..  Are you speaking to reddit about this?  Because I don't think this post will help or hurt his impeachment chances.    The country has a very short memory, so unless its continuously pressed, it will be forgotten.","politics","0","maryland-flag","Maryland","t5_2cneq","1486218198","t3_5p67de","null","1484944999","dcor1re","False","t1_dcooxvp"
"Donald_J_Putin","2","False","0","Nixon was on the brink when he was elected his second term.  No reason to wait.","politics","0","maryland-flag","Maryland","t5_2cneq","1486218213","t3_5p67de","null","1484945031","dcor2re","False","t1_dcoq5jb"
"Donald_J_Putin","11","False","0",">“Now that he has taken the oath of office, President Trump stands in violation of the Constitution’s emoluments clause. He just swore on the Bible to ‘preserve, protect and defend the Constitution of the United States,’ but by continuing to accept payments from foreign governments, he has already failed.   You can disagree whether this is impeachable, but clearly there is an argument for why Trump is in breach by still conducting company business with foreign governments.","politics","0","maryland-flag","Maryland","t5_2cneq","1486218277","t3_5p66sr","null","1484945177","dcor76v","False","t1_dcop7ku"
"Donald_J_Putin","9","False","0","If my rich, jewish son in law isn't qualified, I don't know who is...","politics","0","maryland-flag","Maryland","t5_2cneq","1486218341","t3_5p6gfw","null","1484945314","dcorbl8","False","t3_5p6gfw"
"Donald_J_Putin","1","False","0","Not to start a shit storm, but outside of a UN resolution which is still disputed, what is illegal about these settlements?  I do agree that there wont be a peace deal if these continue, but the hard right Israelis don't want a two state deal.  ","politics","1","maryland-flag","Maryland","t5_2cneq","1486218378","t3_5p6gfw","null","1484945398","dcore7e","False","t1_dcor08u"
"Donald_J_Putin","5","False","0","Carter and Clinton both came close.","politics","0","maryland-flag","Maryland","t5_2cneq","1486218385","t3_5p6gfw","null","1484945417","dcorerq","False","t1_dcor9px"
"Donald_J_Putin","3","False","0","The Black Blocs are a small part of the protests, but certainly the most damaging.","politics","0","maryland-flag","Maryland","t5_2cneq","1486218405","t3_5p6fh3","null","1484945464","dcorg76","False","t1_dcoqt7v"
"Donald_J_Putin","7","False","0",">1 post karma  >-23 comment karma  Why the fuckl do these shit articles always get posted by some new account from 1 hour ago?  ","politics","0","maryland-flag","Maryland","t5_2cneq","1486218427","t3_5p6fh3","null","1484945517","dcorhsx","False","t3_5p6fh3"
"Donald_J_Putin","2","False","0","Mr. Needs Housecleaning?","politics","0","maryland-flag","Maryland","t5_2cneq","1486218455","t3_5p6csc","null","1484945577","dcorjpj","False","t3_5p6csc"
"Donald_J_Putin","1","False","0","Nice thoughtful comment.  I can imagine that minorities are disproportionately beneficiaries of the policy, though not necessarily the majority of those who benefit.  This accounts for about 40,000 mortgages?","politics","0","maryland-flag","Maryland","t5_2cneq","1486218509","t3_5p64uy","null","1484945694","dcornf4","False","t1_dcorivt"
"Donald_J_Putin","0","False","0","And that he is barely known.  I think guys like Kushner want to pull the strings, not be in the limelight.  ","politics","0","maryland-flag","Maryland","t5_2cneq","1486218530","t3_5p6cyl","null","1484945741","dcoroxf","False","t1_dcoqszz"
"Donald_J_Putin","2","False","0","But that doesn't mean everyone who has donors from Wall Street is being influenced.  ","politics","0","maryland-flag","Maryland","t5_2cneq","1486218549","t3_5p6cyl","null","1484945782","dcorq8c","False","t1_dcoqrmk"
"Donald_J_Putin","-4","False","0","I would have thought most would want to stay on for the country.","politics","0","maryland-flag","Maryland","t5_2cneq","1486218596","t3_5p5mvk","null","1484945895","dcortph","False","t1_dcorpun"
"Donald_J_Putin","1","False","0","I lived by capitol hill at the time and the tear gas was everywhere.","politics","0","maryland-flag","Maryland","t5_2cneq","1486218605","t3_5p61cp","null","1484945913","dcoruae","False","t1_dcorp2w"
"Donald_J_Putin","0","False","0","Can you provide a link on forced evacuations occurring?  I thought these settlements were going up in unoccupied areas.  Not that I disagree, but I'd like a source to use later on.","politics","1","maryland-flag","Maryland","t5_2cneq","1486218643","t3_5p6gfw","null","1484945999","dcorwzh","False","t1_dcormxl"
"Donald_J_Putin","48","False","0","More important, its a violation of law.  No government employee can promote a private enterprise.","politics","0","maryland-flag","Maryland","t5_2cneq","1486218819","t3_5p6i3o","null","1484946420","dcos9wq","False","t1_dcorfth"
"Donald_J_Putin","1","False","0","Do you think she personally owns her business, or that its shared by marriage?","politics","0","maryland-flag","Maryland","t5_2cneq","1486218835","t3_5p6i3o","null","1484946457","dcosb1w","False","t1_dcorfv9"
"Donald_J_Putin","2","False","0","I almost liked it better when Frank Langello said it in Frost Nixon.","politics","0","maryland-flag","Maryland","t5_2cneq","1486218854","t3_5p6i3o","null","1484946502","dcoscfv","False","t1_dcorxes"
"Donald_J_Putin","11","False","0","Wrong kid.  Eric and Don Jr are the ones with the body in an uptown apartment decomposing in a tub of acid.  Barron just looks like a scared young kid, maybe with asperger's, and largely not responsible for anything that happens to him. ","politics","0","maryland-flag","Maryland","t5_2cneq","1486218875","t3_5p6i3o","null","1484946553","dcosdyf","False","t1_dcorte1"
"Donald_J_Putin","19","False","0","No, but do you think she doesn't share ownership of her brand with Donald?","politics","0","maryland-flag","Maryland","t5_2cneq","1486218972","t3_5p6i3o","null","1484946777","dcosktm","False","t1_dcosgu5"
"Donald_J_Putin","5","False","0","Good point.  It was a last minute thing.  And surely they won't be trusted.","politics","0","maryland-flag","Maryland","t5_2cneq","1486218988","t3_5p5mvk","null","1484946815","dcosm0c","False","t1_dcosc2t"
"Donald_J_Putin","11","False","0","Was that debunked?","politics","0","maryland-flag","Maryland","t5_2cneq","1486219913","t3_5p6pdi","null","1484948982","dcoufg6","False","t1_dcotm5l"
"Donald_J_Putin","9","False","0","Soure?   ","politics","0","maryland-flag","Maryland","t5_2cneq","1486220037","t3_5p6pdi","null","1484949277","dcouo9z","False","t1_dcouibf"
"Donald_J_Putin","9","False","0","Don't hold breath.","politics","0","maryland-flag","Maryland","t5_2cneq","1486220053","t3_5p6nmp","null","1484949313","dcoupdx","False","t1_dcotfzw"
"Donald_J_Putin","2","False","0","DOMA was different.  There is a FRFRA  https://en.wikipedia.org/wiki/Religious_Freedom_Restoration_Act","politics","0","maryland-flag","Maryland","t5_2cneq","1486220996","t3_5p5l8h","null","1484951620","dcowkcv","False","t1_dcowfe6"
"Donald_J_Putin","11","False","0","An Op-Ed?","politics","0","maryland-flag","Maryland","t5_2cneq","1486221010","t3_5p6pdi","null","1484951653","dcowlao","False","t1_dcouyde"
"Donald_J_Putin","2","False","0","Tolerance doesn't apply to others' intolerance. ","politics","0","maryland-flag","Maryland","t5_2cneq","1486226720","t3_5p5l8h","null","1484967229","dcp7qdz","False","t1_dcp52ga"
"Donald_J_Putin","2","False","0","I'm not out to ban you from anything.  But if you are saying I dont like things I dont like, then that is a tautology.  ","politics","0","maryland-flag","Maryland","t5_2cneq","1486228894","t3_5p5l8h","null","1484974181","dcpc0xe","False","t1_dcp97xn"
"Donald_J_Putin","1","False","0","yes.  Eastlake shortly after that.","politics","0","maryland-flag","Maryland","t5_2cneq","1486228904","t3_5p61cp","null","1484974216","dcpc1ol","False","t1_dcp1ynb"
