"author","score","stickied","gilded","body","subreddit","controversiality","author_flair_css_class","author_flair_text","subreddit_id","retrieved_on","link_id","distinguished","created_utc","id","edited","parent_id"
"Donald_J_Putin","2","False","0","If we had a parliamentary system and he was a third party, I would be fine with the Dems reaching a deal to form a majority coalition with him.  It wouldn't happen, he is certainly conservative, but just to get some stability, intelligence and dignity back to the office would be a big gain.","politics","0","maryland-flag","Maryland","t5_2cneq","1486496970","t3_5qkkc4","null","1485564058","dd01ql3","False","t1_dd01ko4"
"Donald_J_Putin","3","False","0","1) Grow a nut tree like hazelnut.  2) Let pigs eat nuts.  3) ...  4) Eat the most delicious cured meats.","politics","0","maryland-flag","Maryland","t5_2cneq","1486496991","t3_5qkk3t","null","1485564124","dd01s4q","False","t1_dd01ir4"
"Donald_J_Putin","2","False","0","We have in many ways.  Democrats became very open to free trade and open markets.  They have turned towards market-based solutions to problems, like tradable pollution permits to the ACA.  But the point of being a progressive is to make progress, which sometimes means adopting ideas from the other side.  The GOP doesn't do that so much.  But that is what it means to be a conservative - to stick to the old ways.","politics","0","maryland-flag","Maryland","t5_2cneq","1486497060","t3_5qkkc4","null","1485564335","dd01x8y","False","t1_dd01tjm"
"Donald_J_Putin","2","False","0","Everyone person's pork is another's local spending.  I think everyone opposes blatant pork, but I wish they brought back earmarks to help facilitate legislation and even more investment.","politics","0","maryland-flag","Maryland","t5_2cneq","1486497234","t3_5qkkc4","null","1485564859","dd02a85","False","t1_dd0249w"
"Donald_J_Putin","1","False","0","You'll notice that those links are all from blog.wsj.  The actual articles in the paper are behind a paywall.","politics","0","maryland-flag","Maryland","t5_2cneq","1486498775","t3_5qhmne","null","1485569622","dd05em2","False","t1_dd040ir"
"Donald_J_Putin","60","False","0","He sounds exhausted. Shit, my dad is his age and taking a few walks and getting dinner is a days worth of energy. ","politics","0","maryland-flag","Maryland","t5_2cneq","1486501238","t3_5qlscx","null","1485577860","dd0ah49","False","t1_dd09t2b"
"Donald_J_Putin","36","False","0","Boredom can be a sign of heavy stress under pressure. ","politics","0","maryland-flag","Maryland","t5_2cneq","1486501249","t3_5qlscx","null","1485577898","dd0ahwg","False","t1_dd0a4o1"
"Donald_J_Putin","30","False","0","That's all it would take to fund about 1000 schools for a year. ","politics","0","maryland-flag","Maryland","t5_2cneq","1486501288","t3_5qlu9r","null","1485578041","dd0aksn","False","t1_dd0aj83"
"Donald_J_Putin","2","False","0","Don't order the lobster. ","politics","0","maryland-flag","Maryland","t5_2cneq","1486501298","t3_5qlsvf","null","1485578078","dd0aljn","False","t1_dd0a7p3"
"Donald_J_Putin","2","False","0","We can appreciate what he says without normalizing the rest of what Cheney did to fuck us the US. His daughter came out in favor of torture just yesterday, something he initiated. This interview doesn't make that moderate all of a sudden. ","politics","0","maryland-flag","Maryland","t5_2cneq","1486502294","t3_5qlyqz","null","1485581833","dd0clu9","False","t1_dd0bvuv"
"Donald_J_Putin","2","False","0","I think he is old, tired and stressed and simply doesn't have the facilities for it. ","politics","0","maryland-flag","Maryland","t5_2cneq","1486509057","t3_5qnd4z","null","1485618541","dd0ql73","False","t1_dd0lbrh"
"Donald_J_Putin","177","False","0","Holy shit!  I have students from some of those countries who will either not be able to continue here or not go home again.","politics","0","maryland-flag","Maryland","t5_2cneq","1486509508","t3_5qo49c","null","1485620009","dd0rivt","False","t3_5qo49c"
"Donald_J_Putin","26","False","0","This is in conflict with what Qatar arilines has posted:  http://www.qatarairways.com/uk/en/travel-alerts.page  Green card holders are permanent residents.  This is fucked if they are banned.  ","politics","0","maryland-flag","Maryland","t5_2cneq","1486509698","t3_5qo49c","null","1485620607","dd0rx3m","False","t3_5qo49c"
"Donald_J_Putin","25","False","0","I'm shocked as I was when I saw this coming.  ","politics","0","maryland-flag","Maryland","t5_2cneq","1486509702","t3_5qo49c","null","1485620622","dd0rxgq","False","t1_dd0qb06"
"Donald_J_Putin","4","False","0","Of course not.  ","politics","0","maryland-flag","Maryland","t5_2cneq","1486509721","t3_5qo49c","null","1485620680","dd0ryu5","False","t1_dd0rjfa"
"Donald_J_Putin","21","False","0","This happens every 20-30 years.  It was why the younger baby boomers couldn't vote for Humphrey and we got Nixon.  It's why decades later we got W because Gore wasn't cool enough.  And we now have Trump.  Its almost like every generation needs to make this mistake and hopefully millennials now understand the dangers.  The next generation will of course forget this lesson and we will have President Numnuts again in a couple decades.","politics","0","maryland-flag","Maryland","t5_2cneq","1486509773","t3_5qo49c","null","1485620843","dd0s2s8","False","t1_dd0rsc0"
"Donald_J_Putin","2","False","0","My bad.","politics","0","maryland-flag","Maryland","t5_2cneq","1486510017","t3_5qo49c","null","1485621594","dd0skwj","False","t1_dd0sjm4"
"Donald_J_Putin","24","False","0","This is fucked up.  I need to make some phone calls...","politics","0","maryland-flag","Maryland","t5_2cneq","1486510086","t3_5qo49c","null","1485621804","dd0sq38","False","t1_dd0slft"
"Donald_J_Putin","10","False","0","It is illegal.  And in case anyone feels like parotting the ""Carter did it with Iran"" talking point:  >While presidents have used their power dozens of times to keep out certain groups of foreigners under the 1952 law, no president has ever barred an entire nationality of immigrants without exception. In the most commonly cited case, President Jimmy Carter barred certain Iranians during the 1980 hostage crisis, but the targets were mainly students, tourists and temporary visitors. Even then, the policy had many humanitarian exceptions. Immigrants continued to be admitted in 1980.","politics","0","maryland-flag","Maryland","t5_2cneq","1486510103","t3_5qo8r4","null","1485621851","dd0sr91","False","t3_5qo8r4"
"Donald_J_Putin","2","False","0","Individually, I am sure many would like to.  Collective action is hard, which is always why the President has an advantage over congress blocking him.  ","politics","0","maryland-flag","Maryland","t5_2cneq","1486510113","t3_5qo8r4","null","1485621886","dd0ss39","False","t1_dd0rfom"
"Donald_J_Putin","5","False","0","I hope he goes the way of his likenesses like Sadam, Qadaffi, etc.","politics","0","maryland-flag","Maryland","t5_2cneq","1486510128","t3_5qo8r4","null","1485621932","dd0st87","False","t1_dd0rxig"
"Donald_J_Putin","3","False","0","At LBJ passed VRA, CRA and Medicare and Medicaid.  ","politics","0","maryland-flag","Maryland","t5_2cneq","1486510139","t3_5qo8r4","null","1485621964","dd0su0m","False","t1_dd0rh7l"
"Donald_J_Putin","2","False","0","Is that the same one being filed by refugees currently held?","politics","0","maryland-flag","Maryland","t5_2cneq","1486510148","t3_5qo8r4","null","1485621987","dd0sukd","False","t1_dd0rvwe"
"Donald_J_Putin","2","False","0","https://www.facebook.com/thenyic/posts/10154877384452381","politics","0","maryland-flag","Maryland","t5_2cneq","1486510207","t3_5qo49c","null","1485622164","dd0sz16","False","t1_dd0sy4j"
"Donald_J_Putin","3","False","0","https://www.facebook.com/thenyic/posts/10154877384452381","politics","0","maryland-flag","Maryland","t5_2cneq","1486510220","t3_5qo49c","null","1485622200","dd0szx0","False","t1_dd0sz0o"
"Donald_J_Putin","12","False","0","Fuck the GOP  http://imgur.com/a/Pbnxf","politics","0","maryland-flag","Maryland","t5_2cneq","1486510263","t3_5qo8q8","null","1485622329","dd0t35z","False","t3_5qo8q8"
"Donald_J_Putin","10","False","0","http://imgur.com/a/Pbnxf","politics","0","maryland-flag","Maryland","t5_2cneq","1486510275","t3_5qo8q8","null","1485622363","dd0t402","False","t1_dd0rgob"
"Donald_J_Putin","12","False","0","https://twitter.com/Evan_McMullin/status/825381180056940544  No shit.  ","politics","0","maryland-flag","Maryland","t5_2cneq","1486510286","t3_5qo8q8","null","1485622396","dd0t4u3","False","t1_dd0rmf5"
"Donald_J_Putin","4","False","0","I hope JFK and Reagan get ground to a halt.  ","politics","0","maryland-flag","Maryland","t5_2cneq","1486510385","t3_5qo49c","null","1485622682","dd0tc80","False","t1_dd0tb1h"
"Donald_J_Putin","9","False","0","The world will continue, but it will be another dark stain on human history.  And in the meantime, lots of unnecessary pain and suffering.    The right wing, alt right, and christian right are all a bunch of fucking selfish hypocrites.  A couple days after a march for life and they are standing idly by while lives are being lost.  http://imgur.com/a/Pbnxf ","politics","0","maryland-flag","Maryland","t5_2cneq","1486510498","t3_5qo49c","null","1485623009","dd0tkp4","False","t1_dd0tf4u"
"Donald_J_Putin","11","False","0","I'm starting to think I should join a mosque out of protest.  ","politics","1","maryland-flag","Maryland","t5_2cneq","1486510507","t3_5qof3z","null","1485623036","dd0tlef","False","t3_5qof3z"
"Donald_J_Putin","176","False","0","They are Pro Life!  http://imgur.com/a/Pbnxf ","politics","0","maryland-flag","Maryland","t5_2cneq","1486510513","t3_5qof3z","null","1485623053","dd0tltt","False","t1_dd0spwi"
"Donald_J_Putin","353","False","0","About 35-40% of the citizens do.  ","politics","0","maryland-flag","Maryland","t5_2cneq","1486510525","t3_5qof3z","null","1485623089","dd0tmpo","False","t1_dd0tjcw"
"Donald_J_Putin","1","False","0","I know this is somewhat trivial, but we need a symbol of resistance - a symbol that we can put on our homes, offices, cars, that shows our opposition.  A yellow ribbon for refugees.  I want a way to show my fellow humans that I am against this with all my heart.  That I will fight for them.  That I will provide safe haven, support, and that I value life.  http://imgur.com/a/Pbnxf ","politics","0","maryland-flag","Maryland","t5_2cneq","1486510632","t3_5qof3z","null","1485623407","dd0tusr","False","t3_5qof3z"
"Donald_J_Putin","16","False","0","I'm not in California.  That site is very useful information.  I just wonder if there are any national organizations I can turn to.   ","politics","0","maryland-flag","Maryland","t5_2cneq","1486510806","t3_5qo49c","null","1485623922","dd0u7uk","False","t1_dd0tywo"
"Donald_J_Putin","6","False","0","http://imgur.com/a/Pbnxf  Fucking hypocrites.  ","politics","0","maryland-flag","Maryland","t5_2cneq","1486510979","t3_5qodx8","null","1485624429","dd0ukrv","False","t1_dd0sd3x"
"Donald_J_Putin","8","False","0","Hey Pro Lifers, weren't you concerned about life?  http://imgur.com/a/Pbnxf ","politics","0","maryland-flag","Maryland","t5_2cneq","1486511030","t3_5qokix","null","1485624579","dd0uomn","False","t3_5qokix"
"Donald_J_Putin","2","False","0","It's an op-ed.  Even the NYTimes and Wapo publish opinions of some shitheads (Will, Kristol, etc)","politics","0","maryland-flag","Maryland","t5_2cneq","1486511045","t3_5qokix","null","1485624624","dd0upqz","False","t1_dd0ttug"
"Donald_J_Putin","1","False","0","I'd say that those are quite different.  Of course we aren't blocking UN members and their families.  ","politics","0","maryland-flag","Maryland","t5_2cneq","1486511096","t3_5qo8r4","null","1485624776","dd0utkb","False","t1_dd0upqj"
"Donald_J_Putin","1","False","0","2010 and 2014 were during a Democratic Presidency where it virtually always favors the other party.  2006 is the better comparison, which resulted in a +7% Democratic margin and a 50 seat majority.  While gerrymandering has made it harder, a +7% margin would flip the House.","politics","0","maryland-flag","Maryland","t5_2cneq","1486511123","t3_5qhvm5","null","1485624856","dd0uvjv","False","t1_dd0upia"
"Donald_J_Putin","3","False","0","I think Clinton would have won even without Perot.  Most analysis I have seen on it indicates that Perot pulled from both Bush and Clinton rather equally.","politics","0","maryland-flag","Maryland","t5_2cneq","1486511169","t3_5qo49c","null","1485624990","dd0uyzb","False","t1_dd0usle"
"Donald_J_Putin","2","False","0","He needs to be impeached for that any many of the things that have happened in the last week.  ","politics","0","maryland-flag","Maryland","t5_2cneq","1486511228","t3_5qoic2","null","1485625167","dd0v3g5","False","t1_dd0tb7h"
"Donald_J_Putin","2","False","0","What is all or nothing here?  That I am pointing out hypocrites on the right?","politics","0","maryland-flag","Maryland","t5_2cneq","1486511325","t3_5qo49c","null","1485625454","dd0vaqp","False","t1_dd0v5s5"
"Donald_J_Putin","31","False","0","Nothing worse than Catholics and many evangelicals.    http://www.people-press.org/2011/08/30/muslim-americans-no-signs-of-growth-in-alienation-or-support-for-extremism/","politics","0","maryland-flag","Maryland","t5_2cneq","1486511359","t3_5qof3z","null","1485625552","dd0vd8w","False","t1_dd0v56j"
"Donald_J_Putin","4","False","0","Maybe she is also afraid of UKIP.","politics","0","maryland-flag","Maryland","t5_2cneq","1486511431","t3_5qolsd","null","1485625758","dd0vio8","False","t1_dd0u6b0"
"Donald_J_Putin","0","False","0","I agree with your sentiments, but ""Can't wait for increased terrorism"" is pretty much ruining the argument.  I agree this will increase tensions and may certainly do just that, but I wouldn't wish it on anyone.","politics","0","maryland-flag","Maryland","t5_2cneq","1486511461","t3_5qolsd","null","1485625844","dd0vkvs","False","t1_dd0u3dw"
"Donald_J_Putin","10","False","0","I'm pretty sure Christians burn down churches and mosques, go on killing rampages, and kill more americans by a factor of 10,000x the amount of those killed by muslims.","politics","0","maryland-flag","Maryland","t5_2cneq","1486511482","t3_5qolsd","null","1485625907","dd0vmhj","False","t1_dd0uo4n"
"Donald_J_Putin","17","False","0","> Muslim infestation  What the fuck is wrong with you people.  ","politics","0","maryland-flag","Maryland","t5_2cneq","1486511498","t3_5qolsd","null","1485625952","dd0vnnv","False","t1_dd0u6dd"
"Donald_J_Putin","1","False","0",">Can't wait for increased terrorism.  I know you didn't mean this literally, but your words could have been less encouraging.","politics","0","maryland-flag","Maryland","t5_2cneq","1486511517","t3_5qolsd","null","1485626007","dd0vp3e","False","t1_dd0vnyj"
"Donald_J_Putin","33","False","0","Of course he doesn't.    http://imgur.com/a/Pbnxf ","politics","0","maryland-flag","Maryland","t5_2cneq","1486511737","t3_5qop31","null","1485626621","dd0w5iv","False","t1_dd0uq41"
"Donald_J_Putin","1","False","0","I haven't seen this much outrage since then.  This is close to Iraq war levels of protest and resistance.  I can certainly see it happening.  Do you really think 2006 was that much different?","politics","0","maryland-flag","Maryland","t5_2cneq","1486515194","t3_5qhvm5","null","1485636495","dd13bt9","False","t1_dd11xe8"
"Donald_J_Putin","1","False","0","Yeah, I don't think that is the message I want to send.  ","politics","0","maryland-flag","Maryland","t5_2cneq","1486515204","t3_5qof3z","null","1485636524","dd13cjv","False","t1_dd0zy76"
"Donald_J_Putin","1","False","0","Well, the polling suggests its not.","politics","0","maryland-flag","Maryland","t5_2cneq","1486515227","t3_5qof3z","null","1485636591","dd13ear","False","t1_dd0y2o1"
"Donald_J_Putin","2","False","0","I was going off approval ratings, not percentage who voted for him.  ","politics","0","maryland-flag","Maryland","t5_2cneq","1486515249","t3_5qof3z","null","1485636656","dd13g0b","False","t1_dd0xjbx"
"Donald_J_Putin","3","False","0","> would any woman or gay live with the same liberties as they do here   I'm talking about Muslims in the US, man.  Not extremists in under oppressive regimes.  ","politics","0","maryland-flag","Maryland","t5_2cneq","1486515287","t3_5qof3z","null","1485636767","dd13iur","False","t1_dd13grt"
"Donald_J_Putin","6","False","0","It wont always be a problem.  2006 saw people turn out against W. ","politics","0","maryland-flag","Maryland","t5_2cneq","1486515306","t3_5qpnjz","null","1485636821","dd13kal","False","t1_dd13cpr"
"Donald_J_Putin","5","False","0","I just moved, and need a DL in my state.","politics","0","maryland-flag","Maryland","t5_2cneq","1486515314","t3_5qpnjz","null","1485636842","dd13kun","False","t1_dd13ega"
"Donald_J_Putin","13","False","0","Redditor for 8 days and  >1 post karma  >-57 comment karma  I think someone needs to grow balls and not /u/bythepint ","politics","0","maryland-flag","Maryland","t5_2cneq","1486515352","t3_5qpnjz","null","1485636947","dd13nov","False","t1_dd13eui"
"Donald_J_Putin","1","False","0","OK, then don't write crap about US mosques being anti woman or anti gay.  There are just as many churches that are. ","politics","0","maryland-flag","Maryland","t5_2cneq","1486515379","t3_5qof3z","null","1485637021","dd13pmy","False","t1_dd13nhl"
"Donald_J_Putin","2","False","0","YEah, the US sucks with that.  I was more speaking to the ability of the people to replace the congress with Democrats.  It is certinatly possible with a 2006 turnout.","politics","0","maryland-flag","Maryland","t5_2cneq","1486515699","t3_5qpnjz","null","1485637945","dd14dkc","False","t1_dd13uof"
"Donald_J_Putin","2","False","0","> Few if any mosques will allow open gays  I'd rather you provide evidence because the link I provided shows quite the opposite.  ","politics","0","maryland-flag","Maryland","t5_2cneq","1486515776","t3_5qof3z","null","1485638173","dd14jap","False","t1_dd14ge4"
"Donald_J_Putin","3","False","0","Pressure works.  If these (in)humans see that they are going to get hurt in the polls badly from this, they may take actions to stop this.","politics","0","maryland-flag","Maryland","t5_2cneq","1486515801","t3_5qpnre","null","1485638243","dd14l4v","False","t1_dd12y6y"
"Donald_J_Putin","1","False","0","I love that song.  ","politics","0","maryland-flag","Maryland","t5_2cneq","1486515858","t3_5qpo2t","null","1485638411","dd14pfc","False","t1_dd12bw7"
"Donald_J_Putin","2","False","0","I wonder what that makes people like Steve King and the openly racist fucks in congress?","politics","0","maryland-flag","Maryland","t5_2cneq","1486515869","t3_5qpo2t","null","1485638445","dd14qan","False","t1_dd12hij"
"Donald_J_Putin","2","False","0","I didn't see your link supporting your statistic either.  ","politics","0","maryland-flag","Maryland","t5_2cneq","1486516048","t3_5qof3z","null","1485638970","dd153ps","False","t1_dd14yic"
"Donald_J_Putin","4","False","0","Do you think they talked about golden showers?","politics","0","maryland-flag","Maryland","t5_2cneq","1486516268","t3_5qprrk","null","1485639621","dd15k6g","False","t3_5qprrk"
"Donald_J_Putin","1118","False","0","This has happened every 50 years or so.  It's like we need to make things as shitty as possible before people realize voting matters, and who is in charge matters.","politics","0","maryland-flag","Maryland","t5_2cneq","1486516625","t3_5qpyax","null","1485640645","dd16az8","False","t1_dd15pf6"
"Donald_J_Putin","340","False","0","> Stop fighting about ""microaggressions""  This really isn't the big issue the right wingers make it out to be.  Common decency and ending racism are important, but not the main rallying cry of the left.  I feel like this meme of progressives only caring about these things is a product of the Limbaughs and Hannities and not based on what progressives really fight for.  ","politics","0","maryland-flag","Maryland","t5_2cneq","1486516657","t3_5qpyax","null","1485640736","dd16dbq","False","t1_dd15shl"
"Donald_J_Putin","394","False","0","A dangerous joke.","politics","0","maryland-flag","Maryland","t5_2cneq","1486516665","t3_5qpyax","null","1485640761","dd16dys","False","t1_dd15jn8"
"Donald_J_Putin","10","False","0","Oh, is there an alt left?  A racist, shit stain of white nationals?  I don't think so.  ","politics","1","maryland-flag","Maryland","t5_2cneq","1486516683","t3_5qpyax","null","1485640818","dd16fdc","False","t1_dd15uma"
"Donald_J_Putin","7","False","0","I'll just let your name indicate what we already know about you . ","politics","0","maryland-flag","Maryland","t5_2cneq","1486516718","t3_5qpyax","null","1485640921","dd16i0k","False","t1_dd168zf"
"Donald_J_Putin","9","False","0","Racists have taken over the right so now they are trying to project it on the left.  ","politics","0","maryland-flag","Maryland","t5_2cneq","1486516728","t3_5qpyax","null","1485640951","dd16ir7","False","t1_dd15mbh"
"Donald_J_Putin","122","False","0","That 40% of this country is a terrible judge of competence and character in the voting booth?","politics","0","maryland-flag","Maryland","t5_2cneq","1486516918","t3_5qpyax","null","1485641511","dd16x0w","False","t1_dd16rp7"
"Donald_J_Putin","29","False","0","The left as always been balkanized.  That's why progress has been so difficult since the progressive era.  Even FDR only was able to act because the entire economic system had shut down.  The left is much more balkanized because there is no single governing idealogy, like with conservatives.  From animal welfare, to minimum wages, to environmental protections, to issues surrounding trade.  There is no single commonality - we can't simply turn to religious beliefs or some strict constructional view.","politics","0","maryland-flag","Maryland","t5_2cneq","1486517148","t3_5qpyax","null","1485642181","dd17e9v","False","t1_dd16zk6"
"Donald_J_Putin","1","False","0","> I haven't seen outrage in the streets or from family and friends.  I have.  I was at a demonstration with 500,000 people.  There were 3 million people on the streets last week.","politics","0","maryland-flag","Maryland","t5_2cneq","1486517594","t3_5qhvm5","null","1485643472","dd18bm7","False","t1_dd17u8u"
"Donald_J_Putin","2","False","0","Why disgusting?  It was posted.  It also was a fraction of the size of the anti-Trump protests, hence a fraction of the attention.","politics","0","maryland-flag","Maryland","t5_2cneq","1486517612","t3_5qof3z","null","1485643530","dd18d2s","False","t1_dd17owc"
"Donald_J_Putin","-1","False","0","Huh?  Only one is in charge now.  Don't put this on the democrats because you didn't like Clinton.","politics","0","maryland-flag","Maryland","t5_2cneq","1486518692","t3_5qpyax","null","1485646663","dd1alnh","False","t1_dd19qo9"
"Donald_J_Putin","2","False","0","I couldn't help it.  Pee pee tapes would have been leaked, and it doesn't take a wiz to know that isn't the golden outcome to flow out of this.","politics","0","maryland-flag","Maryland","t5_2cneq","1486518707","t3_5qo49c","null","1485646711","dd1amv3","False","t1_dd19m9o"
"Donald_J_Putin","5","False","0","What has Clinton done since the election that was so terrible?","politics","0","maryland-flag","Maryland","t5_2cneq","1486518715","t3_5qpyax","null","1485646734","dd1angp","False","t1_dd19dbh"
"Donald_J_Putin","1","False","0","Certainly they are to blame for this mosque burning.","politics","0","maryland-flag","Maryland","t5_2cneq","1486518724","t3_5qof3z","null","1485646759","dd1ao1x","False","t1_dd18xio"
"Donald_J_Putin","1","False","0","Aren't all good americans ""hard working""?  Or are you reading from some sort of script?","politics","0","maryland-flag","Maryland","t5_2cneq","1486518739","t3_5qof3z","null","1485646808","dd1ap81","False","t1_dd18rb0"
"Donald_J_Putin","2","False","0","Why are you attributing ""alternative facts"" to the left here?  The pro life march happens every four years (well, more than that), and this was one of the lower turnouts.  ","politics","0","maryland-flag","Maryland","t5_2cneq","1486518764","t3_5qof3z","null","1485646881","dd1ar1y","False","t1_dd18r25"
"Donald_J_Putin","1","False","0","They do suck as well.  Specifically those who didn't take this threat serious enough and complained ""both sides are terrible"".  This includes the third party voters.","politics","0","maryland-flag","Maryland","t5_2cneq","1486518778","t3_5qof3z","null","1485646924","dd1as4d","False","t1_dd18o3l"
"Donald_J_Putin","5","False","0","I work on one.  ","politics","0","maryland-flag","Maryland","t5_2cneq","1486518783","t3_5qpyax","null","1485646940","dd1asit","False","t1_dd18lsm"
"Donald_J_Putin","1","False","0","> how many evangelicals have gunned down/blown up/beheaded/drowned/burned alive non-christians in the name of jesus in the last 10 years?  In the US? Much more than the number of muslims.  Shal I list them for you?  Nice new account, BTW.  Already suspect.  >1 post karma  >-59 comment karma  Not even worth engaging.  Why can't you just stick to an account?","politics","0","maryland-flag","Maryland","t5_2cneq","1486518794","t3_5qof3z","null","1485646976","dd1aten","False","t1_dd18kio"
"Donald_J_Putin","12","False","0","That is very depressing.","politics","0","maryland-flag","Maryland","t5_2cneq","1486518830","t3_5qpyax","null","1485647072","dd1avvo","False","t1_dd18f2q"
"Donald_J_Putin","2","False","0","I was speaking domestically.  ","politics","0","maryland-flag","Maryland","t5_2cneq","1486518836","t3_5qpyax","null","1485647090","dd1awbm","False","t1_dd18f0y"
