"author","score","stickied","gilded","body","subreddit","controversiality","author_flair_css_class","author_flair_text","subreddit_id","retrieved_on","link_id","distinguished","created_utc","id","edited","parent_id"
"Donald_J_Putin","3","False","0","If the Sanders message would have done so much better in the rust belt, why not find candidates to run for republican held districts in those States?  Without a majority, it won't matter if we replace every moderate or blue dog with a ""true"" progressive.    Besides, if it's successful in 2018, that would likely move the primary in 2020 towards more candidates favored by the Sanders wing.","politics","0","maryland-flag","Maryland","t5_2cneq","1486303189","t3_5pshq5","null","1485217403","dctjbbm","False","t1_dcthlku"
"Donald_J_Putin","1","False","0","And Manson didn't use ""Helter Skelter"" in the same way the Beatles did.  ","politics","0","maryland-flag","Maryland","t5_2cneq","1486303321","t3_5pshq5","null","1485217746","dctjl7g","False","t1_dctisy1"
"Donald_J_Putin","4","False","0","I forgot to add it should also be a big tent - we focus on GOP politicians, not Democrats.","politics","0","maryland-flag","Maryland","t5_2cneq","1486303364","t3_5pshq5","null","1485217855","dctjobg","False","t1_dctjajr"
"Donald_J_Putin","2","False","0","Cool.  But I have some skeletons in my closet, so I probably shouldn't run.  I also live in Raskin's district and think he is pretty great.","politics","0","maryland-flag","Maryland","t5_2cneq","1486303436","t3_5pshq5","null","1485218047","dctjtsj","False","t1_dctjkj9"
"Donald_J_Putin","3","False","0","> only comes up when a corporate Democrat is being shoved down our throats.  That's a purity test.  So you didn't agree with Clinton on some issues.  She overlaps with Bernie on the other 80% of importance, and reached out to have him get 90% of what he wanted into the platform.  Let me be clear, it's fine that we debate.  But the PUMA folks can get fucked.   ","politics","1","maryland-flag","Maryland","t5_2cneq","1486303868","t3_5prhny","null","1485219187","dctkq78","False","t1_dctjk74"
"Donald_J_Putin","7","False","0","Things changed in 2006.  Sure, it took time.  But W was at 90% approval after 9-11 and Iraq was just starting to go south that year.  Voters got scared of changing POTUS during the dark days of a war.  But antiwar sentiment grew with help from those protests, 2006 was a huge Democratic sweep (54% of House votes).  Libby was convicted, investigations began, and then the financial collapse occurred in 2008.  Protests can shape the broader public, and also can scare politicians in swing districts - enthusiasm did translate into votes in 2006.    I'm not in anyway confident the Democrats can win the House next election, but things like that can help.  Especially if they continue.","politics","0","maryland-flag","Maryland","t5_2cneq","1486304023","t3_5prez3","null","1485219603","dctl1sj","False","t1_dctkmh0"
"Donald_J_Putin","4","False","0","I think everyone in the party is for getting rid of Citizen's and ending the unlimited spending by outside groups.  In the meantime, however, you can't win a general election against an opponent with one hand tied behind your back unless they do also.  The more extreme criticize even getting campaign donations from people who work for specific firms like Goldman.  Suggesting those reported on donations, limited by campaign finance laws taint a politician is ridiculous.  ","politics","0","maryland-flag","Maryland","t5_2cneq","1486304118","t3_5pshq5","null","1485219850","dctl8vz","False","t1_dctkg8f"
"Donald_J_Putin","1","False","0","So have you ever found someone you voted for?  I can't think of many ""exceptionally perfect (sic)"" politicians.","politics","0","maryland-flag","Maryland","t5_2cneq","1486304147","t3_5ppoq0","null","1485219924","dctlb19","False","t1_dctkcgp"
"Donald_J_Putin","1","False","0","Myspace.  ","politics","0","maryland-flag","Maryland","t5_2cneq","1486304615","t3_5prez3","null","1485221131","dctma94","False","t1_dctm5om"
"Donald_J_Putin","1","False","0","I can understand why it wouldn't be a positive factor, but why such a negative one?","politics","0","maryland-flag","Maryland","t5_2cneq","1486304673","t3_5ppoq0","null","1485221286","dctmeky","False","t1_dctlstp"
"Donald_J_Putin","1","False","0","What does the trade deficit matter there? ","politics","0","maryland-flag","Maryland","t5_2cneq","1486304819","t3_5przfj","null","1485221665","dctmplm","False","t1_dctmfei"
"Donald_J_Putin","9","False","0","Forcibly evicted.","politics","0","maryland-flag","Maryland","t5_2cneq","1486304848","t3_5psz6y","null","1485221734","dctmrkn","False","t1_dctm88v"
"Donald_J_Putin","24","False","0","They ignore it in order to make it seem normal.  Notice most of them just said ""I wasn't interested in it"", rather than saying ""it's false"".  That's how they treated birtherism.  The last GOP to stand up against these bullshit alt-fact stories was John McCain in 2008.  ","politics","0","maryland-flag","Maryland","t5_2cneq","1486304889","t3_5psz6y","null","1485221842","dctmupc","False","t1_dctkl63"
"Donald_J_Putin","1","False","0","> It's a circlejerk.  Shh, don't tell anyone.","politics","0","maryland-flag","Maryland","t5_2cneq","1486304944","t3_5prhny","null","1485221980","dctmyvg","False","t1_dctmuxs"
"Donald_J_Putin","2","False","0","That's why I say they should focus on getting those independents in Republican held districts.    When it comes to picking the national candidate for President, have the primaries decide.    Besides, independents are largely center right.","politics","0","maryland-flag","Maryland","t5_2cneq","1486304988","t3_5prhny","null","1485222092","dctn243","False","t1_dctmofm"
"Donald_J_Putin","11","False","0","> the emoluments clause does on apply to the President.  This sounds like a stretch.  I agree with your first point.    Of course, perhaps a company that loses a contract to Trump with a foreign government, or can demonstrate a loss of business to his hotel, can demonstrate damages for standing.","politics","0","maryland-flag","Maryland","t5_2cneq","1486305082","t3_5pt0b3","null","1485222336","dctn95d","False","t1_dctmtaa"
"Donald_J_Putin","13","False","0","Fascism on the rise.  ","politics","0","maryland-flag","Maryland","t5_2cneq","1486305127","t3_5pt88n","null","1485222453","dctncls","False","t1_dctmk9i"
"Donald_J_Putin","3","False","0","Here's a direct link to the interview.  Starts at 1:37  https://www.youtube.com/watch?v=P6i0YlHriKk&feature=youtu.be&t=1m37s","politics","0","maryland-flag","Maryland","t5_2cneq","1486306365","t3_5ptl20","null","1485225559","dctpx3i","False","t3_5ptl20"
"Donald_J_Putin","5","False","0","Those chinese made ones were being sold by authorized vendors on the day of the parade.  A decision was specifically made to sell the cheaper chinese hats that day - probably to get the crowd to wear more.","politics","0","maryland-flag","Maryland","t5_2cneq","1486306900","t3_5prez3","null","1485226889","dctr1b0","False","t1_dctq5ns"
"Donald_J_Putin","45","False","0","That's why they are not going to allow themselves be tied to any statistic - which is certainly not going to support their narrative of lies.","politics","0","maryland-flag","Maryland","t5_2cneq","1486307051","t3_5pthpn","null","1485227285","dctrcmq","False","t1_dctr4cw"
"Donald_J_Putin","2","False","0","Sorta like it is now, but even more so.    ","politics","0","maryland-flag","Maryland","t5_2cneq","1486307205","t3_5ptjth","null","1485227678","dctro7p","False","t1_dctpviz"
"Donald_J_Putin","2","False","0","Yeah, fuck anyone not fortunate enough to live in a blue state... /s","politics","0","maryland-flag","Maryland","t5_2cneq","1486307233","t3_5ptjth","null","1485227748","dctrqcl","False","t1_dctre3v"
"Donald_J_Putin","1","False","0","So let's fuck everyone in red states?","politics","0","maryland-flag","Maryland","t5_2cneq","1486307246","t3_5ptjth","null","1485227783","dctrrbi","False","t1_dctpixn"
"Donald_J_Putin","1","False","0","Those states will need to up the subsidies, but otherwise it doesn't require across state markets - people can't buy insurance across state lines anyway.  ","politics","0","maryland-flag","Maryland","t5_2cneq","1486307273","t3_5ptjth","null","1485227855","dctrtej","False","t1_dctrifk"
"Donald_J_Putin","3","False","0","The blue states would do fine, just like MA did.  That's not the issue.  Its that people in Red states will be fucked.","politics","0","maryland-flag","Maryland","t5_2cneq","1486307307","t3_5ptjth","null","1485227945","dctrvxx","False","t1_dctq3u2"
"Donald_J_Putin","6","False","0","How could you possibly think Trump is better than Clinton, but prefer Sanders to both?","politics","0","maryland-flag","Maryland","t5_2cneq","1486307348","t3_5prhny","null","1485228049","dctryz1","False","t1_dctrrw6"
"Donald_J_Putin","8","False","0","You realize there are people in those states that don't vote for Republicans.  Almost half of texas!","politics","0","maryland-flag","Maryland","t5_2cneq","1486307401","t3_5ptjth","null","1485228184","dcts2ve","False","t1_dcts08v"
"Donald_J_Putin","1","False","0","Depends on whether they are willing to raise budgets in those states, and if medicaid dollars were reduced.","politics","0","maryland-flag","Maryland","t5_2cneq","1486307585","t3_5ptjth","null","1485228667","dctsgo4","False","t1_dcts403"
"Donald_J_Putin","20","False","0","No, that's not what the order was.  That argument can be made of any aid money given to other countries.  This is specifically a reinstatement of the [global gag rule](https://www.engenderhealth.org/media/info/definition-global-gag-rule.php) as /u/no_mixed_liquor mentioned above.","politics","0","maryland-flag","Maryland","t5_2cneq","1486308856","t3_5ptz74","null","1485232248","dctv47b","False","t1_dctuyjo"
"Donald_J_Putin","4","False","0","People don't believe the reality of the economic improvement under obama, why will they believe people saying it's now worse with Trump?","politics","0","maryland-flag","Maryland","t5_2cneq","1486315612","t3_5pthpn","null","1485264804","dcu906u","False","t1_dctyvyg"
"Donald_J_Putin","16","False","0","There are thousands of them. I was just writing with gone on Reddit recently. ","politics","0","maryland-flag","Maryland","t5_2cneq","1486317638","t3_5pwh1d","null","1485271061","dcud72x","False","t1_dcubx29"
"Donald_J_Putin","7","False","0","Yeah. Bowles Simpson did so much good. ","politics","0","maryland-flag","Maryland","t5_2cneq","1486317774","t3_5pweu3","null","1485271416","dcudhbz","False","t1_dcucf2w"
"Donald_J_Putin","15","False","0","> How much longer will Trump put up with Mattis publicly disagreeing with him or acting in opposition to what Trump is saying?  Doesn't matter.  The President can't force a cabinet member to resign, technically.  He can ask for his resignation.  ","politics","0","maryland-flag","Maryland","t5_2cneq","1486318737","t3_5pwl5i","null","1485273871","dcufhnr","False","t1_dcudl56"
"Donald_J_Putin","12","False","0","It would take a real Battlestar Galactica level event for the chain of command to reach Mattis.","politics","0","maryland-flag","Maryland","t5_2cneq","1486318748","t3_5pwl5i","null","1485273901","dcufike","False","t1_dcudthw"
"Donald_J_Putin","2","False","0","Over a democrat?","politics","0","maryland-flag","Maryland","t5_2cneq","1486318758","t3_5pwl5i","null","1485273924","dcufja5","False","t1_dcue3x7"
"Donald_J_Putin","54","False","0","Good thing we didn't elect a corporatist globalist with ties to Goldman Sachs.  ","politics","0","maryland-flag","Maryland","t5_2cneq","1486318781","t3_5pwkh4","null","1485273983","dcufkzt","False","t1_dcucpnk"
"Donald_J_Putin","1","False","0","It makes them cheaper to ship, but unless oil prices go up again, these investments are a waste of money for taxpayers and wont payoff in the long run.  Especially if renewables get cheaper over the next decade, which they will.","politics","0","maryland-flag","Maryland","t5_2cneq","1486318807","t3_5pwkh4","null","1485274047","dcufmxk","False","t1_dcud35a"
"Donald_J_Putin","10","False","0","My understanding is the concern isn't simply they leak - so do all forms of transporting oil.  Its that it lowers the cost of transportation to promote long term use of these dirty fossil fuels.  It also takes a long time to recoup the high fixed cost of setting these up, which might not be worth it when clean energy becomes cheaper.","politics","0","maryland-flag","Maryland","t5_2cneq","1486318849","t3_5pwkh4","null","1485274151","dcufq3c","False","t1_dcudcgc"
"Donald_J_Putin","4","False","0","Old Faithful can be turned into energy!","politics","0","maryland-flag","Maryland","t5_2cneq","1486318857","t3_5pwllk","null","1485274173","dcufqps","False","t1_dcucvtp"
"Donald_J_Putin","133","False","0","Also note that Federal employees are disproportionately a more diverse workforce than the general public, especially women of color.  ","politics","0","maryland-flag","Maryland","t5_2cneq","1486318876","t3_5pwn6e","null","1485274222","dcufs6y","False","t1_dcue8g0"
"Donald_J_Putin","2","False","0","Back to ""deficits don't matter""  Democrats pay for their spending.  Republicans don't.","politics","0","maryland-flag","Maryland","t5_2cneq","1486318894","t3_5pwktj","null","1485274265","dcuftir","False","t1_dcucrhi"
"Donald_J_Putin","2","False","0","That's what he signalled when blowing him a kiss the other day.","politics","0","maryland-flag","Maryland","t5_2cneq","1486318916","t3_5pwruu","null","1485274322","dcufv72","False","t3_5pwruu"
"Donald_J_Putin","10","False","0","I'm fine with tolls to curb traffic.  I don't want those tolls going to private profits, though.  ","politics","0","maryland-flag","Maryland","t5_2cneq","1486319048","t3_5pwnpn","null","1485274646","dcug524","False","t1_dcufffv"
"Donald_J_Putin","35","False","0","IDK, many old guys with Trophy wives show at least some interest in them.  ","politics","0","maryland-flag","Maryland","t5_2cneq","1486319217","t3_5pwo41","null","1485275059","dcught1","False","t1_dcuduq7"
"Donald_J_Putin","-1","False","0","?? Some are redirected to public transportation, some are directed to less frequent trips.  Pricing a congestible resource is a good way to increase its value.","politics","0","maryland-flag","Maryland","t5_2cneq","1486319242","t3_5pwnpn","null","1485275117","dcugjou","False","t1_dcugaww"
"Donald_J_Putin","26","False","0","I love my dogs more than he shows love for his 3rd wife.  And  I'm on my 5th dog.","politics","0","maryland-flag","Maryland","t5_2cneq","1486319254","t3_5pwo41","null","1485275145","dcugkkk","False","t1_dcue4q7"
"Donald_J_Putin","2","False","0","I would have been able to stomach 15 years with Trump for $100m allimony.  But once he got the presidency, I don't know... she's either having him up money she gets or a bad negotiator.","politics","0","maryland-flag","Maryland","t5_2cneq","1486319279","t3_5pwo41","null","1485275206","dcugmhq","False","t1_dcudh6v"
"Donald_J_Putin","4","False","0","She went along willingly with his birtherism nonsense.  She deserves no special treatment.","politics","0","maryland-flag","Maryland","t5_2cneq","1486319290","t3_5pwo41","null","1485275233","dcugnbu","False","t1_dcudwao"
"Donald_J_Putin","14","False","0","Every Trump relationship is transactional.  That's why he can so easily go from insulting someone to being ""friends"" (e.g., Obama, many republicans, etc).    I don't pity her.  She is a birther like he is. ","politics","0","maryland-flag","Maryland","t5_2cneq","1486319316","t3_5pwo41","null","1485275291","dcugp6c","False","t1_dcuex4q"
"Donald_J_Putin","-2","False","0","> but not many  Source?  >It isn't like those people are just going to stop going to work.  No, but some (""on the margin"") find alternative transportation, seek out ride share, or alter their work hours.  Demand for the roads is not perfectly inelastic.  Tolls are the only way to assure the value of those roads dont fall to zero from traffic.","politics","1","maryland-flag","Maryland","t5_2cneq","1486319352","t3_5pwnpn","null","1485275375","dcugrsl","False","t1_dcugnek"
"Donald_J_Putin","-3","False","0","As an economist who has worked with transportation and planning folks, tolls are certainly highly prized method of controlling traffic.","politics","0","maryland-flag","Maryland","t5_2cneq","1486319374","t3_5pwnpn","null","1485275421","dcugt9d","False","t1_dcughbx"
"Donald_J_Putin","10","False","0","It's the insecurity all narcissists suffer from.","politics","0","maryland-flag","Maryland","t5_2cneq","1486319388","t3_5pwo41","null","1485275454","dcuguas","False","t1_dcugq62"
"Donald_J_Putin","201","False","0","Well, at least the blue states get to run their own elections.  But red states will be fucked with voter ID and restricted voting.","politics","0","maryland-flag","Maryland","t5_2cneq","1486319419","t3_5pwvxq","null","1485275532","dcugwn3","False","t1_dcug0ry"
"Donald_J_Putin","9","False","0","Senators are just posturing.  Individually, they have very little power other than to be a thorn in the President's side.  And they are showing that.  But when push comes to shove, they are powerless without numbers of others joining them.    It was clear that was Rubio's plan.  Show trump he could make his life difficult, but then back down once the message was sent. ","politics","0","maryland-flag","Maryland","t5_2cneq","1486319453","t3_5pwvxq","null","1485275611","dcugz3g","False","t1_dcug0xt"
"Donald_J_Putin","2","False","0","I agree.  It shouldn't be done privately.  That is basically giving out public kickbacks and private contracts to private profits.","politics","0","maryland-flag","Maryland","t5_2cneq","1486319479","t3_5pwnpn","null","1485275674","dcuh10c","False","t1_dcugz0p"
"Donald_J_Putin","4","False","0","No because 1/3 of Trump's followers are bots from Estonia.  ","politics","0","maryland-flag","Maryland","t5_2cneq","1486319496","t3_5pwxse","null","1485275714","dcuh27u","False","t3_5pwxse"
"Donald_J_Putin","104","False","0","He's not.  He won by colluding with foreign powers.  ","politics","0","maryland-flag","Maryland","t5_2cneq","1486319522","t3_5px0x3","null","1485275779","dcuh493","False","t3_5px0x3"
"Donald_J_Putin","2","False","0","No, that's the attack on Clinton.  ","politics","0","maryland-flag","Maryland","t5_2cneq","1486319972","t3_5pwkh4","null","1485276831","dcui1h6","False","t1_dcui0l1"
"Donald_J_Putin","1","False","0","Probably not.  There is no reason they would have to be unless they went to court over it.","politics","0","maryland-flag","Maryland","t5_2cneq","1486319987","t3_5pwo41","null","1485276865","dcui2kn","False","t1_dcui082"
"Donald_J_Putin","1","False","0","> remember NBC reported that Trump was never briefed on the dossier  I thought they reported that it wasn't confirmed if he was personally briefed or if they simply provided him the dossier.  ","politics","0","maryland-flag","Maryland","t5_2cneq","1486320016","t3_5pwvwu","null","1485276933","dcui4r0","False","t1_dcug3n1"
"Donald_J_Putin","2","False","0","Deflected.","politics","0","maryland-flag","Maryland","t5_2cneq","1486320049","t3_5pwvwu","null","1485277012","dcui788","False","t1_dcugq6i"
"Donald_J_Putin","17","False","0",">  people WANTED us to block it.  Most people wanted a vote to happen.  ","politics","0","maryland-flag","Maryland","t5_2cneq","1486320070","t3_5px2x7","null","1485277061","dcui8t7","False","t1_dcuhy7f"
"Donald_J_Putin","1","False","0","Judge Judge Reinhold has a nice ring to it.  ","politics","0","maryland-flag","Maryland","t5_2cneq","1486320077","t3_5px2x7","null","1485277078","dcui9c5","False","t1_dcuh70k"
"Donald_J_Putin","0","False","0","Of course its not a job creator.  If anything, it will reduce jobs in shipping.","politics","0","maryland-flag","Maryland","t5_2cneq","1486320140","t3_5px3n0","null","1485277226","dcuie26","False","t1_dcuhbmo"
"Donald_J_Putin","1","False","0","Flynn used an illegal server and connection in the pentagon.  So sure.","politics","0","maryland-flag","Maryland","t5_2cneq","1486320159","t3_5px3n0","null","1485277272","dcuifir","False","t1_dcui0th"
"Donald_J_Putin","4","False","0","Those states are red states.  What makes my comment false?","politics","0","maryland-flag","Maryland","t5_2cneq","1486320321","t3_5pwvxq","null","1485277659","dcuiros","False","t1_dcuionm"
"Donald_J_Putin","18","False","0","People aren't single issue voters - especially based on a SCOTUS nominee.  The polling was overwhelming in favor of having a vote.","politics","0","maryland-flag","Maryland","t5_2cneq","1486320342","t3_5px2x7","null","1485277708","dcuita1","False","t1_dcuih6s"
"Donald_J_Putin","5","False","0","51 can block Trump's agenda, but it can't over-ride his executive actions.","politics","0","maryland-flag","Maryland","t5_2cneq","1486320355","t3_5pwvxq","null","1485277738","dcuiu9f","False","t1_dcuih5g"
"Donald_J_Putin","7","False","0","I'm referring to the states that went for Trump.  MN did not.  ","politics","0","maryland-flag","Maryland","t5_2cneq","1486320520","t3_5pwvxq","null","1485278128","dcuj6nw","False","t1_dcuj4kc"
"Donald_J_Putin","2","False","0","How can 46 undo his EO?","politics","0","maryland-flag","Maryland","t5_2cneq","1486320545","t3_5pwvxq","null","1485278186","dcuj8gl","False","t1_dcuj2dh"
"Donald_J_Putin","3","False","0","Gotcha.  But the damage will already be done with things like the pipelines and deportations.","politics","0","maryland-flag","Maryland","t5_2cneq","1486320601","t3_5pwvxq","null","1485278319","dcujcqm","False","t1_dcujadk"
"Donald_J_Putin","3","False","0","This is a pointless argument.  ","politics","1","maryland-flag","Maryland","t5_2cneq","1486320632","t3_5pwvxq","null","1485278390","dcujf1c","False","t1_dcuj93z"
"Donald_J_Putin","0","False","0","Which issues was he socialist?  ","politics","0","maryland-flag","Maryland","t5_2cneq","1486320667","t3_5pxbaz","null","1485278472","dcujhm6","False","t1_dcujdye"
"Donald_J_Putin","3","False","0","There is no way that this poll was conducted from the last 12 hours to incorporate that.","politics","0","maryland-flag","Maryland","t5_2cneq","1486320703","t3_5pxa7y","null","1485278557","dcujkda","False","t1_dcuiwrw"
"Donald_J_Putin","5","False","0","Those states were going to the republican anyway.","politics","0","maryland-flag","Maryland","t5_2cneq","1486320733","t3_5px0x3","null","1485278623","dcujmh7","False","t1_dcuje6v"
"Donald_J_Putin","8","False","0","He loves a gold plated environment.  ","politics","0","maryland-flag","Maryland","t5_2cneq","1486320756","t3_5px8cl","null","1485278674","dcujo6h","False","t1_dcuigiq"
"Donald_J_Putin","1","False","0","> Should we be able to use our own oil or buy it from third world countries with much worse regulation?   Shouldn't we use up the oil reserves of other countries before drying up our own sources?","politics","0","maryland-flag","Maryland","t5_2cneq","1486320770","t3_5px8cl","null","1485278708","dcujpb0","False","t1_dcuijrp"
"Donald_J_Putin","1","False","0","EPA is not socialism.  Its environmental regulation.  It was forced on him by Congress, anyway.  >. He believed in a strong social safety net and improved on several existing ones during his time.   I did not know.  What laws did he sign to do so?  He was also the one who started the drastic increase in incarceration, the drug war, and instituted price controls which did nothing to curb high inflation.  I still don't see anything ""socialist"" about Nixon.  ","politics","0","maryland-flag","Maryland","t5_2cneq","1486320832","t3_5pxbaz","null","1485278851","dcujtxl","False","t1_dcujppa"
"Donald_J_Putin","2","False","0","> 500 likely voters per night and reported on a three-day rolling average basis.  ","politics","0","maryland-flag","Maryland","t5_2cneq","1486320850","t3_5pxa7y","null","1485278894","dcujvc1","False","t1_dcujomu"
"Donald_J_Putin","0","False","0","Those aren't socialist.    He had no ability to subvert SS and MEdicare/aid because the democrats controlled the house.  ","politics","0","maryland-flag","Maryland","t5_2cneq","1486320867","t3_5pxbaz","null","1485278934","dcujwna","False","t1_dcujnk6"
"Donald_J_Putin","1","False","0","> socially progressive stances  ?? Which??  Again, none of these are socialist.  ","politics","0","maryland-flag","Maryland","t5_2cneq","1486320886","t3_5pxbaz","null","1485278964","dcujxml","False","t1_dcujtnv"
"Donald_J_Putin","1","False","0","It's enough to get a reasonable MOE if its a well conducted sampling process and properly adjusted to be representative of the population.    The MOE for a N=500 sample (binomial distribution - approve/disapprove) would be around +/- 2.5% at the 95% confidence level.  So the sample size isn't the problem here.","politics","0","maryland-flag","Maryland","t5_2cneq","1486321194","t3_5pxa7y","null","1485279670","dcukklh","False","t1_dcuk36g"
"Donald_J_Putin","3","False","0","I thought it was during Johnson that it came up.","politics","0","maryland-flag","Maryland","t5_2cneq","1486321253","t3_5pwl5i","null","1485279804","dcukozr","False","t1_dcukkbw"
"Donald_J_Putin","1","False","0","There is a difference between what happened - they reported they didn't know if Trump was personally briefed.  Then it came out that Comey had personally briefed him.  There was no error in the NBC reporting.  ","politics","0","maryland-flag","Maryland","t5_2cneq","1486321280","t3_5pwvwu","null","1485279871","dcukr33","False","t1_dcukmnt"
"Donald_J_Putin","6","False","0","Remember, that base is a minority of the GOP primary voters.  That base is die hard, no doubt.  But his election also brought in many marginally attached voters who will certainly not be as blindly supportive.","politics","0","maryland-flag","Maryland","t5_2cneq","1486321310","t3_5px6ep","null","1485279939","dcuktc7","False","t1_dcujj30"
