"distinguished","created_utc","edited","id","parent_id","body","stickied","gilded","subreddit","author","score","link_id","controversiality","author_flair_css_class","author_flair_text","retrieved_on","subreddit_id"
"null","1485707139","False","dd26eql","t1_dd2651j",">> Correct. There are only the rights that you believe you have.   No, you can believe you have them, that doesn't mean you do. Society decides what right we have and don't have. Society doesn't believe you have the right to leave the union, and the law also says you can't.  >> The scholars who point out the ""extralegal"" nature of the question are correct. If Californians vote to secede, and if the US does not recognize their independence, then there is suddenly a problem of legitimacy. That's why the firing on Fort Sumter was so important.  Ther isn't a question of legitimacy. Nobody is going to blame the US for enforcing the law. That's just absurd.  Like I said, leaving the union is in fact, no legal. You have no right to leave the union. California is bound by the same piece of paper every other state is.  >> I understand that you don't like the idea that people have rights  And this is a lie. I love rights, but you don't get to make up your own rights at will and think they're actual rights.  If I believe I have the right to murder someone, that doesn't mean I have the right to murder someone.    >> We're only discussing this because Trump voters no longer demonstrate a willingness to compromise for the sake of unity. They ought to re-read Washington's farewell address.  No, you're discussing it because Russia is god tier at manipulating people.  https://en.wikipedia.org/wiki/Foundations_of_Geopolitics  >> Russia should use its special forces within the borders of the United States to fuel instability and separatism, for instance, provoke ""Afro-American racists"". Russia should ""introduce geopolitical disorder into internal American activity, encouraging all kinds of separatism and ethnic, social and racial conflicts, actively supporting all dissident movements – extremist, racist, and sectarian groups, thus destabilizing internal political processes in the U.S. It would also make sense simultaneously to support isolationist tendencies in American politics.""   http://ww2.kqed.org/news/2016/12/13/from-his-home-in-russia-calexit-leader-plots-california-secession/  >> Louis Marinelli heads the secessionist group Yes California. Following the election of Donald Trump to the presidency, the organization has gone from an unknown fringe group to one discussed seriously in mainstream media.  >> What has not been discussed as prominently is Marinelli’s deep ties to Russia.  >> A former right-wing activist from Buffalo, New York, Marinelli first moved to Russia almost a decade ago. He studied at St. Petersburg State University, the alma mater of Russian President Vladimir Putin. He returned to the United States to campaign against LGBTQ rights as part of the National Organization for Marriage.   >> Marinelli then returned to Russia. He would marry a Russian citizen, and the couple moved to San Diego, where Marinelli launched a political career based on a platform of California secession.    ","False","0","politics","pizzashill","1","t3_5qqsjt","0","null","null","1486533978","t5_2cneq"
"null","1485707988","False","dd2707s","t1_dd26g1s","Obviously.","False","0","politics","pizzashill","1","t3_5qtbdv","0","null","null","1486534264","t5_2cneq"
"null","1485708335","False","dd279l2","t1_dd26fn1","Alright, you seem to have problems following what I'm saying to you here, so let's logically lay this out for you.  The Obama ban prevented any new visas from being issued, if you were already here and had your visa, you were free to leave the country and come back in any time you wanted.  And under his ban, people were still allowed to apply, and like I said, the screening took longer than 6 months so the argument is pointless.   The Trump ban? It banned **everyone.**  So for example, let's say I were born in Iraq and came to America at the age of 15, went to school here, had my greencard/visa/whatever else and I left the country?  I wouldn't be allowed back in. Your argument here is just a giant false equivalency. Preventing new ""refugees"" for 6 months is not the same as a blanket ban on everyone, including gren card/visa holders that have lived here for years.   >> Oh. That's better because...?  See above.  >> LOL the mental gymnastics here are pretty amazing.  Also known as facts.   >> For 90 days, yes. People were only ""turned away at airports"" because they thought they could circumvent the law. They can't.  Lmao what? They were turning green card holding legal residents away. Your argument makes no sense, what law did they try to circumvent?   >> Wait, so you're admitting that muslim countries are worse than ours when it comes to discrimination? That those laws are purely anti semitic? THESE are the people you want to import into our country by the tens of thousands?   Lol? few things.  A) Islam is a cancer religion, but so is Christianity.  B) far right Christians are a larger threat to this country and our way of life than anyone else.   It isn't the Muslims trying to gut education, that'd be the republicans.  It isn't the Muslims denying climate change, that's the republicans.  It isn't Muslims trying to force creationism into our education system that'd be the republicans.  It isn't Muslims that control the government, it's the republicans.  ","False","0","politics","pizzashill","3","t3_5qtbdv","0","null","null","1486534388","t5_2cneq"
"null","1485708416","False","dd27bte","t1_dd2721i",">> ""Society""? We're talking about a vote in the state of California.  No, society as a whole.  >> At his point, you are arguing against reason.  No, you're just an irrational person.  >> I agree with you that secession would be terrible.  A) at no point did I talk about how bad it would be.  B) I am discussing the legality of it, nothing more.    ","False","0","politics","pizzashill","1","t3_5qqsjt","0","null","null","1486534418","t5_2cneq"
"null","1485711329","False","dd29hnq","t1_dd28y0f",">> The reason the North felt justified to do something clearly illegal -- forcefully preventing the peaceful secession of the Southern states -- was that slavery is inconsistent with liberal government. Without that, the Civil War was actually illegal.   Are you just not understanding what I'm saying to you? The supreme court has constantly ruled that the union can't be split up.  >> Of course the courts within the Constitutional system will find no legal basis for secession. The Brits made the same argument. That's why sometimes a society must assert its rights.  Ok, I'm done here, you seem to not understand that this country is under the constitution  and not the declaration of independence.  >> Do not call me an irrational person. There are rules of conduct on reddit. You are making irrational arguments, and you think that I am. That is called debate. According to Fox News, disagreement is no longer tolerable within the Republican party, but Democrats still enjoy the freedom to debate.  This is not a debate, it's you trying to reject objective reality and thinking the constitution isn't supreme.  Like I said, it is not legal for satates to leave the union. No matter how hard you kick, no matter how loud you scream, no matter how much you cry it is not legal for a state to leave the union.  **It is not legal to leave the union, and it never will be.** And if by some miracle the state did vote to leave, the federal government would go to war with that state.","False","0","politics","pizzashill","1","t3_5qqsjt","0","null","null","1486535454","t5_2cneq"
"null","1485711531","False","dd29n8t","t1_dd29l7r","No, it's not, according to the supreme court, the people that have the authority to decide these things.","False","0","politics","pizzashill","1","t3_5qqsjt","0","null","null","1486535528","t5_2cneq"
"null","1485713555","False","dd2b6mw","t1_dd2a3st","Last I checked, the founding fathers were big fans of liberty, and they gave the supreme court the authority to decide these things.","False","0","politics","pizzashill","1","t3_5qqsjt","0","null","null","1486536268","t5_2cneq"
"null","1485713655","False","dd2b9bf","t1_dd2b612","The one thing we didn't want to do was turn this into a religious war.  Trump is going to make everything worse. ","False","0","politics","pizzashill","1","t3_5qv445","0","null","null","1486536304","t5_2cneq"
"null","1485714455","False","dd2bva7","t1_dd2btnd","Are you trying to claim the founding fathers didn't give the supreme court the authority to rule on these things?  Do tell, how do you think the supreme court came into being?","False","0","politics","pizzashill","1","t3_5qqsjt","0","null","null","1486536596","t5_2cneq"
"null","1485715223","False","dd2cfvf","t1_dd2c5tn"," I'm guessing you don't?   A) The supreme court got that authority from the founding fathers, because they got the authority to do that from the constitution.  B) The founders clearly intended for it, if you read.  https://en.wikipedia.org/wiki/Marbury_v._Madison#Status_of_the_judicial_power_before_Marbury  >> At the Constitutional Convention in 1787, there were a number of references to judicial review. Fifteen delegates made statements about the power of the federal courts to review the constitutionality of laws, with all but two of them supporting the idea.[17]  >> Likewise, at the state ratifying conventions, over two dozen delegates in at least seven states indicated that under the Constitution, the federal courts would have the power to declare statutes unconstitutional.[18] Professors Saikrishna Prakash and John Yoo point out, with respect to the ratification of the Constitution, that ""no scholar to date has identified even one participant in the ratification fight who argued that the Constitution did not authorize judicial review of Federal statutes. This silence in the face of the numerous comments on the other side is revealing.""[19]  >> The concept of judicial review was discussed in The Federalist Papers. Alexander Hamilton asserted in Federalist No. 78 that under the Constitution, the federal courts would have not just the power, but the duty, to examine the constitutionality of statutes:  >> **The courts were designed to be an intermediate body between the people and the legislature, in order, among other things, to keep the latter within the limits assigned to their authority. The interpretation of the laws is the proper and peculiar province of the courts. A constitution is, in fact, and must be regarded by the judges as, a fundamental law. It, therefore, belongs to them to ascertain its meaning, as well as the meaning of any particular act proceeding from the legislative body. If there should happen to be an irreconcilable variance between the two, that which has the superior obligation and validity ought, of course, to be preferred; or, in other words, the Constitution ought to be preferred to the statute, the intention of the people to the intention of their agents.**","False","0","politics","pizzashill","1","t3_5qqsjt","0","null","null","1486536870","t5_2cneq"
"null","1485717819","False","dd2eezv","t3_5qviz9","They always do this shit.  They're doing it to test him, he'll probably fail the test.  Those missiles could hit the US from anywhere in China.","False","0","politics","pizzashill","6","t3_5qviz9","0","null","null","1486537818","t5_2cneq"
"null","1485717976","False","dd2ejaw","t1_dd2efrp","This is just a waste of time, I'm confident that I've dismantled you here, we'll let the crowd decide.","False","0","politics","pizzashill","1","t3_5qqsjt","0","null","null","1486537874","t5_2cneq"
"null","1485722140","False","dd2hqgp","t1_dd2hog4","I'd like to see more countries banning Americans.","False","0","politics","pizzashill","1","t3_5qvv4b","0","null","null","1486539406","t5_2cneq"
"null","1485722983","False","dd2idd0","t1_dd2h24v","This article is pretty bad. It's operating on a lot of flawed assumptions with conflicting evidence.  >> Formal equality is about equal opportunities to participate, and to make the choices that affect your life. Real equality is about equal distribution of participation, resources, power and responsibilities.  Right here? This is absurd, it seems to think that men and women are exactly the same in every way and if something isn't 50-50 it's because of sexism.  We know for a fact there are biological differences between men and women that aren't simply the result of how we socialize boys and girls.  For example, we know baby boys are more interested in mechanical objects than baby girls are.   http://www.math.kth.se/matstat/gru/godis/sex.pdf  Here's a study on that. Equality of opportunity is what we need to aim for, and we absolutely have equality of opportunity. This is one of the major beefs I have with modern 3rd wave feminism, they seem to think they can just throw out biology and assume there are no differences between males and females, that's just.. absurd.  >> Culture and tradition are important to Norwegian women. Traditional activities such as knitting, sewing, crocheting, cooking, are building blocks of our identity. We pride ourselves in practicing and perpetuating the traditions that belong to the homemaker. ""Rose"" blogs have thousands of followers in Norway, mainly among the younger generation. Most Norwegian women value these aspects of life in line with our professional life.  Oh no, we can't have people doing what they enjoy, we can't have that at all! Seriously, does this person think women are oppressed in Norway or something? The author is literally angry because people are doing things they value, because those things don't fall in line with his/her worldview.  >> Fathers are allotted 10 weeks of parental leave. This is to strengthen the fathers' relationships with their children and to signal the need for fathers to participate in childcare -- 68 per cent of fathers take their full quota or more. Women take the most the parental leave; the full period is 49 weeks with full pay. For many women, the stay at home is longer. The government offers a cash-for-care benefit to parents who decline public day care facilities until the child is two years old. More women choose this route. In 2011, 84 per cent of those receiving the benefit were women (Ellingsæter 2012). This means that some women have been out of the workforce for 2 years, while men have only been out for 10 weeks.   Holy shit, again, what is wrong with this person? The country gives them an absurd amount of leave, while they're being paid, and offers free child care to them. **Women are making the choice to stay at home longer, this system is beyond generous.**  So we see the author again, complaining that women are making choices he/she doesn't like. Even when women are offered free child care, 49 weeks of leave with pay, they still find a way to complain.  >> The entry of women into positions of power and decision-making in society is important for the development of a democratic and egalitarian society. Most political parties have introduced gender quotas. In the 2013 national election, women gained 39.6 per cent of the seats in the parliament. In local government, women occupy about one third of the seats. Women's labour market participation in Norway is among the highest in Europe. However, women still earn 86 per cent of a man's wage. Women make up 71 percent of the public sector and 34 per cent of women work part-time, compared to 14 percent men. Despite working part-time, the share of women working outside regular hours has gradually decreased in the last seven years. Work hours are upheld and respected; most employees can, if they choose to, leave their work place at 4 o'clock sharp. This makes it possible for mothers and fathers to pick up children in kindergartens and attend their needs for activities and other support in the afternoon.   And yet again, we see this person trying to paint something good as a negative. Complaining because women aren't making the choices he/she likes. A bonus wage gap myth being thrown in there too.  Women make less because they overwhelmingly go into lower paying fields and work less hours, they aren't literally being paid less for the same work. And again, as seen above, Norway offers them free child care and leave with pay, they have no excuse here, they could easily go back to work if they wanted. Does it not occur to this person that maybe men and women are just different?   >> Gender equality and the welfare state are mutually inclusive -- the welfare state is a precondition for gender equality and gender equality is necessary to develop and maintain the welfare state. Yet, Norway continues to face challenges to achieve ""real"" gender equality.   No, they've achieved equality, that equality just doesn't line up with your trash view that everything has to be 50-50 and men are women are the exact same.  I had to stop reading here, this person is delusional. Here's a good doc on gender equality in Norway:   https://www.youtube.com/watch?v=p5LRdW8xw70  Funny how even in the most equal countries on the planet with beyond generous systems in place feminists still find a way to cry oppression.  ","False","0","politics","pizzashill","0","t3_5qvsy2","1","null","null","1486539710","t5_2cneq"
"null","1485723468","False","dd2iqtl","t1_dd2ip65","You know Sarah Palin is like 3 IQ points above disabled, right?  If you find yourself agreeing with Sarah Palin, it's time to take a step back.","False","0","politics","pizzashill","16","t3_5qw26v","0","null","null","1486539890","t5_2cneq"
"null","1485724027","False","dd2j6hc","t1_dd2ivxl","The ""left"" isn't a monolith and I don't subscribe to blind political dogma.  Calling Palin disabled might be an insult to actual disabled people which are probably more intelligent than she is.","False","0","politics","pizzashill","13","t3_5qw26v","0","null","null","1486540099","t5_2cneq"
"null","1485725218","False","dd2k3wa","t1_dd2k1me","pretty sure she is.","False","0","politics","pizzashill","0","t3_5qw8v2","0","null","null","1486540544","t5_2cneq"
"null","1485726238","False","dd2kwto","t1_dd2jv38","I'm not so sure about this.  Every flipped Trump voter I know is enraged at him. They thought he wasn't being serious, they know he can't be defended now.  They're just really stupid people that didn't take Trump literally. Once the trade wars kick in and Americans are being banned from other countries and they feel themselves losing money, they'll be looking for a way to punish the GOP.","False","0","politics","pizzashill","27","t3_5qw0qn","0","null","null","1486540932","t5_2cneq"
"null","1485726412","False","dd2l1tl","t1_dd2l05b","Not talking about NY.  I have friends/family in Florida and the rust belt, Ohio mainly.","False","0","politics","pizzashill","8","t3_5qw0qn","0","null","null","1486540999","t5_2cneq"
"null","1485726528","False","dd2l551","t1_dd2kysa","You realize there were protests in many countries over Trump, right?  The world thinks Trump is a dangerous moron. Nobody likes him other than Russia, north Korea, and his delusional base.  PS: These safe zones are the same exact thing Clinton pushed and you guys accused her of trying to start WW3.","False","0","politics","pizzashill","6","t3_5qwdod","0","null","null","1486541043","t5_2cneq"
"null","1485726897","False","dd2lfyh","t1_dd2l9yr","I like how you guys keep trying to lie by claiming Obamas ban was anywhere near what Trump's was.  Obama suspended new visas for 6 months, but they could still apply.  Trumps banned people that are already legal residents with green cards and visas.  Do you see why this Obama argument is a false equivalency? You understand this person is going to do insane damage to our country, right?  He's going to push our allies away, screw our economy, and make us an international laughing stock.","False","0","politics","pizzashill","13","t3_5qwdwr","0","null","null","1486541186","t5_2cneq"
"null","1485727030","False","dd2ljv8","t1_dd2lia2","Not even a bad idea, it was going to be used to stop the flow of refugees, everyone was going to be on board with it.  There was never going to be any ""wars.""  Safe zones are a good solution to the refugee crisis. Sadly, Trumps base doesn't understand geopolitics on even a basic level.","False","0","politics","pizzashill","2","t3_5qwdod","0","null","null","1486541238","t5_2cneq"
"null","1485727547","False","dd2lyir","t1_dd2lwcg","I like how you didn't refute my argument.  >> Obama completely stopped processing refugees from Iraq for six months. Yeah, sure they could apply for visas, but they weren't getting any.  Yes, this is what I said.  >> It's the exact same thing Trump is doing. That's what makes his executive order so genius.  No, it's not. He banned people from entering the country, even legal residents with green cards/visas. That is what he did, this is nothing like the Obama ban.  You're just wrong, stop embarrassing yourself.  >> No answer though on how Mexico is going to protect illegal aliens in America.  Because I don't give a shit about Mexico, I'm calling out your blatant lie about the Obama policy, and I explained to you why they're different.  ","False","0","politics","pizzashill","14","t3_5qwdwr","0","null","null","1486541433","t5_2cneq"
"null","1485728407","False","dd2mmi8","t1_dd2miin",">> I like how your argument in the face of facts is  No, I actually explained to you in detail why you were wrong, you don't seem to be able to grasp it.   >> I'm not sure why I'm providing you with Trump's tactics for making the Democrat party destroy itself. I guess it's because you've checked out a while ago and won't believe any facts that don't conform to your worldview.  - Obamas ban applied to **new** immigrants from Iraq.  - Trump's base bans everyone, including legal residents with green cards.  You understand these 2 are not the same thing, correct?    >> Either way, it will be decades before Democrats regain any political power.  Yeah, that's what they always say. Yet the government always swings back and forth. Trump is going to end up killing the republican party with his joke of an admin. ","False","0","politics","pizzashill","8","t3_5qwdwr","0","null","null","1486541754","t5_2cneq"
"null","1485729689","1485729869","dd2nmcs","t1_dd2ne4k",">> those countries are the armpit of the world that breed more extremists than any others. nobody has a ""right"" to come to america. get off your high horse.  Lmao, keep trying to lie about what the ban did.  PS: The science denying GOP is a bigger threat to this country than any refugee is.   >> the green card holders didn't get banned. stop spreading bullshit. they're temporarily inconvenienced to get vetted before being admitted back.   You realize this is a lie, right? Multiple people with green cards were turned back.  http://www.reuters.com/article/us-usa-trump-immigration-administration-idUSKBN15C0R4?il=0  >> **U.S. green card holders from Syria and six other Muslim-majority countries traveling outside the United States need to check with a U.S. consulate to see whether they can return, senior U.S. administration officials said on Saturday.**   >> **New restrictions on immigrants and refugees in an executive order signed by President Donald Trump will mean legal permanent residents who have passports from the seven countries have to be cleared back into the United States on a case-by-case basis, an official told reporters in a briefing.**  Federal judges had to stop it and allow people with visas to stay.  http://www.foxnews.com/us/2017/01/29/federal-judge-grants-stay-to-allow-those-with-visas-to-remain.html    >> o i support them being treated like that? no. but they're not being ""banned"". i once held a green card too, so trust me, i know the bullshit bureaucratic processes at hand.  Except you're wrong, the airports were literally turning people back that had visas and green cards, and the Trump admin said it was intended.  http://www.cnn.com/2017/01/28/politics/donald-trump-travel-ban/  >> DHS arrived at the legal interpretation that the executive order restrictions applying to seven countries -- Iran, Iraq, Libya, Somalia, Syria, Sudan and Yemen -- did not apply to people with lawful permanent residence, generally referred to as green card holders.  >> The White House overruled that guidance overnight, according to officials familiar with the rollout. That order came from the President's inner circle, led by Stephen Miller and Steve Bannon. Their decision held that, on a case by case basis, DHS could allow green card holders to enter the US.  >> There had been some debate whether green card holders should be even allowed to board international flights. It was decided by the Department of Homeland Security they could fly to the US and would be considered on a case-by-case basis after passing a secondary screening.   In the future, I suggest you avoid trying to lie.  ","False","0","politics","pizzashill","1","t3_5qtbdv","0","null","null","1486542231","t5_2cneq"
"null","1485729962","False","dd2nu8n","t3_5qwqdr","I wonder when republicans are gonna wake up and realize the US has always had one of the most extreme vetting processes in the world when it comes to refugees.  The wait was like 2 god damn years. It's amazing to me how misinformed Trumpers are.  ","False","0","politics","pizzashill","20","t3_5qwqdr","0","null","null","1486542337","t5_2cneq"
"null","1485730431","False","dd2o7jg","t1_dd2nw5j","I mean, if Trump wins another term this country needs to be walled off from the rest of the world.","False","0","politics","pizzashill","50","t3_5qwoqu","0","null","null","1486542513","t5_2cneq"
