"distinguished","created_utc","edited","id","parent_id","body","stickied","gilded","subreddit","author","score","link_id","controversiality","author_flair_css_class","author_flair_text","retrieved_on","subreddit_id"
"null","1485074881","False","dcqxf4b","t1_dcqxakm","http://www.tradepartnership.com/pdf_files/2002jobstudy.pdf  Here you go.","False","0","politics","pizzashill","1","t3_5pfr08","0","null","null","1486257518","t5_2cneq"
"null","1485074975","False","dcqxgcb","t3_5pg190","Nice, Trump doesn't understand missile defenses either.  Add another subject to the list he's clueless on.","False","0","politics","pizzashill","7","t3_5pg190","0","null","null","1486257536","t5_2cneq"
"null","1485075642","False","dcqxozw","t1_dcqxmfi",">> You seem to be forgetting that Clinton lost the election because she failed to connect with voters in key states that Sanders won. Sanders won in Wisconsin, Michigan, and Pennsylvania, states that are probably the most responsible for Hillary loosing the election. All the normally blue states like California, Minnesota, and most of New England would have gone blue again no matter what. What Bernie brought to the table was the ability to appeal to people that the DNC has struggled to court. People in the Midwest felt abandoned by DC and Sanders understood that. Unfortunately so did Trump. If the democratic party can't admit that they have a problem then we are in big trouble. Thankfully Ellison seems like he's got the right ideas.   This is just not true, Clinton lost because rural America is horribly uneducated and gullible. This wasn't Clinton ""not connecting"" with them, it was her not fluffing reality for them, it was her giving them real solutions and them not liking real solutions, them wanting to feel good.  You guys keep trying to downplay what this election was, this wasn't some election on economic anxiety, it was an election where one person promised to protect the rural snowflakes from the browns and they ate it up like Candy.  Clinton won voters worried about the economy, she lost on **immigration and terrorism.**  Both issues Sanders was weaker than her on.","False","0","politics","pizzashill","2","t3_5pfx1o","0","null","null","1486257652","t5_2cneq"
"null","1485076078","False","dcqxujt","t1_dcqxstt","I don't care about winning elections, I care about being right.  These people are dumb.  http://fivethirtyeight.com/features/education-not-income-predicted-who-would-vote-for-trump/  Turnout this year wasn't even that low, it was higher than average.","False","0","politics","pizzashill","3","t3_5pfx1o","0","null","null","1486257732","t5_2cneq"
"null","1485076106","False","dcqxuxb","t1_dcqxsjq",">> **they let you do it.**  What does this say?","False","0","politics","pizzashill","1","t3_5pf3v7","0","null","null","1486257738","t5_2cneq"
"null","1485076348","False","dcqxxz9","t1_dcqxws4","You seem to have a serious reading comp problem if that's what you got from that study.  It baffles my mind how people can just try to dismiss entire academic fields of study because it doesn't make them feel good.  About 50% of what we import = raw materials which are used to finish products in America, higher prices = those places go under.   ","False","0","politics","pizzashill","1","t3_5pfr08","0","null","null","1486257781","t5_2cneq"
"null","1485078428","False","dcqynkr","t1_dcqyf36","""way more popular""  ""lost by over 3 million votes.""","False","0","politics","pizzashill","6","t3_5pfx1o","0","null","null","1486258134","t5_2cneq"
"null","1485078549","False","dcqyp1n","t1_dcqyb7p",">> International Steel Group ultimately purchased LTV and other failing steel companies, and brought some of that production back on line, but it did not start resupplying the market in any significant manner until May 2002. So during the first quarter of the year steel producers began to push for higher prices and they had the market power of steel shortages to force through some price increases.6 In addition, a host of antidumping and countervailing duties went into effect at the end of 2001, raising steel costs. Antidumping and countervailing duties were imposed on imports of hot-rolled carbon steel flat products imported from 11 countries between September and December 2001, boosting costs – or eliminating foreign supply -- of this important product. Antidumping or countervailing duties were imposed on imports of stainless steel bar from five countries in March 2002 with the same consequences. These duties were imposed in addition to the steel tariffs. Ultimately unsuccessful investigations were launched against imports of oil country tubular goods and cold rolled carbon sheet, disrupting supplies and prices of these products during the course of the investigations.  >> **The steel supply shortage problem deepened because of uncertainty associated with the tariffs.** **Importers stopped ordering steel in January waiting to see what the President would decide.**  **Thus, product that would have been entering the market in March, April and May was absent. Import supply did not recover to the benefit of steel-consumers until September (and it has since fallen off again). Steel consumers scrambled to order steel from U.S. producers, many of whom would not or could not supply them with needed product, and spot prices for steel soared.7**  >> Domestic steel supplies were so tight that in May 2002 U.S. producers supplied over 90 percent of the market, when 80-85 percent is more typical.8  >> The results: shortages and very high prices, particularly last Summer and Fall. Steel transaction (spot) prices – more than half of major carbon and stainless steel producers purchase steel on the spot market9  -- began to accelerate in March, reaching a peak in July and August. According to price tracking data from Purchasing Magazine, hot-rolled sheet transaction prices were 81.8 percent higher in July 2002 than in January 2002; cold-rolled sheet prices were 69.4 percent higher, and hot-dipped galvanized prices 62.1 percent higher. These are key products, used to make products ranging from cars to lawn-mower blades. Increases in the prices of steel sold directly by steel manufacturers (the so-called “producer price index”) to their customers also showed strong increases over the period. In December 2002, the producer price index for hotrolled steel was 27 percent above the index recorded in December 2001, and the index for cold-rolled steel was 19 percent higher over the same period. 10 ","False","0","politics","pizzashill","1","t3_5pfr08","0","null","null","1486258153","t5_2cneq"
"null","1485079121","False","dcqyvjl","t1_dcqypuw",">> Your account is 15 days old and extremely dedicated. Litterally apt username.  ""facts conflict with what I believe, accuse the other person of being a shill.""  >> Anyway, that out of the way, yes. His popularity rating was much higher than Hillary and the vote count doesn't factor in all the people purged or 'accidentally' given provisional ballots when they did vote, or the draconian rules for voting overall in the dem system... or caucuses.   ""we lost horribly, the system must be rigged, because that's how **I FEEL.**""  ""People can't possibly disagree with me, it's all a scheme to oppress my views!!""","False","0","politics","pizzashill","5","t3_5pfx1o","0","null","null","1486258243","t5_2cneq"
"null","1485079440","False","dcqyz9n","t1_dcqyv43","Alright man, this is just nuts. Like I'm not trying to be rude, but you seem to not really understand trade, or why tariffs are bad, or why anything like that.  So let's ask this.  Do you understand how increased prices on raw materials could lead to the cost of production increasing?  Does that make sense to you?  Tariffs are a tax on the consumer, they are not a tax on the businesses. It's the consumer that ends up paying more.","False","0","politics","pizzashill","1","t3_5pfr08","0","null","null","1486258295","t5_2cneq"
"null","1485079574","False","dcqz0un","t3_5pg6jn","Anyone that supports this.  Can you copy paste which part of NAFTA is not fair?","False","0","politics","pizzashill","5","t3_5pg6jn","0","null","null","1486258317","t5_2cneq"
"null","1485080647","False","dcqzdcq","t1_dcqz9q3","Nothing in this is actually coherent.   I'm baffled as to what this person is even trying to say, she's also talking about job loss which seems sketchy as well.  It seems like you linked something from a long time ago, I can't see this being recent, for example, there are credible studies today:  https://www.aeaweb.org/articles?id=10.1257/jep.15.1.125  >> **We describe the main economic arguments posed for and against the North American Free Trade Agreement (NAFTA) during the U.S. policy debate. To evaluate these arguments, we analyze recent trade data and survey post-NAFTA studies. We find that both the U.S. and Mexico benefit from NAFTA, with much larger relative benefits for Mexico. NAFTA also has had little effect on the U.S. labor market. These results confirm the consensus opinion of economists at the time of the debate. Finally, studies find that trade creation greatly exceeds trade diversion in the region under NAFTA, especially in intermediate goods.**","False","0","politics","pizzashill","5","t3_5pg6jn","0","null","null","1486258487","t5_2cneq"
"null","1485081136","False","dcqziud","t1_dcqzg2c","I'm saying this seems old, and her views are against the consensus even then.  Was this like your misguided attempt some type of appeal to authority?  Wait a second, here we go.  https://en.wikipedia.org/wiki/Elaine_Bernard  >> Elaine Bernard is the executive director of the Labor and Worklife Program at Harvard Law School and a prominent member of the Democratic Socialists of America.[1] She is also a member of the interim consultative committee of the International Organization for a Participatory Society[2] which she describes as offering ""an opportunity to reach across borders, time zones, organizations, communities, and individual interests and grow solidarity  I don't even think this person is an economist.","False","0","politics","pizzashill","8","t3_5pg6jn","0","null","null","1486258561","t5_2cneq"
"null","1485081371","False","dcqzli2","t1_dcqzkw8","She's not an economist dude, I looked her up, I don't know what the hell she is.  Her opinions on NAFTA are worthless to me.  I'm not asking you to point out what this crazy thinks of NAFTA, I'm asking you to point out which parts of NAFTA are bad, and then provide an actual economic argument against them.  ","False","0","politics","pizzashill","5","t3_5pg6jn","0","null","null","1486258597","t5_2cneq"
"null","1485081661","False","dcqzoui","t1_dcqzo9o","Uh, if you're going to use one, you might want to at least use an economist, a person that's an expert on the subject.  This person isn't, she seems to be some weird union crazy that misses the point of free trade in the first place.  An appeal to authority isn't a fallacy if the thing you're appealing to is an actual expert.  http://www.nizkor.org/features/fallacies/appeal-to-authority.html  >> This fallacy is committed when the person in question is not a legitimate authority on the subject. More formally, if person A is not qualified to make reliable claims in subject S, then the argument will be fallacious.","False","0","politics","pizzashill","7","t3_5pg6jn","0","null","null","1486258641","t5_2cneq"
"null","1485081808","False","dcqzqii","t1_dcqzq35","No, I read it again, I understood what she was saying, it was just.. weird.  She isn't making economic arguments, she's making union arguments, she seems to miss the point of free trade.","False","0","politics","pizzashill","0","t3_5pg6jn","0","null","null","1486258664","t5_2cneq"
"null","1485081835","False","dcqzqul","t1_dcqzpp0","I'm saying she's wrong, she's trying to claim NAFTA was bad.","False","0","politics","pizzashill","6","t3_5pg6jn","0","null","null","1486258668","t5_2cneq"
"null","1485081946","False","dcqzs4a","t3_5pga9t","Eh, this is questionable, the US is flipping this right now, things are going to be made here, robots will just do the making.  http://bigstory.ap.org/article/265cd8fb02fb44a69cf0eaa2063e11d9/mexico-taking-us-factory-jobs-blame-robots-instead  >> But research shows that the automation of U.S. factories is a much bigger factor than foreign trade in the loss of factory jobs. A study at Ball State University's Center for Business and Economic Research last year found that trade accounted for just 13 percent of America's lost factory jobs. The vast majority of the lost jobs — 88 percent — were taken by robots and other homegrown factors that reduce factories' need for human labor.  >> ""We're making more with fewer people,"" says Howard Shatz, a senior economist at the Rand Corp. think tank. General Motors, for instance, now employs barely a third of the 600,000 workers it had in the 1970s. Yet it churns out more cars and trucks than ever. In a survey by the consulting firm Deloitte, global manufacturing executives predicted that that the United States — now No. 2 — will overtake China as the most competitive country in manufacturing by 2020. (Competitiveness is measured by such factors as costs, productivity and the protection of intellectual property.)  >> The Reshoring Initiative, a nonprofit that lobbies manufacturers to return jobs to the United States, says America was losing an average of 220,000 net jobs a year to other countries a decade ago. Now, the number being moved abroad is roughly offset by the number that are coming back or being created by foreign investment.  ","False","0","politics","pizzashill","2","t3_5pga9t","0","null","null","1486258686","t5_2cneq"
"null","1485082020","False","dcqzsxz","t1_dcqzs13","Clinton won the counties producing a majority of our economic output.","False","0","politics","pizzashill","1","t3_5paklw","0","null","null","1486258696","t5_2cneq"
"null","1485082136","False","dcqzu6z","t1_dcqzsuz","Her argument seems to be that US workers can't compete with Mexican workers in low end manufacturing.  Yeah, no shit, that's the point, this is comparative advantage.  The US needs to build what we're good at building, airplanes, computers, heavy machinery, etc.  I have no problem with unions, but when your defense of them becomes so rabid you want to just throw free trade out of the window it's absurd.  The US is already flipping this anyway.  http://bigstory.ap.org/article/265cd8fb02fb44a69cf0eaa2063e11d9/mexico-taking-us-factory-jobs-blame-robots-instead  >> But research shows that the automation of U.S. factories is a much bigger factor than foreign trade in the loss of factory jobs. A study at Ball State University's Center for Business and Economic Research last year found that trade accounted for just 13 percent of America's lost factory jobs. The vast majority of the lost jobs — 88 percent — were taken by robots and other homegrown factors that reduce factories' need for human labor. ""We're making more with fewer people,"" says Howard Shatz, a senior economist at the Rand Corp. think tank. General Motors, for instance, now employs barely a third of the 600,000 workers it had in the 1970s. Yet it churns out more cars and trucks than ever.  >> In a survey by the consulting firm Deloitte, global manufacturing executives predicted that that the United States — now No. 2 — will overtake China as the most competitive country in manufacturing by 2020. (Competitiveness is measured by such factors as costs, productivity and the protection of intellectual property.) The Reshoring Initiative, a nonprofit that lobbies manufacturers to return jobs to the United States, says America was losing an average of 220,000 net jobs a year to other countries a decade ago. Now, the number being moved abroad is roughly offset by the number that are coming back or being created by foreign investment.","False","0","politics","pizzashill","0","t3_5pg6jn","0","null","null","1486258712","t5_2cneq"
"null","1485082484","False","dcqzy54","t1_dcqzvwu","But she isn't looking at the whole picture, she isn't looking at **workers** she's looking at a subset of **workers** which is low end manufacturing.  Sure, we might lose low end manufacturing, but what about the other sectors that are benefit?  Why exactly are those sectors less valuable than low end manufacturing?  There are winners and losers, free trade creates way more winners than losers, and yes, that applies to everyone in the country.  http://www.igmchicago.org/igm-economic-experts-panel/poll-results?SurveyID=SV_25byqjBle85jqy9  http://www.igmchicago.org/igm-economic-experts-panel/poll-results?SurveyID=SV_a3jxYtWKoF4vSKx","False","0","politics","pizzashill","0","t3_5pg6jn","0","null","null","1486258767","t5_2cneq"
"null","1485082630","False","dcqzzqg","t1_dcqzwbt","There's a huge difference.  US aircraft carriers are a huge deal for disaster relief, if there's a disaster somewhere you can bet a carrier group will show up if required.  No country on the planet has the ability to respond like the US does, anywhere on the globe.","False","0","politics","pizzashill","0","t3_5pgdlk","1","null","null","1486258788","t5_2cneq"
"null","1485082670","False","dcr005t","t1_dcqzzmd","Not really sure why this is relevant, Clinton spent less than Obama did by a fairly large margin I believe.","False","0","politics","pizzashill","7","t3_5pfx1o","0","null","null","1486258794","t5_2cneq"
"null","1485082887","False","dcr02oa","t1_dcr01mo","Lmao what? Why do you guys try to throw these insane double standards out in relation to Clinton?  If she were **anyone else** you wouldn't be bringing that shit  up, it's like when Obama won everyone switched to U6 unemployment, a clear double standard.  If you applied those same metrics to Obama, he would have still outspent her by a ton.","False","0","politics","pizzashill","3","t3_5pfx1o","0","null","null","1486258827","t5_2cneq"
"null","1485083039","False","dcr04d8","t1_dcr027h","The US is actually going to pass China as the most competitive manufacturing economy around 2020.  This drum beating against China/trade deals makes no sense.","False","0","politics","pizzashill","0","t3_5pgdlk","0","null","null","1486258850","t5_2cneq"
"null","1485083174","False","dcr05vw","t3_5pgf3s","I'm not sure why people don't get how the GOP works.  The GOP base is mainly angry, isolated rural people in rural America.  This is how they dominate the house/state governments, the democrats might get 55% of the votes in a state government and the republicans will still hold a super majority.  If you want to beat them back you need to go after gerrymandering and improve the education system.  Education is like a vaccine against GOP policy.","False","0","politics","pizzashill","32","t3_5pgf3s","0","null","null","1486258871","t5_2cneq"
"null","1485083337","False","dcr07ph","t1_dcr05nx","I don't even like Clinton, but people seriously don't seem to understand the extent of the GOP smear against this woman.  She lies less than Trump, yet is still painted as the ""dishonest"" one, it isn't even close, Trump lied more on any given day than Clinton has in her entire political career.  Yet she was still called dishonest, not Trump.  Clinton flew around the world trying to bring single payer to this country, the GOP hated her, they tried to paint her as a communist for over 20 years, then in under a year they convince a bunch of progressives that she's a ""conservative.""  How is this logical? How can they accuse her of being a commie for 20 years, and then in 1 year flip it to conservative?  The list goes on, the absurd god damn smears the GOP has pulled on her are just nuts. Be it Benghazi or the email fiasco, just constant, multi year long investigations that turn up nothing.  For fucks sake they blamed her for being cheated on at one point **and it worked.**","False","0","politics","pizzashill","5","t3_5pfx1o","0","null","null","1486258896","t5_2cneq"
"null","1485083607","False","dcr0apz","t3_5pgf8k","Trump is easily the most economically illiterate person to ever win an election.  Either by choice, or not. You'd expect economics to be a subject he had some type of grasp on, but he just doesn't.","False","0","politics","pizzashill","6","t3_5pgf8k","0","null","null","1486258938","t5_2cneq"
"null","1485083810","False","dcr0cyt","t3_5pgg8q","Nice to see redstate trying to lie again.  Why do conservatives constantly try to claim they only did this to conservative groups, when they did it to both progressive and conservative groups?  https://en.wikipedia.org/wiki/IRS_targeting_controversy  Even so:  >> In January 2014, the FBI told Fox News that its investigation had found no evidence so far warranting the filing of federal criminal charges in connection with the scandal, as it had not found any evidence of ""enemy hunting"", and that the investigation continued. On October 23, 2015, the Justice Department declared that no criminal charges would be filed.   >> referenced words such as ""Tea Party"", ""Patriots"", or ""9/12 Project"", ""progressive,"" ""occupy,"" ""Israel,"" ""open source software,"" ""medical marijuana"" and ""occupied territory advocacy"" in the case file   ","False","0","politics","pizzashill","1","t3_5pgg8q","0","null","null","1486258970","t5_2cneq"
"null","1485084136","False","dcr0glj","t3_5pggfy","Can't wait until he causes real economic damage and next election he runs around with his slogan ""keep America great"" rejecting literal objective reality that he failed.  The first debate when he claims GDP growth is 9% and everyone says well it's actually 2% and he just says ""no it's 9%"" over and over again.  And then the Trumpers run to the internet and declare GDP growth is actually 9% but the jews are hiding it.","False","0","politics","pizzashill","25","t3_5pggfy","0","null","null","1486259019","t5_2cneq"
"null","1485085414","False","dcr0uos","t1_dcr0pma","Yeah, it's the liberals in their large, multi-ethnic cities, that contain cultures from all over the world living in safe spaces.  Not the rural conservatives in their isolated small counties that are 99% white and 99% conservative Christian.","False","0","politics","pizzashill","18","t3_5pgf3s","0","null","null","1486259214","t5_2cneq"
"null","1485085470","False","dcr0vdd","t3_5pgj2c","I'm beyond furious at the DNC for stoking anti-NAFTA bullshit for years man.  They opened this country up for an economically illiterate right wing demagogue.  It wasn't even the DNC, it was the god damn rust belt dems.  xenophobic right wing protectionism beats out inclusive left wing protectionism every time.   One panders to multiple aspects of regressive human nature and the other panders to 1.","False","0","politics","pizzashill","4","t3_5pgj2c","0","null","null","1486259223","t5_2cneq"
"null","1485085685","False","dcr0xv0","t1_dcr0tqa","The church knows what's up, one of the first things fascist dictators do is go after organized religion.  It's up there with education, the media, and art.","False","0","politics","pizzashill","81","t3_5pgii7","0","null","null","1486259258","t5_2cneq"
"null","1485086224","False","dcr147e","t3_5pgju5",">> POTUS explained why CIA was his first visit: because the dishonest media has made it seem like he was having a feud with the intelligence community  Honestly, this is getting absurd. He literally asked if this was nazi Germany and attacked them constantly.  Are there any Trump supporters here? Can you tell me how on earth this isn't setting off alarm bells for you?  That's 2 times in 1 day he accused the media of lying for reporting objective facts, how is this ok with you?  >> -- He boasted that “probably everybody in this room voted for me ... because we’re all on the same wavelength.”  LOL, what? But you just spent weeks attacking them.  >> -- ISIS is evil and must be eradicated off the face of the earth.  Ok? Did you think you needed to pander to the CIA about how bad ISIS is?  This is starting to sound a little like Emmanuel Goldstein, comrade.  >> -- He is very smart, and again pointed to his uncle the MIT professor. “Trust me, I’m like a smart person.”  Does Trump think citing his intelligent uncle as evidence of his own intelligence is a valid thing? I don't judge people based on who they know or they're related to, because that's stupid, and also a fallacy.  https://en.wikipedia.org/wiki/Association_fallacy  >> -- He claimed the media are lying about size of the inauguration crowd -- he believes it was about 1-1.5 million people, not 250,000.   Ok, so you also feel the need to try to lie to the CIA about your crowd sizes? Trump might actually be the most insecure person on the planet, if Russia leaked a dong pic, even a fake one, he'd kill himself.   ","False","0","politics","pizzashill","21","t3_5pgju5","0","null","null","1486259346","t5_2cneq"
"null","1485086347","False","dcr15ou","t1_dcr13o1","I mean, there is research showing protests are effective.  http://qje.oxfordjournals.org/content/128/4/1633  **non-violent protests.**","False","0","politics","pizzashill","3","t3_5pgf3s","0","null","null","1486259366","t5_2cneq"
"null","1485086613","False","dcr18nc","t1_dcr15op","This seems highly, highly questionable.  https://en.wikipedia.org/wiki/Political_party_strength_in_U.S._states  This poll seems to be outside of the norm.  I'd say thats obvious considering the DNC wins the popular vote constantly, and this:  https://www.brookings.edu/blog/the-avenue/2016/11/29/another-clinton-trump-divide-high-output-america-vs-low-output-america/    This graph alone shows the GOP is scattered in rural counties.","False","0","politics","pizzashill","5","t3_5pgf3s","0","null","null","1486259406","t5_2cneq"
