"distinguished","created_utc","edited","id","parent_id","body","stickied","gilded","subreddit","author","score","link_id","controversiality","author_flair_css_class","author_flair_text","retrieved_on","subreddit_id"
"null","1485514221","False","dcz13os","t1_dcy2bp6",">> I wasn't making that argument at all. I was claiming that as an egalitarian you should be a feminist. That was my argument. Don't claim that I don't understand your posts when you put no effort in trying to understand mine.  Again, modern feminism is not about equality, it is anti-egalitarian by nature.   >> This is really not a good argument. First, you are making these claims. You have not shown these are true. You are making the assumption that these claims are true (wrong domestic violence numbers, degree gap, and court gender disparity). Then, you are making the claim that feminism is not for equality because of these flawed assumptions that you are making. This is a very basic logical error.   Yikes, ok, let's do this.  http://www.aei.org/publication/stunning-college-degree-gap-women-have-earned-almost-10-million-more-college-degrees-than-men-since-1982/  https://www.aei.org/publication/women-earned-majority-of-doctoral-degrees-in-2014-for-6th-straight-year-and-outnumber-men-in-grad-school-136-to-100/  Degree gap.  http://cep.lse.ac.uk/pubs/download/dp1341.pdf  http://cee.lse.ac.uk/ceedps/ceedp133.pdf  http://people.terry.uga.edu/cornwl/research/cmvp.genderdiffs.pdf  Grading bias.  https://www.law.umich.edu/newsandinfo/features/Pages/starr_gender_disparities.aspx  court bias.   http://www.saveservices.org/2012/02/cdc-study-more-men-than-women-victims-of-partner-abuse/  Domestic violence numbers.   >> Could you list the name of the bill? Honestly you are being very vague. I cannot counter your arguments if they just consist of ""some feminist somewhere did something bad"".  http://floridapolitics.com/archives/206474-womens-rights-groups-host-statewide-media-conference-sb-668  It came with the premise of shared custody, just the premise. Feminists then claimed this would force children to stay with their abusive fathers (ignoring the fact women are just as likely if not more likely to be abusive.)  >> Why are you dismissing this as irrelevant? It's entirely reasonable to believe that feminists might be protesting this talk because of the individual giving it, not because of your claim that they are protesting discussions on male suicide. I'm asking this precisely because I suspect that might be the case.  This is called an ad hominem, the guy they protested though? not sexist.  They just irrationally hate anyone that challenges their dogma.   https://www.youtube.com/watch?v=iARHCxAMAO0   >> That's strange because there has been quite a significant feminist backlash against student-run courts. In fact, the ""Dear Colleague"" letter by the US government attempting to deal with the plague of sexual assault on college campuses has often been interpreted to imply that student-run courts are illegal. They have been most often used to suppress word of sexual assault in order to preserve the University's reputation. In what instances have you seen feminists defending these kinds of courts?  http://reason.com/archives/2013/12/17/guilty-until-proven-innocent  These kangaroo courts are a direct outcome of fabricated rape culture and misleading rape statistics.     >> Can you give an example of one? It would be interesting to see how are opinion on what satire is differs.  I'll literally just go to SRS right now and find an obvious joke they're screeching over.  >> ""Nothing says I Love You like a black guy holding a gun"" - Rich Evans Never change, Rich."" [+195] ""Hardest I laughed in the entire video"" [+29]    https://np.reddit.com/r/RedLetterMedia/comments/5qdtyd/the_nerd_crew_episode_2/dcyg3uj/  CLEAR joke.  Another one?  >> (""How do you subtly fuck with people?"") ""Insert my penis in themvery(sic) slowly""[+24]  https://np.reddit.com/r/AskReddit/comments/5q69um/how_do_you_subtly_fuck_with_people/dcwo8ix/  Another CLEAR god damn joke.   ","False","0","politics","pizzashill","1","t3_5q6b85","0","null","null","1486479311","t5_2cneq"
"null","1485514537","False","dcz177i","t1_dcy2aiq","We don't need to subsidize anything.  http://bigstory.ap.org/article/265cd8fb02fb44a69cf0eaa2063e11d9/mexico-taking-us-factory-jobs-blame-robots-instead  >> But research shows that the automation of U.S. factories is a much bigger factor than foreign trade in the loss of factory jobs. A study at Ball State University's Center for Business and Economic Research last year found that trade accounted for just 13 percent of America's lost factory jobs. The vast majority of the lost jobs — 88 percent — were taken by robots and other homegrown factors that reduce factories' need for human labor.  >> ""We're making more with fewer people,"" says Howard Shatz, a senior economist at the Rand Corp. think tank. General Motors, for instance, now employs barely a third of the 600,000 workers it had in the 1970s. Yet it churns out more cars and trucks than ever.  >> In a survey by the consulting firm Deloitte, global manufacturing executives predicted that that the United States — now No. 2 — will overtake China as the most competitive country in manufacturing by 2020. (Competitiveness is measured by such factors as costs, productivity and the protection of intellectual property.)  >> The Reshoring Initiative, a nonprofit that lobbies manufacturers to return jobs to the United States, says America was losing an average of 220,000 net jobs a year to other countries a decade ago. Now, the number being moved abroad is roughly offset by the number that are coming back or being created by foreign investment.","False","0","politics","pizzashill","1","t3_5q6qa9","0","null","null","1486479358","t5_2cneq"
"null","1485514627","False","dcz1896","t3_5qghev","Dude, if Obama EVER said he'd send the feds into, I don't know, Texas, the GOP would lose their shit.  They thought a training exercise was an Obama takeover of Texas. Seriously, conservatives are nothing but hypocritical loons.","False","0","politics","pizzashill","21","t3_5qghev","0","null","null","1486479372","t5_2cneq"
"null","1485514775","False","dcz19xo","t1_dcz13pt","Yeah we've dropped thousands of bombs on these people.  Do conservatives really think we just weren't bombing them until Mattis or something?","False","0","politics","pizzashill","8","t3_5qgbea","0","null","null","1486479395","t5_2cneq"
"null","1485514992","False","dcz1cc0","t1_dcz0th0","Guy literally speaks like he has a severe learning disability.  The way he repeats himself over and over again, his head is just empty.","False","0","politics","pizzashill","4","t3_5qgdyt","0","null","null","1486479426","t5_2cneq"
"null","1485515999","False","dcz1nr4","t3_5qgkuo",">> Based on national polling by a consortium of universities, a report by Mr. Richman said 6.4 percent of the estimated 20 million adult noncitizens in the U.S. voted in November. He extrapolated that that percentage would have added 834,381 net votes for Mrs. Clinton, who received about 2.8 million more votes than Mr. Trump.   Lmao, absolute bullshit.  There are like 5+ studies on this, they all disagree with the claim illegals are voting.","False","0","politics","pizzashill","56","t3_5qgkuo","0","null","null","1486479579","t5_2cneq"
"null","1485516684","False","dcz1vym","t1_dcz1u7j","Literally the direct opposite. The guy that did this study disagrees with the claims made in this article.  >> Like so much on this issue, this posting has taken on something of a life of its own, and I want to emphasize and clarify some points that seem to be generating confusion as echo chambers pick this up and re-post it. This post is not intended to make a specific claim on my part concerning how many non-citizens voted in 2016. It has a much narrower aim. My goal was to show that an extrapolation from my coauthored work on the 2008 election to the 2016 election did not support the arguments some seemed to be making that the entire popular vote margin for Clinton was due to illegal votes by non-citizens. In this post I do my own calculation of that extrapolation for the purpose of demonstrating that this extrapolation would not support that claim. There are a number of reasons why one should be cautious about extrapolating from the 2008 CCES data to 2016. Many things can and have changed over the course of eight years. For example, a number of states have made efforts to use matching of records to remove non-citizen registrants from voter rolls. For example, on this blog I have recently highlighted data from Virginia and North Carolina concerning such matching efforts. These non-citizens are no longer on voter rolls. There are other states that have been even more aggressive about the issue of attempting to verify that registered voters are citizens. Furthermore, although the evidence from our 2014 paper suggests that it is only partially effective, many states have moved to adopt tighter identification requirements. The 2008 estimate is inherently uncertain. It depends upon a number of assumptions including assumptions about the validity of the survey data. Our critics have made a variety of arguments and I encourage readers to evaluate those arguments along with our responses to them. In the absence of other data, arguably an extrapolation from the earlier (2008) numbers is the best one can do. But one should recognize that this is an extrapolation fraught with a great deal of uncertainty.","False","0","politics","pizzashill","35","t3_5qgkuo","0","null","null","1486479692","t5_2cneq"
"null","1485516763","False","dcz1wvr","t3_5qgmj2","http://abcnews.go.com/Politics/obamas-deportation-policy-numbers/story?id=41715661","False","0","politics","pizzashill","4","t3_5qgmj2","0","null","null","1486479704","t5_2cneq"
"null","1485517129","False","dcz21bw","t3_5qglor","I hope to god someone in one of these interviews baits him by pointing out how small his crowd was.","False","0","politics","pizzashill","193","t3_5qglor","0","null","null","1486479763","t5_2cneq"
"null","1485517429","False","dcz254v","t3_5qgnw0","You're absolutely right.  But voting for Donald Trump, and the views the people that did hold do in fact, = stupid.  It just so happens this is more common in people that have lower education levels.","False","0","politics","pizzashill","6","t3_5qgnw0","0","null","null","1486479814","t5_2cneq"
"null","1485517527","False","dcz26ei","t3_5qgnam","I mean, Trump's economic agenda would hurt his base pretty badly.  The border wall would screw a lot of businesses, the trade war with Mexico would hurt US farmers.  Trump's base is going to quickly learn that Trump's economic illiteracy hurts them.","False","0","politics","pizzashill","5","t3_5qgnam","0","null","null","1486479831","t5_2cneq"
"null","1485518077","False","dcz2dj7","t1_dcz2ajs","Not really an opinion though.  Vaccines do not cause autism.  Climate change is not a hoax.  Free trade is good.  These are all objective facts.","False","0","politics","pizzashill","3","t3_5qgnw0","0","null","null","1486479926","t5_2cneq"
"null","1485518921","False","dcz2oza","t1_dcz2j0v","What jobs?  http://bigstory.ap.org/article/265cd8fb02fb44a69cf0eaa2063e11d9/mexico-taking-us-factory-jobs-blame-robots-instead  >> But research shows that the automation of U.S. factories is a much bigger factor than foreign trade in the loss of factory jobs. A study at Ball State University's Center for Business and Economic Research last year found that trade accounted for just 13 percent of America's lost factory jobs. The vast majority of the lost jobs — 88 percent — were taken by robots and other homegrown factors that reduce factories' need for human labor.  >> ""We're making more with fewer people,"" says Howard Shatz, a senior economist at the Rand Corp. think tank. General Motors, for instance, now employs barely a third of the 600,000 workers it had in the 1970s. Yet it churns out more cars and trucks than ever.  >> In a survey by the consulting firm Deloitte, global manufacturing executives predicted that that the United States — now No. 2 — will overtake China as the most competitive country in manufacturing by 2020. (Competitiveness is measured by such factors as costs, productivity and the protection of intellectual property.)  >> The Reshoring Initiative, a nonprofit that lobbies manufacturers to return jobs to the United States, says America was losing an average of 220,000 net jobs a year to other countries a decade ago. Now, the number being moved abroad is roughly offset by the number that are coming back or being created by foreign investment.  http://www.igmchicago.org/surveys/100-day-plan  Shockingly enough, they're wrong if that's why they voted for him as well.","False","0","politics","pizzashill","1","t3_5qgnw0","0","null","null","1486480078","t5_2cneq"
"null","1485521176","False","dcz3n2q","t1_dcz3lvx"," I just linked you the author of the study you linked telling you that your argument, using his study, is bullshit.  Do you understand what I'm saying to you?  I need a yes or no answer to this question.","False","0","politics","pizzashill","2","t3_5qgkuo","0","null","null","1486480533","t5_2cneq"
"null","1485523585","False","dcz4uud","t3_5qh235","The wall would cost well over 20 billion dollars, lol.  If congress gives this guy 20-40 billion for a useless wall, they're a joke.  I'm guessing we're going to see a lot of businesses that need easy access to Mexico via rail are gonna be putting pressure on congress as well.  A 20% border tax on Mexico would trigger a trade war that hurts a lot of Americans, ones that probably voted for Trump.","False","0","politics","pizzashill","15","t3_5qh235","0","null","null","1486481117","t5_2cneq"
"null","1485524058","False","dcz54kj","t1_dcz506h","A 20% border tax **still** wouldn't even be Mexico paying for it.  The consumer pays that tax, not Mexico, the American consumer.","False","0","politics","pizzashill","12","t3_5qh235","0","null","null","1486481246","t5_2cneq"
"null","1485524133","False","dcz566h","t1_dcz54li","It doesn't. People don't realize just how much of a con man Trump is.  When he rebuilt that ice shit in NY ""under budget and on time"" it was because he just decided not to pay the contractors he hired.  The media decided to leave that little bit out. Trump basically got people to work for free to enrich himself.","False","0","politics","pizzashill","11","t3_5qh235","0","null","null","1486481267","t5_2cneq"
"null","1485524268","False","dcz594s","t1_dcz57vw","Yeah it's hilarious watching conservative Trumpers talk about the budget/debt constantly, it's so bad we can't afford a 100 million here and there for education, but billions of dollars for a trash wall is 100% ok.","False","0","politics","pizzashill","5","t3_5qh235","0","null","null","1486481306","t5_2cneq"
"null","1485524513","False","dcz5edq","t3_5qh4j4","Considering the vast majority of the population here doesn't understand trade on literally any level, I doubt anyone cares.","False","0","politics","pizzashill","2","t3_5qh4j4","0","null","null","1486481376","t5_2cneq"
"null","1485524632","False","dcz5gxy","t1_dcz4otp","https://en.wikipedia.org/wiki/Foundations_of_Geopolitics  >> Russia should use its special forces within the borders of the United States to fuel instability and separatism, for instance, provoke ""Afro-American racists"". Russia should ""introduce geopolitical disorder into internal American activity, encouraging all kinds of separatism and ethnic, social and racial conflicts, actively supporting all dissident movements – extremist, racist, and sectarian groups, thus destabilizing internal political processes in the U.S. It would also make sense simultaneously to support isolationist tendencies in American politics.""","False","0","politics","pizzashill","6","t3_5qh1fh","0","null","null","1486481410","t5_2cneq"
"null","1485524697","False","dcz5if3","t1_dcz51pr","This shouldn't be relevant.  1 vote should be 1 vote, no matter what. ","False","0","politics","pizzashill","10","t3_5qh1fh","0","null","null","1486481430","t5_2cneq"
"null","1485525361","False","dcz5x9v","t1_dcz5qh8","Uh, it isn't 1 state, it's the **majority of people** that should determine all elections.  You can't honestly think the electoral college is a good idea.  - It reduces turnout.  - It makes most states worthless, people running for office don't even show up to the biggest states in the country or most of the smaller one, they stick to a few swing states every election.  - The founders had intended for us to expand the size of the house as the population grew to give larger states power equal to their population in the house, they had wanted around 1 rep per 30-50k, but a more realistic number might be 1 per 100 thousand.  It's currently at 1 per 700 thousand, this gives small states an advantage in the senate, the house, and the white house.  That is just absurd. This is not democracy, this is a joke, outdated system that favors a minority of the country.","False","0","politics","pizzashill","13","t3_5qh1fh","0","null","null","1486481628","t5_2cneq"
"null","1485525932","False","dcz6a9j","t1_dcz64so","Yes, the majority of people should have the majority of political power.  That's what democracy is.  We don't even use the electoral college for what it was intended for, if we did, Trump wouldn't be president.","False","0","politics","pizzashill","6","t3_5qh1fh","0","null","null","1486481800","t5_2cneq"
"null","1485526272","False","dcz6iaj","t1_dcz6eka","It's **not** working as intended. The house was meant to expand with the population, it doesn't.  When this system was set up the majority of the country was rural, that isn't the case anymore.  https://www.nytimes.com/2016/11/21/upshot/as-american-as-apple-pie-the-rural-votes-disproportionate-slice-of-power.html  As the country became more urban, and rural people started voting like a minority group, the entire system went to shit.  Urban people can't even get bills passed that help them, rural America gets all of it. Big states are basically enslaved to a rural minority.","False","0","politics","pizzashill","10","t3_5qh1fh","0","null","null","1486481907","t5_2cneq"
"null","1485526817","False","dcz6vfq","t3_5qhbyi","Lmao, this country is a god damn joke. I'm baffled as to how we've made it to where we are.  ","False","0","politics","pizzashill","762","t3_5qhbyi","0","null","null","1486482083","t5_2cneq"
"null","1485528064","False","dcz7r2s","t1_dcz7q2e","A) No they didn't, that's you lying, please don't do that.  B) There are time lapses of the crowd that clearly show it was small.  C) There are numbers directly from the metro that show significantly less people showed up for Trump than Obama.","False","0","politics","pizzashill","8","t3_5qglor","0","null","null","1486482504","t5_2cneq"
"null","1485528131","False","dcz7sw5","t1_dcz7kc9","You understand that there is no logical, sane, rational way to ever conclude that Hillary Clinton was worse than Trump on any level, correct?  Not only that, I didn't even talk about Russia, but the college was intended to stop incompetent demagogues, it didn't, it no longer serves a purpose.","False","0","politics","pizzashill","6","t3_5qh1fh","0","null","null","1486482527","t5_2cneq"
"null","1485528375","False","dcz7zbb","t1_dcz7u2s",">> Do you really think having 6,360 house representatives would be working as intended?  Uh, 1 per 100-300 thousand would be fine. At 1 per 300 thousand you're looking at about 1 thousand members.  That's fine.  >> Urban? It didn't care about urbanism back then. Some states were bigger.  What?  The entire system is set up against this.  https://www.nytimes.com/2016/11/21/upshot/as-american-as-apple-pie-the-rural-votes-disproportionate-slice-of-power.html  >> Its wrong that urban areas aren't properly represented at state and federal levels  No, it's not wrong, actually.   https://www.nytimes.com/2016/11/21/upshot/as-american-as-apple-pie-the-rural-votes-disproportionate-slice-of-power.html   >> I'm genuinely curious: what is the rural ""minority"" imposing on the urban?   https://www.cambridge.org/core/journals/american-political-science-review/article/no-strength-in-numbers-the-failure-of-big-city-bills-in-american-state-legislatures-18802000/A4B778D9088BB12B72900356B375CA27  And even more:  >> **But even when you control for policy need, Dr. Lee’s research has found that a significant rural bias in resources persists. You can see it in Homeland Security funding that gave Wyoming, for example, seven times as much money per capita as New York after the Sept. 11 terrorist attacks. You can see it in Alaska’s proposed “bridge to nowhere.”**  >> **“In that case,” Dr. Ansolabehere said, “Alaska has so much disproportionate power in the negotiation over funds that in order for California to get some, Alaska gets a lot — to the point of not knowing what to spend the money on.”**  >> **These calculations also mean that populous states subsidize less populous ones, which receive more resources than the tax dollars they send to Washington.**","False","0","politics","pizzashill","8","t3_5qh1fh","0","null","null","1486482612","t5_2cneq"
"null","1485529414","False","dcz8rkx","t1_dcz8k19","You seem to think this guys data shows higher voter fraud numbers than other studies have found.  His data seems to be questionable from the very start, I have no idea how he's getting even 800k.  There are studies that have looked at over a billion votes and found less than 30, and those weren't even in person. This ""the illegals are voting"" meme doesn't even make sense on a basic level.    ","False","0","politics","pizzashill","1","t3_5qgkuo","0","null","null","1486482990","t5_2cneq"
"null","1485529781","False","dcz91yf","t1_dcz8s2q","These are infuriating.  They're literally attacking him for doing what he fking said he was going to do.  This is mind blowing, how can anyone be this dumb?","False","0","politics","pizzashill","48","t3_5qhbyi","0","null","null","1486483128","t5_2cneq"
"null","1485532343","False","dczb65v","t1_dcz9my7","The man claimed Climate change was a hoax, vaccines cause autism, and went on the Alex Jones show.  Do you have any idea how incompetent Donald Trump is?  What policy did Trump run on supported by empirical data?","False","0","politics","pizzashill","4","t3_5qh1fh","0","null","null","1486484145","t5_2cneq"
"null","1485532399","False","dczb7vx","t1_dcz9ezm","They can say the opposite, but facts aren't subjective.  Anyone that looks at the facts that both of them ran on would not come to the conclusion that Trump is better than Clinton.  Trump voters operate on their feelings, nothing more.","False","0","politics","pizzashill","1","t3_5qh1fh","0","null","null","1486484167","t5_2cneq"
"null","1485533044","False","dczbrfn","t1_dczbjyc","Serious question.  Do you think smart people think vaccines cause autism and climate change is a hoax?  Does this sound like how a smart person speaks?  >> Look, having nuclear—my uncle was a great professor and scientist and engineer, Dr. John Trump at MIT; good genes, very good genes, OK, very smart, the Wharton School of Finance, very good, very smart—you know, if you’re a conservative Republican, if I were a liberal, if, like, OK, if I ran as a liberal Democrat, they would say I'm one of the smartest people anywhere in the world—it’s true!—but when you're a conservative Republican they try—oh, do they do a number—that’s why I always start off: Went to Wharton, was a good student, went there, went there, did this, built a fortune—you know I have to give my like credentials all the time, because we’re a little disadvantaged—but you look at the nuclear deal, the thing that really bothers me—it would have been so easy, and it’s not as important as these lives are (nuclear is powerful; my uncle explained that to me many, many years ago, the power and that was 35 years ago; he would explain the power of what's going to happen and he was right—who would have thought?), but when you look at what's going on with the four prisoners—now it used to be three, now it’s four—but when it was three and even now, I would have said it's all in the messenger; fellas, and it is fellas because, you know, they don't, they haven’t figured that the women are smarter right now than the men, so, you know, it’s gonna take them about another 150 years—but the Persians are great negotiators, the Iranians are great negotiators, so, and they, they just killed, they just killed us.","False","0","politics","pizzashill","1","t3_5qh1fh","0","null","null","1486484429","t5_2cneq"
"null","1485534400","False","dczcy14","t1_dczbw77","Even if you count those people, it's the most peaceful era in human history.","False","0","politics","pizzashill","6","t3_5qf3lf","0","null","null","1486484996","t5_2cneq"
"null","1485535393","False","dczdtj1","t1_dczco87","It's actually even worse than most people think.  He was basically handed huge real estate deals for free by the NY state government because his father had a lot of influence.  ","False","0","politics","pizzashill","15","t3_5qhveo","0","null","null","1486485414","t5_2cneq"
