"distinguished","created_utc","edited","id","parent_id","body","stickied","gilded","subreddit","author","score","link_id","controversiality","author_flair_css_class","author_flair_text","retrieved_on","subreddit_id"
"null","1485187865","False","dcst326","t1_dcssz5p","Trump is straight up the most economically illiterate person to ever run for president.  And he got away with it because the general population is stupid and thinks rich = smart.  Rural America, thanks again, Bush was bad enough but now you've given us the most profoundly ignorant president in US history.  A second time.  ","False","0","politics","pizzashill","14","t3_5ppmkw","0","null","null","1486290612","t5_2cneq"
"null","1485188384","False","dcstj8h","t1_dcsthj7","There's nothing to negotiate in NAFTA dude, he's just a moron. Either that or he's just going to change some minor detail and declare it a good deal.  It's not like his base has the mental capacity to even understand when they're being lied to. ","False","0","politics","pizzashill","3","t3_5ppmkw","0","null","null","1486290827","t5_2cneq"
"null","1485189724","False","dcsupkd","t1_dcsri4f","Lol, you realize people are arrested for tweeting mean things in Europe, right?  The UK libel laws alone are cancer. I'd absolutely rather have US free speech than anything in Europe.","False","0","politics","pizzashill","3","t3_5podsc","0","null","null","1486291392","t5_2cneq"
"null","1485189770","False","dcsur24","t1_dcsuool","Uh, read the actual study.  ","False","0","politics","pizzashill","7","t3_5poxjt","0","null","null","1486291411","t5_2cneq"
"null","1485189945","False","dcsuwsl","t3_5ppup8","Look, you guys shouldn't be worried about Trump as president, he's going to cause damage, but it isn't the end of the world.  What you need to be worried about is the fact 60 million Americans looked at Trump, saw the things he said and said ""I think this person would be a good president.""  Trump is directly because of intellectual rot in rural America. And that's a much larger problem for us, moving forward.","False","0","politics","pizzashill","1","t3_5ppup8","0","null","null","1486291488","t5_2cneq"
"null","1485190158","False","dcsv3lk","t1_dcsv1u4","A border tax would cause economic damage, he isn't even allowed to throw up a border tax I don't think.  ","False","0","politics","pizzashill","1","t3_5ppmkw","0","null","null","1486291579","t5_2cneq"
"null","1485190235","False","dcsv615","t1_dcssgo5","Yeah, a country where you can get arrested and have your life ruined for disagreeing with a feminist on twitter is pretty sane.","False","0","politics","pizzashill","-3","t3_5podsc","0","null","null","1486291611","t5_2cneq"
"null","1485190258","False","dcsv6qq","t1_dcsv5r4","A tax at the border..  He seems to think he can tax imports to America.","False","0","politics","pizzashill","1","t3_5ppmkw","0","null","null","1486291621","t5_2cneq"
"null","1485190327","False","dcsv8wa","t1_dcsv7kr","imports, but they'd clearly fight back and do the same to us.","False","0","politics","pizzashill","1","t3_5ppmkw","0","null","null","1486291649","t5_2cneq"
"null","1485190895","False","dcsvr1n","t1_dcsvfxj","A death threat is different than tweeting mean things.  A death threat should probably be taken seriously, even more so against a political figure.  Freedom of speech in the US has limits, and they're reasonable. ","False","0","politics","pizzashill","3","t3_5podsc","0","null","null","1486291891","t5_2cneq"
"null","1485190982","False","dcsvtsz","t3_5pq0et","Wikileaks has one goal and one goal only.  to damage America, that's why they backed Trump during the election, to damage America.  It wasn't because they liked Trump, it's because he'd cause the most damage possible. Now they have to go after Trump to cause even more damage.  This is why I got a kick out of the Trumpers cheering WikiLeaks on, as if they were on the same side, they were in reality cheering for someone attacking their own country.","False","0","politics","pizzashill","2","t3_5pq0et","0","null","null","1486291928","t5_2cneq"
"null","1485191034","False","dcsvvg5","t1_dcsvsy1","This is just not true.  http://faculty.som.yale.edu/lorenzocaliendo/ETWENAFTA.pdf  Free trade benefits everyone here.  The income gains might be lopsided, but the consumer benefits, a lot. Poor people benefit too, being able to buy cheap goods.","False","0","politics","pizzashill","2","t3_5poxjt","0","null","null","1486291949","t5_2cneq"
"null","1485191174","False","dcsvzzj","t1_dcsvyei","I mean, I'd love to see your opinion on why the TPP is bad.","False","0","politics","pizzashill","1","t3_5pq13i","0","null","null","1486292011","t5_2cneq"
"null","1485191228","False","dcsw1qr","t1_dcsw0vs","Why not? The damage is already done.  Wikileaks is cancer.","False","0","politics","pizzashill","1","t3_5pq0et","0","null","null","1486292034","t5_2cneq"
"null","1485191742","False","dcswi4n","t1_dcswfda","Lmao, do you even understand the point of free trade? First we'll start with some facts here.  http://bigstory.ap.org/article/265cd8fb02fb44a69cf0eaa2063e11d9/mexico-taking-us-factory-jobs-blame-robots-instead  >> But research shows that the automation of U.S. factories is a much bigger factor than foreign trade in the loss of factory jobs. A study at Ball State University's Center for Business and Economic Research last year found that trade accounted for just 13 percent of America's lost factory jobs. The vast majority of the lost jobs — 88 percent — were taken by robots and other homegrown factors that reduce factories' need for human labor.  >> ""We're making more with fewer people,"" says Howard Shatz, a senior economist at the Rand Corp. think tank. General Motors, for instance, now employs barely a third of the 600,000 workers it had in the 1970s. Yet it churns out more cars and trucks than ever.  >> In a survey by the consulting firm Deloitte, global manufacturing executives predicted that that the United States — now No. 2 — will overtake China as the most competitive country in manufacturing by 2020. (Competitiveness is measured by such factors as costs, productivity and the protection of intellectual property.) The Reshoring Initiative, a nonprofit that lobbies manufacturers to return jobs to the United States, says America was losing an average of 220,000 net jobs a year to other countries a decade ago. Now, the number being moved abroad is roughly offset by the number that are coming back or being created by foreign investment.   Second, that's the point.  https://en.wikipedia.org/wiki/Comparative_advantage  The US is not a 3rd world country that needs to be building plastic toys and t-shirts.","False","0","politics","pizzashill","0","t3_5pq13i","0","null","null","1486292252","t5_2cneq"
"null","1485191759","False","dcswin9","t1_dcswd9f","That's uh... not how logic works.  All 3 of them are wrong, factually.","False","0","politics","pizzashill","1","t3_5pq13i","0","null","null","1486292259","t5_2cneq"
"null","1485191912","False","dcswnj6","t3_5pq3lg","This meme is getting stupid.  Being a woman doesn't give you a free pass to attack reproductive rights.  ","False","0","politics","pizzashill","5","t3_5pq3lg","0","null","null","1486292324","t5_2cneq"
"null","1485192106","False","dcswtqt","t1_dcswqqe","You seem to really just not understand this on even a basic level.  The jobs that leave are leaving because it's cheaper to do so.  This means cheaper goods for the US, a consumer based economy. The jobs that leave are leaving because it's more efficient to do them somewhere else.  That's good, that's what you want.  ","False","0","politics","pizzashill","1","t3_5pq13i","0","null","null","1486292406","t5_2cneq"
"null","1485192192","False","dcswwh7","t1_dcswujs","Do you understand that free trade benefits our country? Do you understand that cheap consumer goods = good for the US economy?  Do you understand that free trade benefits more sectors than it hurts?  Of course you don't, because you don't understand basic economics.","False","0","politics","pizzashill","2","t3_5pq13i","0","null","null","1486292443","t5_2cneq"
"null","1485192681","False","dcsxcfr","t1_dcsx6p3","How can you not grasp this?  Can you really not understand why cheaper consumer prices benefit the overwhelming majority?  So what happens when the overwhelming majority of working class people are forced to pay higher consumer prices in order to benefit a tiny minority of working class people?  https://www.mercatus.org/publication/benefits-free-trade-addressing-key-myths  Here.","False","0","politics","pizzashill","2","t3_5pq13i","0","null","null","1486292655","t5_2cneq"
"null","1485192898","False","dcsxjem","t1_dcsxi3v","https://www.mercatus.org/publication/benefits-free-trade-addressing-key-myths  Here you go, educate yourself.","False","0","politics","pizzashill","2","t3_5pq13i","0","null","null","1486292747","t5_2cneq"
"null","1485193284","False","dcsxw5b","t1_dcsxpoh","You seen the leaked shit about the EPA?  https://www.axios.com/axios-am-2207230091.html  >> Listed as initiatives to stop: ""Clean Air Act greenhouse gas regulations for new (NSPS) and existing (ESPS or the 'Clean Power' Plan) coal and natural gas power plants … [CAFE] Standards … Clean Water Section 404: Waters of the U.S. Rule (wetlands) … TMDL (Total Maximum Daily Load) for Chesapeake Bay.  >> ""Key opportunities"": ""Issue an executive order barring EPA from overruling federal/state regulatory/permit decisions unless in clear violation of established law.""  >> Changing the way the EPA uses science: **""Unless major reforms of the agency's use of science and economics are achieved, EPA will be able to return to its bad old ways as soon as an establishment administration takes office.""**   Unreal.","False","0","politics","pizzashill","10","t3_5pq8p9","0","null","null","1486292916","t5_2cneq"
"null","1485194258","False","dcsys3p","t1_dcsylz0","Literally just calling people names or being racist.","False","0","politics","pizzashill","2","t3_5podsc","0","null","null","1486293342","t5_2cneq"
"null","1485195262","False","dcszor6","t1_dcszlwq","  http://natoassociation.ca/some-myths-concerning-investor-state-dispute-settlement/  That isn't how it works.  All trade deals have these, they can't sue because something is going to hurt their profits, they can sue if they can prove your government unfairly targeted them over domestic companies.  For example  ""company can't use chemical Y, but our domestic companies can.""","False","0","politics","pizzashill","4","t3_5pq9q1","0","null","null","1486293777","t5_2cneq"
"null","1485195917","False","dct0acl","t1_dct08wn","http://www.independent.co.uk/news/uk/arrests-for-offensive-facebook-and-twitter-posts-soar-in-london-a7064246.html","False","0","politics","pizzashill","1","t3_5podsc","0","null","null","1486294064","t5_2cneq"
"null","1485197672","False","dct1wms","t3_5pqro2",">> Back during the campaign, Donald Trump’s defenders called us conservatives crazy for saying that **Trump was more comparable with Barack Obama, than with a defender honest American values.**   Lmao, and closed. Anyone this delusional has an empty head.","False","0","politics","pizzashill","29","t3_5pqro2","0","null","null","1486294840","t5_2cneq"
"null","1485197821","False","dct21f4","t1_dct1x3a","More like.. people that disagree with facts and economic fundamentals just aren't educated on the subject.  ","False","0","politics","pizzashill","1","t3_5pq9q1","0","null","null","1486294903","t5_2cneq"
"null","1485197901","False","dct240f","t1_dct22y6","Yeah, someone like this is exactly why Trump won, they'll never admit it but that's reality.","False","0","politics","pizzashill","9","t3_5pqro2","0","null","null","1486294938","t5_2cneq"
"null","1485198104","False","dct2ak6","t1_dct272j","http://i.imgur.com/25vg2JL.jpg","False","0","politics","pizzashill","343","t3_5pqtio","0","null","null","1486295026","t5_2cneq"
"null","1485198198","False","dct2dmx","t1_dct2akj","Bernie has literally no understanding of economics dude, he was nearly as bad as Trump.  You know that, right?  To give you an example of how clueless he is:  https://np.reddit.com/r/badeconomics/comments/3zlkax/sanders_on_tbtf/","False","0","politics","pizzashill","0","t3_5pq9q1","0","null","null","1486295067","t5_2cneq"
"null","1485199004","False","dct344h","t1_dct30np","Why do you guys keep trying to make it seem like facts and economic fundamentals are a ""Hillary"" or a ""Trump"" or a ""Bernie"" thing.  I voted for Sanders in the primary, the man is still economically illiterate. Most Berners are too, or they were just trying to defend Sanders.  I never tried to defend Sanders on the indefensible, that's something political zealots do.","False","0","politics","pizzashill","2","t3_5pq9q1","0","null","null","1486295419","t5_2cneq"
"null","1485199194","False","dct3agg","t3_5pqxjx","Fk off Stein, ran around swing states claiming Clinton was worse than Trump.  ","False","0","politics","pizzashill","21","t3_5pqxjx","0","null","null","1486295503","t5_2cneq"
"null","1485199571","False","dct3mpx","t1_dct3f8d","This is horseshit dude, consumer prices have absolutely stayed low here.  There is no country on this planet that has gained as much as the US from free trade.","False","0","politics","pizzashill","1","t3_5pq13i","0","null","null","1486295666","t5_2cneq"
"null","1485200362","False","dct4d6g","t3_5pr2vp","Really, and in 2152 will dumb feminist rags like this stop pushing the wage gap myth?","False","0","politics","pizzashill","-4","t3_5pr2vp","1","null","null","1486296017","t5_2cneq"
"null","1485201742","False","dct5npb","t1_dct5b8n","Alright man.  https://www.mercatus.org/publication/benefits-free-trade-addressing-key-myths","False","0","politics","pizzashill","0","t3_5pq13i","0","null","null","1486296636","t5_2cneq"
"null","1485202403","False","dct6a0r","t3_5prbna","The economically illiterate find common ground.  What a shocking turn of events.","False","0","politics","pizzashill","1","t3_5prbna","0","null","null","1486296933","t5_2cneq"
"null","1485203696","False","dct7gzk","t3_5prgcs","Trump literally tries to call them fake news for reporting objective facts.  Trump has declared war on reality, and anyone trying to defend him is every bit as much of a clown as he is.","False","0","politics","pizzashill","5","t3_5prgcs","0","null","null","1486297506","t5_2cneq"
"null","1485240508","False","dctzpyp","t1_dctlsje","Can you copy paste me ever being against the TPP?","False","0","politics","pizzashill","1","t3_5poxjt","0","null","null","1486311066","t5_2cneq"
"null","1485240548","False","dctzqmf","t1_dcti6p1","Except, you know, the general population benefits from free trade.","False","0","politics","pizzashill","1","t3_5poxjt","0","null","null","1486311075","t5_2cneq"
"null","1485240591","False","dctzrc2","t3_5puq68","The TPP has been dead for a while, but nice try.  The anti-fact campaign against it paid off.","False","0","politics","pizzashill","9","t3_5puq68","0","null","null","1486311085","t5_2cneq"
"null","1485241422","False","dcu04m7","t1_dcu03ak","The TPP died a while ago, it didn't have enough support, mainly because of an anti-fact campaign by economic illiterate Donald Trump and economic illiterate Bernie Sanders.  It would have never passed, no matter who won.","False","0","politics","pizzashill","9","t3_5puq68","0","null","null","1486311262","t5_2cneq"
"null","1485241562","False","dcu06ve","t1_dctzehw","Literally everything the US does is to benefit the US, you know that, right?  The vast majority of aid money we pay out is spent in the US.","False","0","politics","pizzashill","1","t3_5puna8","0","null","null","1486311292","t5_2cneq"
"null","1485243754","False","dcu12zk","t1_dcu0kbw","http://blogs.wsj.com/economics/2016/11/01/prominent-economists-including-eight-nobel-laureates-do-not-vote-for-donald-trump/  http://blogs.wsj.com/economics/2016/08/22/hillary-clinton-donald-trump-or-gary-johnson-u-s-business-economists-have-a-strong-preference/  http://blogs.wsj.com/economics/2016/08/25/what-former-white-house-economists-say-about-donald-trump-and-hillary-clinton/  Donald Trump is absolutely economically illiterate.","False","0","politics","pizzashill","5","t3_5puq68","0","null","null","1486311721","t5_2cneq"
"null","1485243990","False","dcu16bp","t1_dcu15g3",">> 3 blogposts, two by the same person  No, 3 groups of highly credible economists saying Trump is economically illiterate.  The author didn't write any of this, but nice try.  >> If you believe Trump is economically illiterate you are a fool.  Literally just gave you the most credible economists in the country telling you he's a clown.  So, do you think these Nobel laureate economists might understand economics?  Like this is why Trump is so dangerous, he has no idea what he's talking about but his dumb base thinks he does because they also don't know what they're talking about.","False","0","politics","pizzashill","4","t3_5puq68","0","null","null","1486311765","t5_2cneq"
"null","1485244884","False","dcu1im3","t3_5puyd0","Can't wait to watch Trump snatch defeat out of the jaws of victory.  http://bigstory.ap.org/article/265cd8fb02fb44a69cf0eaa2063e11d9/mexico-taking-us-factory-jobs-blame-robots-instead  >> But research shows that the automation of U.S. factories is a much bigger factor than foreign trade in the loss of factory jobs. A study at Ball State University's Center for Business and Economic Research last year found that trade accounted for just 13 percent of America's lost factory jobs. The vast majority of the lost jobs — 88 percent — were taken by robots and other homegrown factors that reduce factories' need for human labor.  >> ""We're making more with fewer people,"" says Howard Shatz, a senior economist at the Rand Corp. think tank. General Motors, for instance, now employs barely a third of the 600,000 workers it had in the 1970s. Yet it churns out more cars and trucks than ever.  >> In a survey by the consulting firm Deloitte, global manufacturing executives predicted that that the United States — now No. 2 — will overtake China as the most competitive country in manufacturing by 2020. (Competitiveness is measured by such factors as costs, productivity and the protection of intellectual property.) The Reshoring Initiative, a nonprofit that lobbies manufacturers to return jobs to the United States, says America was losing an average of 220,000 net jobs a year to other countries a decade ago. Now, the number being moved abroad is roughly offset by the number that are coming back or being created by foreign investment.","False","0","politics","pizzashill","1","t3_5puyd0","0","null","null","1486311929","t5_2cneq"
"null","1485245226","False","dcu1n9m","t3_5puzf2","Wow, you mean to tell me the man nearly every credible economist said was economically illiterate... is in fact economically illiterate?  This one says it all  >>	Strongly Disagree	9	 Where do I start? ","False","0","politics","pizzashill","8","t3_5puzf2","0","null","null","1486311991","t5_2cneq"
"null","1485245962","False","dcu1xbh","t1_dcu1jzr","http://blogs.wsj.com/economics/2016/11/01/prominent-economists-including-eight-nobel-laureates-do-not-vote-for-donald-trump/  http://blogs.wsj.com/economics/2016/08/22/hillary-clinton-donald-trump-or-gary-johnson-u-s-business-economists-have-a-strong-preference/  http://blogs.wsj.com/economics/2016/08/25/what-former-white-house-economists-say-about-donald-trump-and-hillary-clinton/  http://www.igmchicago.org/surveys/100-day-plan","False","0","politics","pizzashill","5","t3_5puvhy","0","null","null","1486312124","t5_2cneq"
"null","1485246643","False","dcu2635","t3_5pv0b0","If you look into this, the laws there are nuts.  For example, if a father spanks his son, he'd get like 2 years in prison or something.  But if a stranger did then he'd just get a fine I guess? I think this is more of them trying to fix crazy laws.","False","0","politics","pizzashill","0","t3_5pv0b0","0","null","null","1486312241","t5_2cneq"
"null","1485246794","False","dcu27yu","t1_dcu1uew","Except most manufacturing that comes back will be automated.  Rural America is going to have to accept the fact these jobs are just gone, and start trying to get an education to fill the ones we have.  There were like 300 thousand open manufacturing jobs last year, only 271 thousand were filled, people just don't have the skills.","False","0","politics","pizzashill","3","t3_5puyd0","0","null","null","1486312266","t5_2cneq"
"null","1485246965","False","dcu2a6w","t3_5pv1em","I like how old people just constantly try to screw over younger generations.  It's glorious.","False","0","politics","pizzashill","4","t3_5pv1em","0","null","null","1486312296","t5_2cneq"
"null","1485247801","False","dcu2ktk","t1_dcu2k31","Yes, that's my point, but Trump and his base seem to think the coal mines are coming back.","False","0","politics","pizzashill","2","t3_5puyd0","0","null","null","1486312437","t5_2cneq"
"null","1485249948","False","dcu3bda","t1_dcu34ux","Uh, I didn't say it was new, but old people, in both the UK and US have voted to screw the younger generations over, factually.","False","0","politics","pizzashill","3","t3_5pv1em","0","null","null","1486312792","t5_2cneq"
"null","1485250599","False","dcu3j15","t1_dcu3fsf",">> nah, that's just something you think becuase you are young and rebellious and naive.  No, that's what the empirical data says, actually. But I do like the fallacy:  https://www.logicallyfallacious.com/tools/lp/Bo/LogicalFallacies/50/Argument-from-Age  >> If we put your generation in charge, the world would fall apart in a week  So, you are aware that facts aren't subjective, correct?  >> you are easily duped at that age. That's why the constitution prohibits people your age from the presidency  I find it hilarious someone that voted for a climate denier that thinks vaccines cause autism that ran on a platform of economic illiteracy thinks it's the young people that got ""duped."" ","False","0","politics","pizzashill","3","t3_5pv1em","0","null","null","1486312894","t5_2cneq"
"null","1485251261","False","dcu3qvi","t1_dcu3n55",">> Do you think trump thinks vaccines cause ausism?  Trump has literally said this hundreds of times and also donated to an anti-vaxxer charity, as well as put an anti-vaxxer in charge of vaccine safety.  http://scienceblogs.com/insolence/2015/09/15/the-long-sordid-antivaccine-history-of-donald-trump/  http://www.usatoday.com/story/news/politics/onpolitics/2017/01/10/donald-trump-robert-kennedy-vaccines-autism/96391920/   >> yup, you got duped  Has Trump said vaccines cause autism many times over the years? Yes or no.  >> hmmmmm, I also thought reddit hated tpp? are you like the one reddit youth who likes tpp and nafta and were mad today when tpp got tossed?  I've always supported both of those things, because the empirical data supports both of them.   >> also, your logical fallacy is incorrectly applied, and thus null. Im not saying that ancients had some special knowledge, Im saying that you dont have life experience  You should brush up on your reading, maybe.  It applies to older people trying to call younger people naive, or saying older people ""know best"" as well. Example #2:  >> **My Grammy told me that to be healthy I should have bacon and eggs every morning for breakfast.**  >>  **It seems politically incorrect to suggest that older generations are not “wise,” but the fact is, wisdom is not necessarily a function of age.  We have two generations of scientific knowledge that our grandparents did not have, and the world has changed quite a bit in the last two generations.  While some advice may be timeless, other advice, such as the advice in the example, was based on the beliefs of the day and should be discarded like a container of chunky milk.**  Would you like me to slow down, is this too fast for you?","False","0","politics","pizzashill","4","t3_5pv1em","0","null","null","1486312999","t5_2cneq"
"null","1485252798","False","dcu48lk","t1_dcu42nv",">> Yeah? because TPP was never ratified, and was never in place. So you are simply lying about ""emperical data"". There is none because it was never in ratified. Again, youth like you often think you ""know"" more than you really do.  Uh, free trade has economic consensus, friend. You understand that, right?  I support free trade, so I support TPP, and the empirical data shows that free trade is good.  >> Again, the issue is that you do not know enough. Never said we ""know best"", only that you don't. And the constitution agrees. Its also why you are still likely not allowed to drink  How old do you think I am? again, you can keep spewing this fallacy all day, you aren't very informed, that's obvious by the fact you didn't know Trump was an anti-vaxxer.  >> the clearest indication that the young are politically naive is your voting record. The youth vote has ALWAYS showed out to vote poorly.  Yeah, which is why old, incompetent people often win elections. ","False","0","politics","pizzashill","1","t3_5pv1em","0","null","null","1486313235","t5_2cneq"
